Date,Tweet ID,Leader Name,Followers,Text,Hashtags
2022-10-14,1580878834269712385,Carlo Calenda,448452,"L’unico partito riformista è il nostro, la nostra federazione. E lo si vedrà con il lavoro che faremo da domani anche grazie al @PDE_EDP 
#EDPCongress https://t.co/6jNvmcHlcp",['EDPCongress']
2022-10-14,1580872408172568578,Carlo Calenda,448452,"Quando i populisti arrivano al governo iniziano a usare un linguaggio diverso, ma che nasconde un’impronta non pienamente democratica, incompatibile coi valori UE. Per questo ci impegneremo col @PDE_EDP per costruire un presidio di democrazia che fermi questa ondata di populismo. https://t.co/TXZ0hTKQUS",[]
2022-10-14,1580869617555079168,Carlo Calenda,448452,"Auspico che a partire dell’@PDE_EDP si costruisca una grande area capace di mettere insieme coloro che hanno:
- un riferimento europeo chiarissimo;
- intransigenza verso partiti post fascisti e qualunquisti di sinistra;
- l’idea che l’UE e gli USA formino un asse decisivo. https://t.co/uQCE6abLYR",[]
2022-10-14,1580859523795128321,Carlo Calenda,448452,"“RINNOVARE L’EUROPA: UN APPROCCIO DEMOCRATICO”

🔴 In diretta dal Congresso del @PDE_EDP a Roma.

Seguilo qui: https://t.co/OFZ24pSTxZ https://t.co/aeLP4kheoX",[]
2022-10-14,1580838716859650049,Carlo Calenda,448452,"Meloni contro Berlusconi. Berlusconi contro La Russa. Ronzulli contro Meloni. Salvini che gioca con i Ministri come con le figurine. Intanto aumentano il costo del debito, le bollette e i tassi. E il prossimo anno saremo in recessione. Tenersi #Draghi era un’idea così sbagliata?",['Draghi']
2022-10-14,1580797337638645760,Carlo Calenda,448452,Con 5 voti? La moltiplicazione dei pani e dei pesci. Suvvia. Cercate altrove. https://t.co/Y6iIaB4bWx,[]
2022-10-13,1580665249052884993,Carlo Calenda,448452,"Nel 2016 il saluto di Lorenzo Fontana per il congresso di Alba Dorata, partito neonazista greco dichiarato nel 2020 dalla corte d’appello di Atene “organizzazione a delinquere”. https://t.co/uI18C3XFY4",[]
2022-10-13,1580631397089234944,Carlo Calenda,448452,Fontana è un filo putiniano della prima ora; La Russa dichiarava solo poche settimane fa “siamo tutti eredi del Duce”. Sono entrambi del tutto inadatti a presiedere le istituzioni repubblicane. Iniziamo malissimo questa legislatura. Altro che conservatori europeisti. https://t.co/GFNf4NQ3rH,[]
2022-10-13,1580610191434821632,Carlo Calenda,448452,"C’è un solo responsabile della guerra ed è Putin. Occorre continuare a #sostenere l'Ucraina e gli #ucraini senza dubbi e ambiguità.
#sitin https://t.co/OI3jCKeY7O","['sostenere', 'ucraini', 'sitin']"
2022-10-13,1580556940295700480,Carlo Calenda,448452,Una coalizione di maggioranza appesa ai desideri personali di Licia Ronzulli non è in grado di governare l’Italia. Questo è il dato di fatto.,[]
2022-10-13,1580551538946121728,Carlo Calenda,448452,@GianniRosa0 Mostrava la sua capacità di bilocazione visto che in quel momento era anche a Roma alla riunione degli eletti. Pirla,[]
2022-10-13,1580544206078369793,Carlo Calenda,448452,Menzogne di un signore che ne ha fatto una ragione di vita. La Segre che vota Larussa? https://t.co/l7rM7L9CaG,[]
2022-10-13,1580543544569184257,Carlo Calenda,448452,"Si Enrico. La tua. Noi diciannove voti non li abbiamo. E siccome queste cose si vengono sempre a sapere alla fine, ti consiglio di cancellare questo tweet. Invecchierà male. https://t.co/HUg8mk3yph",[]
2022-10-13,1580540718942064641,Carlo Calenda,448452,"Non dico l’oggettività perché vi è sconosciuta, ma almeno la matematica. Sono 19 i voti arrivati a Larussa. Noi abbiamo un gruppo di nove persone e abbiamo votato scheda bianca. https://t.co/2gQ80DpPL2",[]
2022-10-13,1580530202546872322,Carlo Calenda,448452,Al di là dei numeri non esiste per noi liberali votare un nostalgico del fascismo. Fine. https://t.co/yC9zNqepJS,[]
2022-10-13,1580527154592616448,Carlo Calenda,448452,Sospetti tuoi Stefano. Noi abbiamo votato scheda bianca. https://t.co/YD4go7b3ud,[]
2022-10-13,1580512716539985920,Carlo Calenda,448452,"Forza Italia che non vota, Berlusconi si, però poi manda aff il candidato Presidente del Senato.
Se questo è il debutto siamo messi male. Forza Italia/Lega hanno come unico obiettivo il logoramento della Meloni. Le condizioni del paese dovrebbero suggerire maggiore serietà. https://t.co/pxaUYM8q00",[]
2022-10-13,1580492039099383810,Carlo Calenda,448452,"Un discorso straordinario della senatrice Segre apre la XIX legislatura, ricordando tutti i valori costituenti: 
Patriottismo Repubblicano, gravitas delle istituzioni, fondamenta antifasciste e democratiche della Repubblica. Bene che tutti abbiano applaudito senza distinzioni.",[]
2022-10-13,1580484637825978369,Carlo Calenda,448452,"Primo giorno in #Senato. 
L’emozione è stemperata dalla responsabilità di ricoprire un ruolo così importante per il Paese. 
Metterò tutto il mio impegno per esserne all’altezza. https://t.co/ttYesj80lM",['Senato']
2022-10-12,1580252564549140480,Carlo Calenda,448452,"Ora Segreteria Nazionale.
Analisi del voto e programmazione delle prossime attività.
Per @Azione_it e il #TerzoPolo non è che l'inizio. https://t.co/u1LcC6Ejy8",['TerzoPolo']
2022-10-12,1580151815273738240,Carlo Calenda,448452,Parteciperò al sit-in e invito tutti a mobilitarsi. Verità e pace. Non resa degli ucraini. @Azione_it https://t.co/6monUk5EeB,[]
2022-10-12,1580146646314356738,Carlo Calenda,448452,"Giorgia Meloni ha sempre criticato la presenza di tecnici al governo. E ora che li cerca, non li trova a causa di una maggioranza troppo divisa. https://t.co/ByUhu1E0Lu",[]
2022-10-12,1580127697438617600,Carlo Calenda,448452,"La politica deve essere prima di tutto concretezza del buon governo, la capacità di fare accadere le cose con il coraggio di dire dei sì e dei no. Per questo  i sindaci rappresentano un esempio di quella gestione e “messa a terra” che manca quasi sempre alla politica italiana. https://t.co/4nBFz9WdfL",[]
2022-10-12,1580112916438581248,Carlo Calenda,448452,"🔴 In diretta ora per parlare di PNRR ed Europa. Seguitemi!

Link: https://t.co/6d6iXCKuOr https://t.co/nRqIWx8DAU",[]
2022-10-12,1580090016700583936,Carlo Calenda,448452,Mi sembra che la destra sia preda della “sindrome Michetti”: ovvero la mancanza di una classe dirigente con solida esperienza di governo. E così al di là della capacità politica della Meloni rischia di farsi/ci molto male.,[]
2022-10-12,1580069467177963520,Carlo Calenda,448452,La possibilità di tenere una linea di politica internazionale coerente sul supporto all’Ucraina dipende in larga misura dal tetto nazionale alle bollette. Anche per questo occorre implementarlo immediatamente.,[]
2022-10-12,1580066453268869121,Carlo Calenda,448452,Il crollo della società Occidentale https://t.co/jCNJotaOOd,[]
2022-10-11,1579943885979389952,Carlo Calenda,448452,"A chi lo dici Luciano. Tutte le buffonate, gli attacchi, i servizi giornalistici farlocchi. E alla fine nessuno ricorda più nulla. Tutto si dimentica. Rimane la soddisfazione di aver partecipato al negoziato e averlo approvato https://t.co/6m2Wp9I4fw",[]
2022-10-11,1579899810890788864,Carlo Calenda,448452,@Ocirnide Grazie,[]
2022-10-11,1579884583746940929,Carlo Calenda,448452,"@Ocirnide Certo l’ho detto al Commesso quando mi ha fatto notare il pavimento del ritratto diverso da quello della curia. Peraltro avendo come riferimento la curia di Cesare e non la Curia Ostilia, che fu bruciata successivamente nelle sommosse che seguirono la morte di Clodio",[]
2022-10-11,1579884185439047680,Carlo Calenda,448452,"@ggbenedetto Caro Giacomo, non è così. Avevo già dichiarato dove mi sarei candidato. Emma, mi spiace dirlo, si è fatta strumentalizzare dal PD e ha fatto tutta la campagna contro di me",[]
2022-10-11,1579883910632464385,Carlo Calenda,448452,@antonio65142683 Discutibile. Basiamo questa ricostruzione sull’intervento di Cesare contro l’esecuzione sommaria dei congiurati. Ma non ci sono altri elementi. Clodio aveva disonorato Cesare in occasione della festa della Bona Dea,[]
2022-10-11,1579772841733820416,Carlo Calenda,448452,Prima tappa in Senato. Una grande emozione essere in sala Maccari di fronte al quadro che rappresenta l’intervento di Cicerone contro Catilina. https://t.co/PK5LzSshgI,[]
2022-10-11,1579751921765818368,Carlo Calenda,448452,"Questo signore delirante e bugiardo (non abbiamo chiesto di cancellare il RdC) è un ex magistrato eletto con i 5S, per fortuna. Rassicurante sapere che non sia più un magistrato. https://t.co/jxKIQ4DM8z",[]
2022-10-11,1579751327374405632,Carlo Calenda,448452,@ScionPen No. Ero e sono contro l’invio di armi a lunga gittata come i missili Atacms sui quali anche gli USA si stanno interrogando,[]
2022-10-11,1579751054337773569,Carlo Calenda,448452,@mastrodonato81 Eppure è un testo breve in italiano,[]
2022-10-11,1579731879464689665,Carlo Calenda,448452,Vero. Il punto è uno per misurare la veridicità degli intenti pacifisti: la questione del supporto all’Ucraina. Se chiedi la pace e voti contro l’invio di armi stai in realtà pretendendo la resa degli ucraini https://t.co/ZiFoq85wMd,[]
2022-10-11,1579730778766073858,Carlo Calenda,448452,"Il problema è che la leadership americana è debole e il sovranismo filo russo mascherato da isolazionismo è ben presente anche lì. Tocca a Francia, Germania, Spagna e Italia giocare questa partita in modo intelligente per fare dell’Europa il motore di questa nuova costruzione",[]
2022-10-11,1579729443563925505,Carlo Calenda,448452,Occorre riprendere il percorso interrotto da Trump per la costruzione di una rete commerciale delle democrazie e dei paesi amici e riportare una visione realista della politica estera per tenere vicini paesi chiave nel Golfo e nel mediterraneo e staccare l’India da Cina e Russia.,[]
2022-10-11,1579728861172203521,Carlo Calenda,448452,Se Cina e Russia vedranno che l’Occidente è molle e indeciso allora le loro azioni diventeranno più aggressive e i rischi di un conflitto globale aumenteranno. Purtroppo in tutto il mondo la destra è infiltrata da Cina e Russia. Basta vedere le astensioni all’ONU su Ucraina.,[]
2022-10-11,1579727548757311488,Carlo Calenda,448452,L’Ucraina è solo l’inizio di un confronto geopolitico molto duro con il blocco delle dittature. Si deve arrivare ad una coesistenza ma questa possibilità dipende da due fattori: 1) l’unità delle democrazie; 2) la capacità di mantenere una linea di politica estera nel tempo.,[]
2022-10-11,1579715924789452800,Carlo Calenda,448452,Paolo Scaroni è il maggior responsabile insieme a Berlusconi della nostra dipendenza dal gas Russo. Nominarlo Ministro dell’Energia equivarrebbe a metterci l’AD di Gazprom. Evitiamo. @GiorgiaMeloni,[]
2022-10-11,1579709062433734656,Carlo Calenda,448452,Abbiamo mandato al ⁦@pdnetwork⁩ il nostro piano su tetto alle bollette chiedendo di discuterlo insieme e da ⁦@EnricoLetta⁩ non è arrivata nessuna risposta. Idem sulle regionali. Non mi pare ci sia alcuna reale volontà di collaborare. Amen. https://t.co/VSluWMQ79g,[]
2022-10-11,1579707231490043909,Carlo Calenda,448452,Ma dai?! Ci sono voluti appena tre anni e mezzo. https://t.co/9MuEfWhsb5,[]
2022-10-10,1579531346115952648,Carlo Calenda,448452,"L'Italia non è e non diventerà la Polonia. Giorgia Meloni lo tenga a mente. E sappia che se sull'economia saremo responsabili, sulla tutela dei diritti non si discute. Nè oggi, nè in futuro. https://t.co/ZVXc4WAORw",[]
2022-10-10,1579511114077208576,Carlo Calenda,448452,"🔴 Oggi, alle ore 20:30, sarò ospite a @StaseraItalia su @rete_4. https://t.co/UPIAk8pTK6",[]
2022-10-10,1579503842550743041,Carlo Calenda,448452,"Ora in diretta sui canali di @repubblica. 

Link per seguirci: https://t.co/1uxsP0oK5A https://t.co/pz2ns12kjm",[]
2022-10-10,1579501211526778885,Carlo Calenda,448452,"A questo fiorire, da Conte a De Luca, di manifestazioni per la resa degli ucraini opporremo una grande iniziativa per il sostegno all’Ucraina. Invitiamo tutti i partiti ad organizzarla insieme a partire da @pdnetwork e @Piu_Europa",[]
2022-10-10,1579480719075823617,Carlo Calenda,448452,"Nessuna collaborazione con Conte, abbiano due idee di opposizione completamente diverse. https://t.co/335EZhisLD",[]
2022-10-10,1579474008848093188,Carlo Calenda,448452,🔴 Questa sera alle ore 18:00 sarò ospite di #Metropolis su @repubblica. Aspetto i vostri commenti! https://t.co/ZAMHXI0vI5,['Metropolis']
2022-10-10,1579470911031640066,Carlo Calenda,448452,Condivido i punti del discorso di Bonomi. Rischiamo di perderci un pezzo di industria e centinaia di migliaia di posti di lavoro. Quindi: dire di no alle promesse folli su flat tax e pensioni e procedere con il tetto nazionale al costo delle bollette elettriche e gas https://t.co/J8rC6SBh6H,[]
2022-10-10,1579441640493785091,Carlo Calenda,448471,"Bollette, bisogna intervenire il prima possibile per aiutare le famiglie e per evitare la strumentalizzazione populista che porterebbe l’Italia al disastro. https://t.co/61u7CG3qAP",[]
2022-10-10,1579416360802783232,Carlo Calenda,448471,"Tra guerra e crisi economica il pericolo è la deriva populista. 

La mia intervista a @OmnibusLa7.  https://t.co/8GCAwmHT1J",[]
2022-10-10,1579387302102851587,Carlo Calenda,448471,Siamo con l’Ucraina e con gli ucraini. Il pacifismo che mette tutti sullo stesso piano è immorale. Non accetteremo alcuna collaborazione con chi sostiene queste tesi. In Italia e in UE. #Scegli https://t.co/zIQmc4MC3F,['Scegli']
2022-10-10,1579354517489209344,Carlo Calenda,448471,"🔴 Questa mattina, alle ore 09:10, sarò ospite a @OmnibusLa7 su @La7tv. Seguitemi! https://t.co/tw3KstSUNy",[]
2022-10-09,1579192773659398144,Carlo Calenda,448471,Vedo dalle parti della sinistra una grande confusione tra qualunquismo e progressismo. La differenza fondamentale è l’obiettivo: assistenza/dipendenza o emancipazione attraverso istruzione e cultura. Noi sappiamo da che parte stare. https://t.co/A4Ud6eOpha,[]
2022-10-09,1579175909835550720,Carlo Calenda,448471,@lelegno Altrimenti è impossibile visitarle con un approccio organico. Aggiungo I musei collezione sono stati superati a partire dall’800 in tutto il mondo. Rimangono come Musei collaterali rispetto ai Musei Nazionali. L’esposizione a collezione e’ caotica per chi non conosce la storia,[]
2022-10-09,1579175320737165313,Carlo Calenda,448471,@lelegno Ma con questo principio non esisterebbe il Louvre o Il Kunsthistorisches,[]
2022-10-09,1579174850647969792,Carlo Calenda,448471,"@lelegno Ma non è il caso di Altemps, Massimo, Montemartini e Civiltà Romana. I capitolini rimarrebbero intatti. Le collezioni sarebbero arricchite con esposizione negli altri palazzi del Campidoglio",[]
2022-10-09,1579169069458427904,Carlo Calenda,448471,@Franck19841 Si,[]
2022-10-09,1579167606862487554,Carlo Calenda,448471,"Per 10 anni Giorgia Meloni ha spiegato che i tecnici erano il male assoluto per l'Italia. Ora nel suo governo ci saranno anche loro. Al di là della coerenza, mi preoccupa sapere che cosa farà contro il caro bollette o se sulle pensioni seguirà le promesse di Salvini e Berlusconi. https://t.co/ADfyEjPxR3",[]
2022-10-09,1579160772097155072,Carlo Calenda,448471,"Mamma mia che palle. Rispondete su piano energia che vi abbiamo mandato, dite la vostra sui rigassificatori etc. decidete posizione unitaria su Ucraina mentre i vostri parlamentari votano contro invio armi. Etc etc etc https://t.co/hfVR7U3Hn4",[]
2022-10-09,1579157121471430657,Carlo Calenda,448471,"@mat_tarello 1) Ma tu sei andato a visitarla la mostra? 2) ho dato un giudizio su allestimento e pezzi, occorre essere un museologo per esprimerlo?",[]
2022-10-09,1579150241127108608,Carlo Calenda,448471,@MarcoFattorini Effettivamente,[]
2022-10-09,1579149701718212610,Carlo Calenda,448471,@lelegno Nel mentre spiegami perché lo sarebbe,[]
2022-10-09,1579149281407430657,Carlo Calenda,448471,"@giusy2012 Giusy, sono andato a vedere una mostra che non mi è piaciuta. Si può? Perché nel mentre tu stai dando giudizi. Ps abbiamo fatto la campagna elettorale contro destra e sinistra. Si chiama democrazia.",[]
2022-10-09,1579148748865015809,Carlo Calenda,448471,@ArturoB23022138 Ma hai letto ciò che hai scritto Arturo?,[]
2022-10-09,1579148373075980288,Carlo Calenda,448452,"@mat_tarello Mi fa molto piacere per loro.
E tuttavia siccome organizzano mostre per il pubblico il pubblico esprime i propri giudizi liberamente. E ripeto è una mostra di basso livello sia dal punto di vista dell’allestimento che dei pezzi esposti.",[]
2022-10-09,1579147720304267266,Carlo Calenda,448452,@ArturoB23022138 Ma perché tu quando (aggiungo se) vai a una mostra non dici mi è piaciuto o non mi è piaciuta? E nel caso credi di essere un critico d’arte o solo un utente che esprime un giudizio. Non capisco se fate i fessi qui sopra o lo siete in generale,[]
2022-10-09,1579147133524971521,Carlo Calenda,448452,@giusy2012 Veramente ho solo dato il giudizio da utente su una mostra. Non capisco perché ciò vi innervosisca.,[]
2022-10-09,1579146638802636800,Carlo Calenda,448452,@lelegno Volentieri.,[]
2022-10-09,1579146141496938496,Carlo Calenda,448452,@Incredibile___ Hai ragione. Perché portare i figli la domenica al museo. Questa roba così radical chic. Beata ignoranza,[]
2022-10-09,1579145926283001857,Carlo Calenda,448452,"@cozzepecorino Montanari, il direttore degli Uffizi la giudico’ invece ottima e necessaria. Ciò detto prova a ragionare con la tua testa non con quella degli altri",[]
2022-10-09,1579083712897372160,Carlo Calenda,448452,"Raffazzonata, caotica, plastici messi a caso, pochi ritratti di Domiziano (anche perché oggetto di damnatio memoriae). Non all’altezza del luogo https://t.co/EQdgrxhHmi",[]
2022-10-09,1579078334356819970,Carlo Calenda,448452,Tra l’altro collegato all’area dei Fori. Manchiamo di ambizione e innovatività. È un peccato. Non siamo all’altezza del nostro retaggio. https://t.co/3WqhmxmFte,[]
2022-10-09,1579077873025024000,Carlo Calenda,448452,"Sono tornato ai capitolini per la mostra (pessima) su Domiziano. Continuo a pensare che tutti gli edifici del Campidoglio non destinati a esposizioni dovrebbero essere destinati a raccogliere le collezioni oggi a Altemps, Massimo e Civiltà Romana. Diventerebbe il nostro Louvre. https://t.co/yTaDdnCjSY",[]
2022-10-09,1579000612871897089,Carlo Calenda,448452,"La strada è chiara: 1) tetto al costo delle bollette; 2) infrastrutture; 3) rinuncia a proposte folli (Flat Tax, Quota 41, pensioni minime). Se non ci muoviamo rapidamente ci costerà molto di più. Sarebbe utile conoscere le idee di ⁦@GiorgiaMeloni⁩ e ⁦@EnricoLetta⁩ https://t.co/SlpwG9iQvG",[]
2022-10-09,1578999605890412544,Carlo Calenda,448452,"Rimarremo esposti per molto tempo alla fluttuazione del prezzo del Gas. Almeno dobbiamo fare le infrastrutture che servono alla sicurezza degli approvvigionamenti. Ravenna, Piombino, nuovi stoccaggi e Sulmona. E poi partire subito con il nucleare. https://t.co/N8ZAETMKDx",[]
2022-10-08,1578831793746481152,Carlo Calenda,448452,"Quando ero ragazzo ogni anno c’era la manifestazione per la pace. Gli slogan gettonati erano quello che leggete sullo striscione e “fuori l’Italia dalla NATO”.  Mai una parola sull’invasione russa dell’Afghanistan, che  era la guerra di aggressione più cruenta. Siamo sempre lì. https://t.co/3hXKR5BLUy",[]
2022-10-08,1578811232261656576,Carlo Calenda,448452,Bastava votare diversamente. Adesso “o mangi questa minestra..” https://t.co/ZW7b2Vkjk7,[]
2022-10-08,1578796092853927936,Carlo Calenda,448452,"Il problema è che essendo destra e sinistra completamente spaccati al loro interno, il rischio di una perdita di controllo sulle finanze pubbliche ma anche sulla situazione sociale, è rilevantissimo. Per questo riteniamo fondamentale agire subito.",[]
2022-10-08,1578795543471394818,Carlo Calenda,448452,Se non si interverrà presto con un tetto al costo delle bollette elettriche e gas gli italiani smetteranno di pagarle. A quel punto qualche populista (5S/Lega) chiederà di non farle pagare e saremo travolti da una nuova ondata di spese e di voti populisti.,[]
2022-10-08,1578767608706265088,Carlo Calenda,448452,La posizione coraggiosa di ⁦@EnricoLetta⁩ su Ucraina viene sconfessata sempre più spesso in UE e in Italia. A questo faccio riferimento quando chiediamo chiarezza su linea riformista o qualunquista prima di parlare di una collaborazione con il ⁦@pdnetwork⁩ https://t.co/bwoaAoYjdD,[]
2022-10-08,1578763410186985472,Carlo Calenda,448452,🔴 Questa sera alle 20:30 sarò ospite a @InOndaLa7 su @La7tv. Seguitemi! https://t.co/nJmpimrZQT,[]
2022-10-08,1578758515174543360,Carlo Calenda,448452,L’Ansa. https://t.co/Jhlt8AdjbX,[]
2022-10-08,1578723068301938688,Carlo Calenda,448452,Il tetto a 100 euro richiesto dalle aziende è quello che abbiamo indicato nel nostro documento. https://t.co/Y1LTBciTa3,[]
2022-10-08,1578721914498916358,Carlo Calenda,448452,Quelle indicate da Descalzi sono esattamente le stesse infrastrutture che abbiamo elencato nel nostro documento di ieri. Sarebbe importante sapere cosa ne pensano ⁦@EnricoLetta⁩ ⁦@GiorgiaMeloni⁩ https://t.co/8c4aePC5Eg,[]
2022-10-08,1578642012932542464,Carlo Calenda,448452,Ma davvero fai il giornalista all’Espresso? E rispondi in questo modo a un invito a visitare la mostra di Van Gogh? Nel paese dove in assoluto si partecipa meno ad eventi culturali? Un paese impazzito. https://t.co/dAtcC65g3I,[]
2022-10-08,1578637550247645185,Carlo Calenda,448452,@billevans69 @ilmessaggeroit Ma prima di scrivere e fare domande. Potresti sfogliare le 4 dicasi 4 pagine della presentazione. Cosa dobbiamo fare? Delle vignette? Degli stickers? Un video danzante su tik tok?,[]
2022-10-08,1578637211960238080,Carlo Calenda,448452,@FraBcc @ilmessaggeroit Hai ragione. Facciamo così. Per i prossimi 5 anni. Nessuno presenta più alcuna proposta. Andiamo al mare e aspettiamo le prossime elezioni.,[]
2022-10-08,1578636878416207872,Carlo Calenda,448452,@Massimo_P63 @ilmessaggeroit In fondo il problema è questo no? Adulti che fanno i bambini. Si lamentano che tutto va male. Piangono sulle bollette e poi scrivono idiozie infantili sui social. Direi che sei nel mainstream.,[]
2022-10-08,1578635944973910017,Carlo Calenda,448452,"il Vecchio disperato (alle porte dell’eternità). È una collezione diversa da quelle che si trovano nei grandi musei, viene dal museo di Otterlo e dalla collezione Kroller-Müller. Vale la pena portarci i ragazzi. Nulla nell’arte è “immediato” come Van Gogh.",[]
2022-10-08,1578635941643579397,Carlo Calenda,448452,Ieri sono andato al vernissage della mostra di Van Gogh a Palazzo Bonaparte. Allestimento strepitoso e una perfetta spiegazione del percorso artistico dall’81 fino alla morte. Due quadri tra i più belli. Il giardino del manicomio di Saint Remy e https://t.co/XtEm6kie4i,[]
2022-10-08,1578624407433420800,Carlo Calenda,448452,"Era già successo con il report sul SSN che presentammo a novembre ‘19. I giornali non scrissero una riga, ci risposero che la sanità non era un argomento politico. Quattro mesi dopo eravamo in lockdown. La stampa italiana è malata quanto e più della politica.",[]
2022-10-08,1578622483758186496,Carlo Calenda,448452,Destra e sinistra non hanno una posizione sull’emergenza nr 1. Ma il focus della stampa è su totoministri e crisi del PD. Come passa la giornata di sabato Giorgia? Cosa dice Bindi su Letta? Andate pure avanti così ma poi non scrivete editoriali sulla qualità della politica.,[]
2022-10-08,1578619545949917184,Carlo Calenda,448452,"Ieri abbiamo presentato un piano dettagliato su tetto bollette gas/elettricità,
con costi, coperture e infrastrutture necessarie. Oggi a parte @ilmessaggeroit nessun giornale riporta una riga. Nulla di nuovo, accade ogni volta in cui parli di contenuti e non di gossip politico.",[]
2022-10-07,1578481014975840256,Carlo Calenda,448452,Si chiama qualunquismo. Banalità retoriche che celano posizioni ipocrite https://t.co/YDeLity7G4,[]
2022-10-07,1578474130638536704,Carlo Calenda,448452,Ma scusa Roberto ma le misure chi le deve prendere Babbo Natale https://t.co/PnJ3BYX2Za,[]
2022-10-07,1578428541208649734,Carlo Calenda,448452,"La totale disattenzione verso il decoro, la libertà concessa di devastare la città senza controlli e/o reazioni; abbiamo davvero poco rispetto per la nostra città e facciamo poco per farla rispettare. Il tutto con un Sindaco che è completamente assente. #RomasulSerio https://t.co/XhpPBindon",['RomasulSerio']
2022-10-07,1578419057027448842,Carlo Calenda,448452,https://t.co/KQ5Wtzu5n7,[]
2022-10-07,1578419050337927170,Carlo Calenda,448452,"Il fallimento dell’UE sull’energia e l’intervento improvvido della Germania richiedono un cambio di passo. Qui la nostra proposta per un tetto alle bollette luce e gas con coperture. È ora di usare il ""bazooka"". Maggioranza futura e opposizione si confrontino su questa proposta. https://t.co/EE0HLcsTjq",[]
2022-10-07,1578412770349158402,Carlo Calenda,448452,"La questione del caro energia e dell’aumento delle bollette degli italiani non va ideologizzata in alcun modo. Non esistono politiche di destra e di sinistra, ma semplicemente proposte di buon senso per evitare che questa emergenza degeneri in crisi sociale.",[]
2022-10-07,1578405021955330048,Carlo Calenda,448452,"Caro energia: è necessario intervenire subito perché il rischio che questa #crisi (che oggi è produttiva, delle famiglie che hanno visto le bollette aumentare del 50%) diventi una crisi sociale ed economica più profonda, è già certezza.
#conferenzastampa #terzopolo https://t.co/z0rdNLed16","['crisi', 'conferenzastampa', 'terzopolo']"
