Date,Tweet ID,Leader Name,Followers,Text,Hashtags
2022-11-09,1590438654769790976,Carlo Calenda,448452,"La verità è che l’Italia è un’eterna ripetizione delle stesse cose. Le navi delle ONG, le promesse elettorali che si vaporizzano subito, le discussioni sul tetto al contante e condoni. Sempre uguale e sempre inutile. L’unico modo per rompere questa spirale è rifiutare di parlane.",[]
2022-11-09,1590384398117273604,Carlo Calenda,448452,La prossima volta in cui vedrete @berlusconi raccontare a reti unificate palle su pensioni e tasse provate a ricordarvi di questa ennesima menzogna. Sta a noi cittadini evitare di farsi prendere in giro.,[]
2022-11-09,1590384010135359488,Carlo Calenda,448452,Voteremo a favore dello scostamento che andrà per il contenimento dei costi delle bollette. Su Nadef ci asterremo. I numeri sono prudenti. Di tutte le promesse della destra in campagna elettorale non c’è traccia. Bene per Italia male per la politica che inganna gli elettori.,[]
2022-11-09,1590304194770407429,Carlo Calenda,448452,@GabrieleGiglio7 Unire non vuol dire nulla. È un argomento retorico. Come la pace. Unire su che cosa. Questa è politica.,[]
2022-11-09,1590285079443640322,Carlo Calenda,448452,Condividiamo totalmente questa posizione del Governo italiano. ⁦@TimmermansEU⁩ sta accelerando su normative assurde e totalmente controproducenti per l’ambiente. Sembra avere a cuore la distruzione dell’industria europea piuttosto che la transizione ecologica. https://t.co/7oi8y7Ma6J,[]
2022-11-09,1590283054118862849,Carlo Calenda,448452,Quando va in piazza Santoro nessuno può andare in un’altra piazza! Altrimenti è cattivo come Berlusconi. Strano per chi ha passato la carriera a lamentarsi della democrazia in Italia. Ieri ho pensato fosse utile interrompere il suo soliloquio e confrontarmi con lui. Con pazienza. https://t.co/mfhqpFQrWA,[]
2022-11-09,1590282389875724290,Carlo Calenda,448452,Benvenuto https://t.co/yeh90KUJ2e,[]
2022-11-09,1590270981440155649,Carlo Calenda,448452,Ammazza Fabio grande traguardo! Decisivo per famiglie e imprese. Dopo che hai cambiato nome al dispenser ti tocca cambiare anche Made in Italy. Una cosa tipo: fatto in Italia. Oppure ancora meglio: siamo parecchio fatti in Italia. Che descrive bene anche le vaccate che scrivete. https://t.co/WxeZRGggQf,[]
2022-11-09,1590255952569069569,Carlo Calenda,448452,"Non rispondiamo alla logica dell’allarme democratico e del tutti contro. Vogliamo rimettere insieme le culture liberali, popolari, riformiste e repubblicane tranciate dal bipolarismo per governare finalmente il paese e riappacificarlo. Quello che Draghi aveva iniziato a fare.",[]
2022-11-09,1590255886198460416,Carlo Calenda,448452,Nel corso della seconda Repubblica si è andata affermando l’idea che esistano solo la destra e la sinistra. Una rappresentazione Berlinguer vs Almirante che non corrisponde alla storia d’Italia. Noi siamo il centro riformatore. https://t.co/27fAuRXcOg,[]
2022-11-09,1590240725324554240,Carlo Calenda,448452,Eppure sarebbe un accordo facile: un nome del Terzo Polo sostenuto dal PD (che ha possibilità di vincere) in Lombardia e un nome del PD sostenuto dal Terzo Polo nel Lazio. Ufficio complicazione affari semplici.,[]
2022-11-08,1590081219953590273,Carlo Calenda,448452,"Ma anche come se fosse antani del neoliberismo, tarapia tapioco dell’efficientismo. https://t.co/DJ70LMGFCG",[]
2022-11-08,1590048785383960577,Carlo Calenda,448452,"Che fesserie. Avete candidato Di Maio che vi accusava di rubare i bambini! Questo paese deve chiudere una lunga stagione di conflitto tra popolari, liberali e socialdemocratici che ha generato i mostri del sovranismo e del qualunquismo e fatto declinare l’Italia. https://t.co/pz3ZiBOOB7",[]
2022-11-08,1590041461181005826,Carlo Calenda,448452,"Questa sera, a partire dalle ore 22:20, sarò ospite di @giovannifloris3 a @diMartedi.

Seguitemi! https://t.co/HaKVLJbFAX",[]
2022-11-08,1590031347447631874,Carlo Calenda,448452,@antopaleo @PierR11641719 Ed è esattamente quello che è accaduto. Mea culpa!,[]
2022-11-08,1590029203113922560,Carlo Calenda,448452,"Conte ribadisce il No al termovalorizzatore a Roma che è il punto qualificante del programma di Gualtieri. Possiamo desumere che continuare a perdere tempo con il M5S è inutile almeno nel Lazio?  Visto che c'è una persona del @pdnetwork  di valore già in campo, possiamo chiudere?",[]
2022-11-08,1590027460254785537,Carlo Calenda,448452,@antopaleo Del tutto vero. l'ho fatto cancellare appena capito l'errore.,[]
2022-11-08,1590023283507744768,Carlo Calenda,448452,potrebbe essere quella di organizzarli in nuclei regionali ANPAL preposti a lavorare con le agenzie private di collocamento. Il ruolo delle agenzir è fondamentale per chiudere il mismatch tra domanda/offerta di lavoro (circa 500.000 figure) e tuttavia oggi il dialogo con CPI è 0.,[]
2022-11-08,1590022551262334976,Carlo Calenda,448452,La verità è che i loro profili professionali e di studio sono superiori rispetto a molte persone che si trovano nei centri per l’impiego. Abbiamo discusso a lungo su come poter usare la loro esperienza senza abbandonarli allacassa integrazione perenne. Credo che una soluzione…..,[]
2022-11-08,1590021642306179073,Carlo Calenda,448452,"Oggi ho incontrato casualmente un gruppo di navigator e mi sono fermato a parlare con loro. Sono persone serie e preparate, che sono state usate per una battaglia politica nella quale anche io in passato mi sono fatto trascinare giudicandoli ingiustamente e superficialmente. https://t.co/KLwjGYOqkt",[]
2022-11-08,1590014093758328833,Carlo Calenda,448452,Reading List. Il libro di Gotor Generazione Settanta è un testo fondamentale per capire ciò che noi liquidiamo come “anni di piombo”. Abbiamo rimosso una parte della nostra storia che rappresenta un decennio di rottura. Ma è parte della nostra identità e definisce ciò che siamo. https://t.co/nY8xluXhvn,[]
2022-11-08,1589980993372315648,Carlo Calenda,448452,"È un pezzo da incorniciare. Ovviamente i pregiudizi sono “intermittenti”. Chissà, ad esempio, se i pacifisti di sinistra ricorderanno in queste ore il loro amato ⁦@GiuseppeConteIT⁩ che inaugura con Salvini l’uso propagandistico del blocco alle ONG. Chissà.. https://t.co/oFbeeqMub1",[]
2022-11-08,1589908277760249856,Carlo Calenda,448452,Devo confessarlo: ho riabilitato Scanzi. Adoro “Macellaio rude di Tor Vaianica”. Lo preferisco a Churchill https://t.co/kFy7fk2nlh,[]
2022-11-08,1589899435190157313,Carlo Calenda,448452,Questo è ciò che fanno tutti i Governi europei. Compresi quelli socialisti o liberali. Macron e Sanchez non aprono i porti a chiunque.. Quindi cortesemente piantiamola con la strumentalizzazione politica di destra e sinistra e ragioniamo su un piano nazionale per l'immigrazione.,[]
2022-11-08,1589898284042420225,Carlo Calenda,448452,La chiusura delle rotte di immigrazione illegale è fondamentale per gestire i flussi in modo civile. La retorica di sinistra sui porti aperti è assurda. Lavorare con i paesi di transito e provenienza è indispensabile. Così come il pattugliamento e i respingimenti.,[]
2022-11-08,1589897379569840129,Carlo Calenda,448452,"Su questo dato dovremmo concentrare il nostro lavoro attraverso un'agenzia per l'immigrazione, gli sprar, la regolarizzazione di chi trova un lavoro, i rimpatri incentivati, lo ius scholae. Invece continuiamo a parlare di 100 disperati bloccati su una nave per propaganda politica",[]
2022-11-08,1589896674977062912,Carlo Calenda,448452,Contesto: Il numero dei migranti salvati dalle ONG è ininfluente rispetto al totale degli arrivi. L'Italia continua ad essere  un paese di transito. I migranti arrivano lavorano per qualche mese per poi andare in altri paesi. Ci sono 500/600 mila irregolari in Italia.,[]
2022-11-08,1589895281453465601,Carlo Calenda,448452,"Si discute di simboli ma non del problema, di come governarlo e farlo diventare un'occasione di sviluppo. Siamo sempre congelati lì, nello scontro di rumori che aiuta destra e sinistra a non far nulla, militarizzando gli elettori. E' un'eterna ripetizione del nulla.",[]
2022-11-08,1589894404034400256,Carlo Calenda,448452,In questo modo di evita sempre di parlare seriamente di immigrazione. Come controllare i confini e chiudere le rotte di immigrazione illegale evitando di violare il diritto internazionale e i principi umanitari e come integrare i migranti che risiedono in Italia.,[]
2022-11-08,1589893708446838785,Carlo Calenda,448452,Quello che sta accadendo con le navi delle ONG è la ripetizione dello sconcio avvenuto sotto il governo di @GiuseppeConteIT e @matteosalvinimi. Ma al di là della questione umanitaria ciò che è drammatico è il riproporsi di un vuoto confronto tra porti aperti e porti chiusi.,[]
2022-11-08,1589872052886212609,Carlo Calenda,448452,Un ticket tra Letizia Moratti e una personalità della sinistra Lombarda isolerebbe la destra sovranista e la sconfiggerebbe. I riflessi sulla destra anche a livello nazionale sarebbero profondi. Salvini ne uscirebbe a pezzi. Sicuri di voler andare per altre strade? @pdnetwork,[]
2022-11-07,1589590814820569088,Carlo Calenda,448452,"La mia ultima newsletter: la manifestazione di sabato e il sostegno agli ucraini, il lavoro di @Azione_it in vista delle Regionali e la Federazione del #TerzoPolo con @ItaliaViva. 

Leggila qui: https://t.co/WkDsU4banH https://t.co/XASyaGRsQ3",['TerzoPolo']
2022-11-07,1589581706696482818,Carlo Calenda,448452,Un grandissimo abbraccio! Sergio tieni duro https://t.co/oCdzEJGMUm,[]
2022-11-07,1589524713050902528,Carlo Calenda,448452,"Editoriale perfetto di Recalcati. L’infantilismo della Pace evocata senza un come, a prescindere, secondo il vecchio schema né con/ né con, che finisce per diventare una stampella al disegno neoimperialista di Putin. https://t.co/QYiw32sse3",[]
2022-11-07,1589523192041082880,Carlo Calenda,448452,"Il vostro problema, non sono le posizioni che prendete, legittime e comunque utili, ma questo linguaggio adolescenziale speculare a quello di altri giornali della destra. Un atteggiamento che rappresenta il rinfanciullimento del giornalismo a livello chat di calcetto. https://t.co/CCjFGrVuxH",[]
2022-11-06,1589335087824646144,Carlo Calenda,448452,Per chi pensa che Putin vorrà fermarsi all’Ucraina. Come tutti i dittatori si firmerà quando verrà fermato. Non per sazietà. Gli ucraini lo stanno facendo al posto nostro. Prima che il conflitto arrivi in un paese NATO. E noi li vogliamo disarmare. Anime morte. https://t.co/BjSNU9nWah,[]
2022-11-06,1589233349826334720,Carlo Calenda,448452,"Citato ieri all’inizio del discorso: “Pace per il nostro tempo”. La crisi dei Sudeti e la conferenza di Monaco non ci hanno insegnato nulla. “Potevate scegliere tra il disonore e la guerra, avete scelto il disonore avrete la guerra”. WSC https://t.co/LmCbVImZiJ",[]
2022-11-06,1589214875699773442,Carlo Calenda,448452,"È proprio l’opposto. Cercare di guardare oltre un conflitto ideologico sempre più vuoto che dura da decenni e da cui l’Italia è uscita distrutta. E guardare avanti rimettendo insieme riformisti, popolari e liberali sui programmi, non sulla chiacchiera da piazza. https://t.co/BYHdQOMz61",[]
2022-11-06,1589206823269433344,Carlo Calenda,448452,"Rimaniamo aperti alla discussione con tutti per costruire coalizioni ampie, ticket (Moratti-Cottarelli sarebbe perfetto) che parlino a mondi diversi, programmi inclusivi. Ma è ora di rompere gli indugi e iniziare a lavorare.",[]
2022-11-06,1589206224557731842,Carlo Calenda,448452,Appoggiare due persone che in Lombardia e nel Lazio hanno fatto bene sulla campagna vaccinale e la sanità come Alessio D’Amato e Letizia Moratti è la scelta giusta per il #TerzoPolo. Vengono da storie diverse ma hanno lavorato sulla stessa linea di serietà nell’emergenza.,['TerzoPolo']
2022-11-06,1589198082813661184,Carlo Calenda,448452,"Se potete, andate a comprare libri da regalare a una scuola per la biblioteca. In tutte le librerie trovate le liste per i diversi istituti. Tre titolo erano nella lista dell’Istituto M. Fioravanti, uno l’ho aggiunto io. Indovinate quale? https://t.co/oHL9PSu8SQ",[]
2022-11-06,1589170519534075905,Carlo Calenda,448452,"Noi l’abbiamo cantata per chi resiste, voi per disarmare chi resiste. Ma nonostante ciò pretendete di averne il monopolio, e in questo modo da canto repubblicano l’avete svilita a slogan. Io sono antifascista e liberale. La resistenza non è patrimonio dei soli comunisti. https://t.co/ttRMfaqEoP",[]
2022-11-06,1589166681837826049,Carlo Calenda,448452,Ah ho capito. Tu dici che se non inviamo più armi gli Ucraini continuano a combattere lo stesso con le armi che hanno. Quelle al laser che non esauriscono i colpi e il martello di Thor? Vedi quando parlo di ipocrisie del pacifismo retorico penso proprio a queste vaccate. https://t.co/AOieQmE7NQ,[]
2022-11-06,1589166164399493120,Carlo Calenda,448452,@giannizucco1 E perché mica faccio il tronista. Leggi di più piuttosto,[]
2022-11-06,1589165982089883649,Carlo Calenda,448452,Conte. Tanto per dirne una. E una buona parte dei partecipanti alla manifestazione di ieri secondo ogni cronaca giornalistica. https://t.co/fpvJJ2JMuh,[]
2022-11-06,1589164864484016128,Carlo Calenda,448452,Hai ragione. Si chiama principio del paese di prima accoglienza e che non lo sappia il Ministro della Difesa è grave. Poi che quel principio vada integrato con la gestione comune è qualcosa che continuiamo a chiedere senza ottenere. https://t.co/gd09zO3DOO,[]
2022-11-06,1589164030081781760,Carlo Calenda,448452,"E questa è la sintesi decisiva di settarismo e ignoranza. Chi doveva cantarla Bella Ciao, Orsini? E chi sta resistendo, Travaglio? La verità semplice è che l’unica resistenza che potete celebrare è quella contro voi stessi, contro l’Occidente. È un nodo irrisolto dal dopoguerra. https://t.co/rCvZnyL9fW",[]
2022-11-06,1589155140975865862,Carlo Calenda,448452,"E se posso tu cerca di ricordartene il senso. Il sacrificio contro l’invasore, non la resa all’invasore in nome di una PACE che è sottomissione senza libertà",[]
2022-11-06,1589154193771675648,Carlo Calenda,448452,"Amore mio, conosco questa canzone dalla terza elementare. Una volta la insegnavano a tutti in classe senza polemiche. Prima che ne faceste un sistematico uso strumentale. L’ho insegnata a tutti i miei figli. Ieri non sentivo dal palco la musica e quindi sono andato fuori tempo. https://t.co/J4YrjJgN9O",[]
2022-11-06,1589153538021916673,Carlo Calenda,448452,@obioneagain Adoro questo modo di essere fasciocomunista per cui gli altri sono sempre nemici. È la storia del nostro paese,[]
2022-11-06,1589153185234833409,Carlo Calenda,448452,"@SimoTuzza C’è una cosa che va di pari passo con la retorica della pace ed è quella dell’intolleranza. Prova ne sia la contestazione ad Enrico Letta. Quella di ieri era una piazza contro il sostegno militare all’Ucraina. Legittimo, ma pretendere che rappresenti tutti è..putiniano. Diciamo.",[]
2022-11-06,1589151896945987584,Carlo Calenda,448452,"Ho deciso di concludere il comizio cantando insieme alla piazza Bella Ciao, non solo perché era la piazza che sosteneva la resistenza Ucraina, ma perché i valori e i simboli della resistenza devono tornare ad essere di tutti gli italiani, e non usati solo da una parte vs l’altra.",[]
2022-11-06,1589151254965780483,Carlo Calenda,448452,"La seconda lettura sbagliata è “la sinistra va divisa”. La piazza di ieri a Milano non era di sinistra, tantomeno se volete ostinarvi a considerare il qualunquismo di Conte sinistra. Liberali, popolari, riformisti, radicali, buona destra..la piazza di Milano era composita.",[]
2022-11-06,1589150403274280960,Carlo Calenda,448452,"Come ho spiegato ieri, tutte le idee per raggiungere la pace meritano una discussione e una rappresentanza, ma il comune denominatore di ieri a Roma era “no armi all’Ucraina”. Ciò vuol dire la resa degli ucraini a Putin. Noi contrasteremo questa prospettiva.",[]
2022-11-06,1589149576896057344,Carlo Calenda,448452,"Ci sono due letture sbagliate sulle piazze di ieri. La prima è quella che dice “perché dividersi sulla pace”. Sulla pace, su cosa vuol dire pace, su come la si ottiene ci sono due visioni profondamente diverse e mischiarle in un unico indistinto nulla retorico è sbagliato.",[]
2022-11-05,1589019887380627458,Carlo Calenda,448452,@lidiaus82 Fai bene. Libera dalle tossine. Forse anche dalla cafonaggine ma non ci giurerei,[]
2022-11-05,1588993332877086720,Carlo Calenda,448452,Letizia Moratti è stata coraggiosa a venire in piazza. Carlo Cottarelli poteva tenersi alla larga per non scontentare nessuno. Hanno fatto una scelta seria e onorevole. Grazie https://t.co/vE54vjFol8,[]
2022-11-05,1588984344487800833,Carlo Calenda,448452,@francoisengo Anche no. Ho un figlio e un fratello laziale. E basta e avanza,[]
2022-11-05,1588983426992029698,Carlo Calenda,448452,E daje https://t.co/hZ0CjQoHoz,[]
2022-11-05,1588979305086062592,Carlo Calenda,448452,Mi sembra invece che è proprio quello che chiedi: che gli ucraini restino inermi. https://t.co/iyAGIPffAS,[]
2022-11-05,1588961444086788096,Carlo Calenda,448452,"A #Milano eravamo tantissimi. Una grande manifestazione di italiani di diverse estrazioni culturali e politiche per dire forte che i nostri valori di #libertà si difendono con #coraggio e che non possiamo abbandonare un popolo che combatte anche per noi.
#SlavaUkraini https://t.co/3R1YNvB3fm","['Milano', 'libertà', 'coraggio', 'SlavaUkraini']"
2022-11-05,1588957715241783298,Carlo Calenda,448452,Noi lo avremmo applaudito senza se e senza ma. @EnricoLetta ha tenuto in modo impeccabile la linea di politica internazionale con grande coraggio e senza sbandamenti. Solidarietà e vicinanza. https://t.co/mYOrIxBgAg,[]
2022-11-05,1588954402290745344,Carlo Calenda,448452,Perché se avessimo seguito questa linea Putin sarebbe a Kiev. E voi avreste la pace che in fondo volete. Quella che non chiede sacrifici per noi e che non riconosce il diritto agli ucraini di combattere per la loro libertà. Ps poi però lasciate stare i valori della resistenza https://t.co/lK9aC3fiby,[]
2022-11-05,1588953419813122048,Carlo Calenda,448452,"La nostra difesa è la difesa dell’Ucraina.
La nostra difesa è la difesa delle donne iraniane in Iran.
La nostra difesa è la capacità di comprendere tutto ciò.
#SlavaUkraini https://t.co/znz1rj139X",['SlavaUkraini']
2022-11-05,1588947938201731073,Carlo Calenda,448452,"Gli ucraini oggi stanno combattendo anche per noi, il minimo che possiamo fare è aiutarli.
#SlavaUkraini https://t.co/2yiOIMlaV8",['SlavaUkraini']
2022-11-05,1588942476500668417,Carlo Calenda,448452,"Io sono con tutti quelli che manifestano per la pace tranne una categoria: quelli che manifestano per la pace e poi dicono disarmiamo l’Ucraina.
#SlavaUkraini https://t.co/Cko8CkHvpk",['SlavaUkraini']
2022-11-05,1588932772156301314,Carlo Calenda,448452,"A breve il mio intervento.
Segui la diretta 👉🏻 https://t.co/c6itMh4fhz
#SlavaUkraini https://t.co/R19JzVdt2D",['SlavaUkraini']
2022-11-05,1588923658478977025,Carlo Calenda,448452,"Siamo in tantissimi a #Milano per far sentire il nostro appoggio al popolo ucraino che combatte anche per la nostra libertà.
#SlavaUkraini https://t.co/K8zO66Oa0S","['Milano', 'SlavaUkraini']"
2022-11-05,1588923214402834433,Carlo Calenda,448452,La pace nasce dalla libertà. E la libertà nasce dalla resistenza. Chi non vuole mandare le armi all’Ucraina difende in realtà le ragioni di Putin. https://t.co/A2h0G9aPBB,[]
2022-11-05,1588911370338471937,Carlo Calenda,448452,"Da Milano. Iniziamo.
#SlavaUkraini https://t.co/ajgZEjQ30P",['SlavaUkraini']
2022-11-05,1588910531687383040,Carlo Calenda,448452,"In diretta dall'Arco della Pace, a Milano, per ribadire il nostro sostegno all'Ucraina. Perché non esiste pace, senza libertà.
Segui la diretta qui: https://t.co/3jz1MPiGdn https://t.co/Jzon16D0xb",[]
2022-11-05,1588873174032080896,Carlo Calenda,448452,"Capisco la confusione. Del resto hai governato con Salvini mentre innegiava a Putin, hai flirtato con Trump e firmato la via della seta con i cinesi. Allora facciamola semplice @GiuseppeConteIT: non esiste pace senza libertà e non esiste libertà senza resistenza all’invasore. https://t.co/gOpLpE5ZG0",[]
2022-11-05,1588869569107857408,Carlo Calenda,448452,@Ceraunavolta6 Ricordati che la maleducazione è solo un torto che fai ai tuoi genitori. Non a me. Buona giornata.,[]
2022-11-05,1588868553062592512,Carlo Calenda,448452,"@_GrandePuffo @Ceraunavolta6 Tutte le guerre generano efferatezze da ogni parte, che vanno combattute. Pensa agli omicidi post liberazione operati da una parte della resistenza. Ma quegli atti, deprecabili, non cancellano la realtà e il valore di un popolo aggredito che combatte per la libertà.",[]
2022-11-05,1588867866971238400,Carlo Calenda,448452,"@Ceraunavolta6 No, non lo sei. Perché dimentichi che quella resistenza è stata armata e rifornita dagli angloamericani. E che gli alleati insieme ai partigiani hanno rinunciato ad una pace facile per morire per la nostra libertà.",[]
2022-11-05,1588866821666791424,Carlo Calenda,448452,"@castagnafrance2 Certo. Ma la questione fondamentale, quella che torna sempre è: la pace al costo della libertà? Alla fine è tutto qui. E fa impressione vedere persone che si richiamano costantemente ai valori della resistenza, tradire chi sta resistendo. Pace è libertà. Pace senza libertà è resa",[]
2022-11-05,1588865805101723648,Carlo Calenda,448452,"@Cristherock Si? quale lobby delle armi mi paga? Dovrai spiegarlo in tribunale. Perché qui si dialoga con tutti, ma ci si assume la responsabilità di ciò che si dice",[]
2022-11-05,1588865357930196992,Carlo Calenda,448452,@castagnafrance2 La parola Pace (per il nostro tempo) è stata usata da chi ha regalato la Cecoslovacchia a Hitler pensando di appagarlo. Ed è stata usata da chi ha combattuto contro il nazismo insieme alla parola libertà. Pace ha molti significati diversi. Scegli il tuo,[]
2022-11-05,1588864858011095040,Carlo Calenda,448452,"@Ceraunavolta6 Scusa per capire, ma Bella Ciao che tu hai addirittura nella tua bio, la cantavano i partigiani quando si arrendevano ai nazifascisti ì nome della pace o quando combattevano per la libertà? Alla fine il problema è sempre culturale.",[]
2022-11-05,1588863586910507009,Carlo Calenda,448452,"@AndreaCorrino Hai ragione Andrea, mi sono laureato in diritto internazionale, ho presieduto il Consiglio Commercio dell’UE, due formati del G7, una Ministeriale del WTO, e gestito un tot di FTA. Però un critico d’arte è senz’altro più competente di me per ciò che concerne la geopolitica.",[]
2022-11-05,1588861768901996544,Carlo Calenda,448452,@FabrizioNigro Certo ma anche le cavie sanno che l’equazione pacifista=disarmiamo gli ucraini è una presa per i fondelli. Immorale,[]
2022-11-05,1588860484815441920,Carlo Calenda,448452,"Montanari: se è contro l’invio delle armi all’Ucraina è a favore della resa a Putin. E questo fa di lei un prezioso alleato della Russia. Poi può dare tutte le lauree che vuole, ma questa è la sostanza. Sorvolo sugli insulti. Maleducazione è diffusa quanto la malafede. https://t.co/o3BQOeiglF",[]
2022-11-05,1588843635088441346,Carlo Calenda,448452,"Orsini, Il Fatto al gran completo, Alemanno, Di Battista, Montanari…tutti quelli che hanno sostenuto apertamente le ragioni di Putin e il disarmo degli Ucraini  saranno in piazza a Roma. Davvero si può chiamare questa una piazza per una pace giusta? https://t.co/2GJ011kPdD",[]
2022-11-05,1588828038438993920,Carlo Calenda,448452,Direi che la sostanza è tutta qui. https://t.co/inrrVkgJ1Q,[]
2022-11-05,1588799967598358528,Carlo Calenda,448452,Solo degli emeriti cretini possono pensare di aiutare l’ambiente imbrattando un quadro peraltro tutto incentrato su luce e natura. La consapevolezza ambientale nasce dalla cultura e dal sapere. https://t.co/mLiHKVE83d,[]
2022-11-05,1588795282455949312,Carlo Calenda,448452,"A Roma una manifestazione contro “il bellicismo europeo” e il diritto dell’Ucraina di difendersi; a Milano una piazza contro l’aggressione Russa, per il sostegno all’Ucraina e la libertà di chi resiste. Resistenza vs Resa. Difficile rimanere nel mezzo invocando il “ma anche” https://t.co/lEBAvWxVwI",[]
2022-11-05,1588786846968221696,Carlo Calenda,448452,"Continueremo, data la legge elettorale, a cercare un accordo. Ma manca chiarezza di intenti e il tentativo di fare alleanze a geometrie variabili in Lazio e in Lombardia non è accettabili.",[]
2022-11-05,1588785861768155137,Carlo Calenda,448452,"Solo con il @pdnetwork romano ti può capitare che data la disponibilità a sostenere un loro ottimo assessore già in campo per le regionali, ti rispondano stizziti “come ti permetti! Vogliamo un civico”. Che ancora non hanno. Dottrina Bettini, prima le correnti poi la regione. https://t.co/XCjFpHoI0N",[]
2022-11-04,1588642799427411968,Carlo Calenda,448452,Cercare di forzare la realtà alla propaganda genera molti decreti e molto casino.,[]
2022-11-04,1588632325524541444,Carlo Calenda,448452,Quando scrivi male una norma penale immediatamente operativa (che poi devi correggere) siamo nel pieno della fattispecie Repubblica delle banane. Se presenti una Nadef con numeri sulla crescita sbagliati ti confermi un governo da Repubblica delle banane. https://t.co/mLEo57sxIX,[]
2022-11-04,1588622419774046208,Carlo Calenda,448452,"Dobbiamo con forza dire che oltre i #diritti esistono i #doveri e che tutti dobbiamo contribuire a difendere,a costruire,a partecipare,a sviluppare la nostra #società o rischiamo di vederla sgretolarsi dinnanzi ai nostri occhi.E non possiamo permettercelo.
#lalibertàchenonlibera https://t.co/F7no65de8V","['diritti', 'doveri', 'società', 'lalibertàchenonlibera']"
