Date,Tweet ID,Leader Name,Followers,Text,Hashtags
2022-10-25,1584817941039575041,Carlo Calenda,448452,"Anna, non possiamo saperlo. Sappiamo però che visto il livello delle cose che scrivi il problema che mi porrei fossi in te è cosa sei diventata tu. Buona giornata. https://t.co/ho0JIQ12GO",[]
2022-10-25,1584793196932263937,Carlo Calenda,448452,Vedremo cosa dirà @GiorgiaMeloni di questo “piano per il default” di @matteosalvinimi. Resta il fatto che “bruciare” l’intervento alle camere del Presidente del Consiglio è un atto di profonda scorrettezza istituzionale. https://t.co/xevm3nJKAt,[]
2022-10-25,1584775805913427968,Carlo Calenda,448452,Tra la contestazione del merito e la polemica su La Presidente mi pare che la sinistra si predisponga ad essere La migliore alleata della destra.,[]
2022-10-24,1584636545105289216,Carlo Calenda,448452,Direi una perfetta sintesi https://t.co/YTTNNdG36z,[]
2022-10-24,1584617979664388099,Carlo Calenda,448452,Per fortuna la ⁦@CislNazionale⁩ tiene la barra dritta sulla questione del merito. Bravo Sbarra. https://t.co/Tvvgf8MLnT,[]
2022-10-24,1584601984832720896,Carlo Calenda,448452,"Amici qui si sta deragliando. Tra la polemica su Cingolani e quella su “il Presidente”stiamo tornando al livello polemica Peppa Pig, che credevamo un record irripetibile. https://t.co/q9lbkHKhK5",[]
2022-10-24,1584601164900839424,Carlo Calenda,448452,Sottoscrivo. Altrimenti parliamo del nulla https://t.co/cab5MLNZb5,[]
2022-10-24,1584518259444891648,Carlo Calenda,448452,Sono due cose molto diverse. Anche io sono un fautore della scuola come luogo di apprendimento di conoscenze ampie e anche di sapere non funzionale. Ma tutti i processi sono regolati dal merito come principio di giustizia fondato sull’impegno personale. https://t.co/sCbvKau5eI,[]
2022-10-24,1584516987182493696,Carlo Calenda,448452,In nessun paese del mondo il segretario del principale sindacato si dichiarerebbe contro il merito come principio. Questa posizione ideologica spiega perché la CGIL è stata spesso negli ultimi anni un freno alla modernizzazione del paese. Spero che CISL e UIL prendano le distanze,[]
2022-10-24,1584515240024166400,Carlo Calenda,448452,"Il merito è l’unico antidoto a una società classista o a una società appiattita sull’ignoranza. Come realizzare il merito in modo giusto è un dibattito difficile e interessante, rifiutarne il principio è assurdo e antistorico. Questa presa di posizione di Landini è incredibile. https://t.co/PirTjPtimo",[]
2022-10-24,1584436212995358722,Carlo Calenda,448452,Cingolani fa benissimo a dare una mano e Meloni ha fatto altrettanto bene a chiederglielo. In una democrazia matura nessuno si sognerebbe di fare una polemica su questo.,[]
2022-10-24,1584430664694521856,Carlo Calenda,448452,Il punto rimarrà sempre lo stesso: si riuscirà a implementare qualcosa? Forse riusciremo a capire alla fine che questo continuo conflitto ideologico è solo una strategia di marketing per prendere i voti e mantenerli davanti all’inconsistenza dei risultati. A destra e a sinistra.,[]
2022-10-24,1584430031681781760,Carlo Calenda,448452,Stiamo già assistendo alla trasformazione da MSI a DC. Sulle promesse elettorali: “vorremmo realizzarle ma la situazione del paese impone responsabilità”. Su UE: “collaborazione proficua e costruttiva. La sinistra cercherà elementi  per continuare a parlare di allarme democratico,[]
2022-10-23,1584141974210510849,Carlo Calenda,448452,"Alla fine le cose buone che fai al governo sopravvivono al tuo mandato. Ed è una grande soddisfazione. 

https://t.co/o9fgLxNhRB",[]
2022-10-23,1584092262761254913,Carlo Calenda,448452,La mia intervista di ieri sera con @MaxGramel a @LeParoleRai3. https://t.co/5642UI1OMs,[]
2022-10-23,1584080721349554181,Carlo Calenda,448452,"Questa mattina, alle 10:30, sarò ospite ad #Agenda su @SkyTG24.

Aspetto i vostri commenti! https://t.co/TjSkdtljQ1",['Agenda']
2022-10-23,1584071021107126274,Carlo Calenda,448452,Due libri da leggere insieme per capire la crisi ucraina. La biografia di Short su Putin ne analizza la storia con oggettività. Il libro di @Maumol contestualizza la crisi Ucraina nel nuovo scenario delle relazioni internazionali. Entrambi scritti molto molto bene. https://t.co/9X5M7hUqpq,[]
2022-10-23,1584070063585230849,Carlo Calenda,448452,"La destra userà parole di destra per nascondere la mancanza di politiche di destra e la sinistra scenderà in piazza contro le parole di destra, per nascondere l’assenza di proposte di sinistra. L’unica vittima sarà, come sempre stato, la modernizzazione dell’Italia.",[]
2022-10-23,1584069484515823618,Carlo Calenda,448452,"La destra non toccherà i diritti, non liberalizzerà l’economia, non abolirà il RDC, metterà più soldi per le pensioni. Praticamente farà le stesse scelte che farebbe la sinistra. Più soldi pubblici e poche riforme. Lo scontro tra dx e sx sarà sulle parole, non sui fatti.",[]
2022-10-22,1583918648317870080,Carlo Calenda,448452,È il frutto delle colpe del liberismo immagino https://t.co/BXGn45wLWv,[]
2022-10-22,1583892681603706880,Carlo Calenda,448452,@AlessioPecoraro Il problema di questo posto sono gli adulti che regrediscono.,[]
2022-10-22,1583865770513244162,Carlo Calenda,448452,"Questa sera alle 21:30 sarò ospite di @MaxGramel a @LeParoleRai3 su @RaiTre.

Vi aspetto! https://t.co/1sMD2pXFfC",[]
2022-10-22,1583850677725548546,Carlo Calenda,448452,"È ora di assumerci le conseguenze del modo in cui votiamo. Se continuiamo a votare sulla base della moda del momento, andremo schiantarci e non possiamo continuare a sperare che arrivi qualcuno a sollevarci dalla responsabilità di ciò che abbiamo deciso nella cabina elettorale. https://t.co/wMBWanW113",[]
2022-10-22,1583834386386284544,Carlo Calenda,448452,"Il Governo sappia che se toccheranno i diritti o il posizionamento internazionale del Paese, la nostra opposizione sarà dura, intransigente e pregiudiziale, non solo in Parlamento. https://t.co/B47YJYdULx",[]
2022-10-22,1583830912151990272,Carlo Calenda,448452,"Berlusconi e Salvini faranno di tutto per sabotare l’operato della Meloni, come si è visto in questi giorni. Il rischio non è il fascismo, ma una coalizione disunita incapace di governare il Paese. https://t.co/D4XaTGERPb",[]
2022-10-22,1583743768393490432,Carlo Calenda,448452,Questo pomeriggio alle 15.00 sarò a Firenze alla Festa dell’Ottimismo organizzata da @ilfoglio_it. https://t.co/OuiakTwUV2,[]
2022-10-21,1583516206224396288,Carlo Calenda,448452,Condivido. Ed è anche un Churchilliano. https://t.co/VUwRzuoFxO,[]
2022-10-21,1583487233402675200,Carlo Calenda,448452,Auguri a @GiorgiaMeloni. Avere una Presidente del Consiglio donna che si è battuta con coraggio per arrivare a Palazzo Chigi con le sue sole forze è comunque un grande cambiamento per l’Italia. Saremo all’opposizione. Ma le auguriamo di avere successo per l’Italia.,[]
2022-10-21,1583486437441167360,Carlo Calenda,448452,Benvenuto a Carmine. Persona preparatissima in particolare sui finanziamenti europei. Ci aiuterà anche a livello nazionale su monitoraggio PNRR. Avanti https://t.co/pKxIaHBxT6,[]
2022-10-21,1583422873552592896,Carlo Calenda,448452,@987mies Quello che dovrebbe sapere ogni cittadino istruito e senziente.,[]
2022-10-21,1583417315638771712,Carlo Calenda,448452,@losochimisaluta Al contrario. Hitler era talmente insicuro e l’esercito così impreparato che proprio Goering lo convinse ad accettare la conferenza a Monaco.,[]
2022-10-21,1583413150980116480,Carlo Calenda,448452,La crisi dei Sudeti che portò alla seconda guerra mondiale e la crisi Ucraina hanno delle incredibili somiglianze. La storia dovrebbe insegnarci che i dittatori non si fermano con le illusioni di una pace imposta alle vittime dell’aggressione. https://t.co/Y6Z7OK12M0,[]
2022-10-21,1583393841515634690,Carlo Calenda,448452,"Siamo stati su tutti i giornali del mondo per colpa di Berlusconi. Basta! Fai un'altra cosa, e gioca con la mongolfiera. Non se ne può più. 

Dalla mia intervista a “Il cavallo e la torre” https://t.co/uDGPOWf52d",[]
2022-10-21,1583388484584165381,Carlo Calenda,448452,Augusto non diciamo fesserie. Le frasi di Berlusconi sono ignobili e le simpatie di Salvini immortalate in imperiture t-shirt. Da parte tua un “tutti devono campare” sarebbe più dignitoso. https://t.co/p7LhdBDh9q,[]
2022-10-21,1583356730443894784,Carlo Calenda,448452,Devo dire che la sobria oggettività de Il Giornale è sempre motivo di orgoglio per la nostra democrazia. Una stampa libera e priva di condizionamenti. https://t.co/5uiCTRdul3,[]
2022-10-21,1583352435782742016,Carlo Calenda,448452,Le ricadute concrete le vedremo nel dettaglio. Ma #Draghi ha fatto un ultimo capolavoro forzando il Consiglio Europeo. Ci mancherà. https://t.co/0mzhtuGTvB,['Draghi']
2022-10-20,1583186365038022656,Carlo Calenda,448452,.@MassimGiannini fa Massimo Giannini. A lui piacciono le aree rosse e le aree nere. Rendono la vita più facile al cronista. Amen https://t.co/aJ3Opky9Ap,[]
2022-10-20,1583146329358077953,Carlo Calenda,448452,Conte alle consultazioni ha chiesto che il governo “abbia un chiara posizione euro-atlantica” e contemporaneamente lo stop all’invio di armi in Ucraina che è il fondamento della posizione euro-atlantica. Suggerisco un tête-à-tête con Berlusconi. La linea è quella.,[]
2022-10-20,1583133443981991936,Carlo Calenda,448452,"Questa sera alle 20:30 sarò ospite di @MarcoDamilan a @CavalloTorre su @RaiTre.

Vi aspetto! https://t.co/NP04O7nxPA",[]
2022-10-20,1583121081636093952,Carlo Calenda,448452,Riascolta le nostre dichiarazioni: https://t.co/SmK5kq88mz,[]
2022-10-20,1583121076925521921,Carlo Calenda,448452,Ho espresso al Presidente Mattarella la nostra preoccupazione per le parole di Berlusconi sull’Ucraina e del Presidente Fontana sulle sanzioni alla Russia. Dichiarazioni del genere possono mettere in discussione la linea di politica estera dell’Italia. https://t.co/noEGvdyTdG,[]
2022-10-20,1583115247216623618,Carlo Calenda,448452,"All’ingresso del Palazzo del Quirinale per le #consultazioni col Presidente della Repubblica.

@Azione_it - @ItaliaViva https://t.co/wOO617ZJEl",['consultazioni']
2022-10-20,1583095873860702208,Carlo Calenda,448452,Questo sistema politico crea coalizioni che non riescono a governare e che con il tempo assumono posizioni sempre più estreme. In Italia manca un centro liberale e riformista. Il nostro progetto politico è cercare di ricostruire questo centro. https://t.co/kWv42wwK8J,[]
2022-10-20,1583059461685800962,Carlo Calenda,448452,"Sabato 19 novembre a Napoli riuniremo l’Assemblea Nazionale. A tre anni esatti dalla nascita di @Azione_it, faremo un punto sulla situazione del partito e proporremo la firma dell’accordo di Federazione con @ItaliaViva. Avanti con il #TerzoPolo.",['TerzoPolo']
2022-10-20,1583028409340264448,Carlo Calenda,448452,"Il Governo non si è ancora formato e Berlusconi sta già cercando di sabotarlo. La politica estera deve essere la bussola di una coalizione, se non trovano un accordo non saranno in grado governare insieme. https://t.co/TvLKDvZgls",[]
2022-10-20,1583004634720849922,Carlo Calenda,448452,@PaolaDiCaro Impensabile dolore. Ti siamo vicini. Un grandissimo abbraccio,[]
2022-10-20,1582991693397118982,Carlo Calenda,448452,Possiamo ridere dei deliri di Berlusconi. Possiamo considerarli patetici vaniloqui di un uomo privo di moralità che vuole rimanere aggrappato al palcoscenico. Ricordiamoci però che abbiamo a che fare con criminali che discutono di come affamare e distruggere una popolo. https://t.co/E8IK1IDiGq,[]
2022-10-20,1582988243058192384,Carlo Calenda,448452,"Questo fatto che si usi costantemente l’Italia come paragone negativo anche quando, come nel caso UK, i problemi sono peculiari di quel paese, è insopportabile. Noi l’Italexit non l’abbiamo fatta. Anzi a crederci c’è rimasto solo Paragone e due no vax. https://t.co/ntPqYdjlwY",[]
2022-10-20,1582973997594996736,Carlo Calenda,448452,"A ⁦@repubblica⁩ ci sono rimasti male. Già vedevano la prova del voto a La Russa in uno scambio sulle Presidenze e invece nulla. E da qui un articolo pieno di illazioni, voci e congetture. Ieri era la frattura tra me e Renzi, oggi l’accordo, udite udite, con Lupi. Avanti. https://t.co/DsIXJXYdK0",[]
2022-10-19,1582809123095449600,Carlo Calenda,448452,"@renatogiannetti No, va bene mantenere L’oggettività. Sempre. Soprattutto quando si tratta di un avversario",[]
2022-10-19,1582802427736379392,Carlo Calenda,448452,Brava https://t.co/GyqK2var87,[]
2022-10-19,1582796333161017345,Carlo Calenda,448452,Questa richiesta di escludere Forza Italia da parte dei 5S non si spiega. In fondo @GiuseppeConteIT e @berlusconi hanno più o meno la stessa posizione su Ucraina. Mancano solo le bottiglie di Vodka. https://t.co/PQlvgkXdKe,[]
2022-10-19,1582790666282991616,Carlo Calenda,448452,Tenere sempre alta l’immagine dell’Italia eh?! Grazie ⁦@berlusconi⁩ https://t.co/g5YQWogVI4,[]
2022-10-19,1582786154654359553,Carlo Calenda,448452,"Questa sera alle 21:30 sarò ospite a @controcorrentv su @rete4. 

Aspetto i vostri commenti! https://t.co/Nm561OgbkW",[]
2022-10-19,1582765607518294017,Carlo Calenda,448452,Le parole di Berlusconi confermano che @forza_italia è un partito inaffidabile e chiaramente schierato con la Russia. Il PPE dovrebbe prendere posizione e @Antonio_Tajani non dovrebbe diventare Ministro degli Esteri. Meloni non ha una maggioranza con cui poter governare. https://t.co/wC4ym94zs9,[]
2022-10-19,1582760540979752960,Carlo Calenda,448452,"Un grazie di cuore a #Draghi per aver rappresentato l’Italia in modo impeccabile. È stato chiamato ad aiutare il paese, non si è sottratto e se ne va con signorilità anche dopo essere stato sfiduciato da tre persone che non hanno un decimo delle sue qualità e del suo stile. https://t.co/E1ZI3bBuwH",['Draghi']
2022-10-19,1582758538140856321,Carlo Calenda,448452,Grazie a te Pierfrancesco https://t.co/LfRdCOWldQ,[]
2022-10-19,1582733402608144386,Carlo Calenda,448452,"Sono dati incredibili. Senza un intervento straordinario per dare una base di conoscenze anche a chi non è in età scolare, e che coinvolga anche i media, l’ignoranza, prima o dopo, distruggera’ la democrazia. https://t.co/hMjL1FdKyv",[]
2022-10-19,1582729089470779392,Carlo Calenda,448452,"Ecco perché non partecipiamo al voto. Non è rilevante il fatto di non avere una vicepresidenza, ma che non si dia adeguata rappresentanza a una delle opposizioni. Il Pd ormai ha scelto l’alleanza con i 5 Stelle. https://t.co/KWXHKdD4IV",[]
2022-10-19,1582650852908576769,Carlo Calenda,448452,"Sarà una manifestazione senza bandiere di partito. Invitiamo @pdnetwork @Piu_Europa @BeppeSala e tutte le associazioni e le personalità politiche interessate, a partecipare e organizzare con noi.",[]
2022-10-19,1582648223503896577,Carlo Calenda,448452,"Sabato 5 Novembre scenderemo in piazza a Milano per ribadire il sostegno all’Ucraina contro l’invasore russo. La pace non può nascere dalla resa degli ucraini. “Noi crediamo che la felicità sia il frutto della libertà, ma la libertà sia solo il frutto del valore”. https://t.co/ihJ00xCHLD",[]
2022-10-19,1582619808868499456,Carlo Calenda,448452,"La destra ha vinto le elezioni e deve governare. Meloni sta facendo il suo lavoro, in alcuni casi bene (prudenza nelle dichiarazioni), in altri male (Fontana e La Russa). Ma Berlusconi che fa il sabotatore e considera il governo come un suo affare privato è inqualificabile.",[]
2022-10-19,1582611034741014528,Carlo Calenda,448452,Tra l’altro abbiamo anche parlato con la giornalista per dirglielo. Amen. Se non abbracci il PD a prescindere Repubblica fa così. È una lunga storia. https://t.co/sVvBBCirEJ,[]
2022-10-18,1582442239317651456,Carlo Calenda,448452,Sottoscrivo https://t.co/kfI9tFPegD,[]
2022-10-18,1582440205155414016,Carlo Calenda,448452,Oggi: 1) La Russa ha rivendicato i busti di Mussolini; 2) Fontana si è espresso contro le sanzioni; 3) Berlusconi ha riallacciato i rapporti con Putin; 4) Gasparri contro il diritto all’aborto. Così questa coalizione non regge sei settimane altro che sei mesi. Aridatece Draghi.,[]
2022-10-18,1582430581983674369,Carlo Calenda,448452,Il vero problema è che in questo Paese nessuno vuole prendersi la responsabilità di assumere delle decisioni di governo dal momento che hanno il carico di operare nella realtà e quindi di non piacere a tutti. https://t.co/ngm6whyljc,[]
2022-10-18,1582421379483578368,Carlo Calenda,448452,"Alla presentazione dell’ultimo #libro di @Maumol. Un’occasione per riflettere sugli #imperi che non sono mai tramontati come ci dimostrano le guerre di oggi. Sono rimasti sonnolenti mentre noi, in Occidente, pensavamo che le differenze culturali e storiche non contassero nulla. https://t.co/wkEFGgbqkR","['libro', 'imperi']"
2022-10-18,1582394240356978688,Carlo Calenda,448452,"Berlusconi nomina i ministri al posto di Mattarella e dichiara di aver ""riallacciato"" i rapporti con Putin. Chissà cosa ne pensa il il ""neoministro"" Tajani che dovrebbe garantire la linea euro-atlantica. La verità è che @forza_italia è oramai un partito completamente allo sbando. https://t.co/gDIKchIWeO",[]
2022-10-18,1582368530141679616,Carlo Calenda,448452,Nessun attacco insopportabile @EnricoLetta. Ma la constatazione che avete raggiunto accordo con il M5S per spartirvi le vicepresidenze. Amen. Per quanto ci riguarda ti abbiamo mandato un piano sulla riduzione delle bollette proponendo di discuterne insieme. Aspettiamo risposta. https://t.co/NqpBCYphWx,[]
2022-10-18,1582323615181115392,Carlo Calenda,448452,"Bloccare il GRA non è accettabile, qualsiasi siano le intenzioni o i motivi della protesta. Deve intervenire la forza pubblica e denunciare gli autori. https://t.co/3qmLT7Ocrm",[]
2022-10-18,1582291781471072256,Carlo Calenda,448452,Occorre intervenire subito sulle bollette; introdurre il salario minimo; combattere le false cooperative e implementare la riforma Draghi su reddito di cittadinanza. Su tutti questi punti abbiamo fatto proposte concrete. Diamoci una mossa https://t.co/ZnPrOia1va,[]
2022-10-18,1582281308486750208,Carlo Calenda,448452,"Non è soltanto una questione di nomi o di equilibri politici. Di fronte alla crisi energetica e le incertezze del futuro, l'Italia non può permettersi un governo di basso livello.

Riascolta la mia intervista al #Tg1. https://t.co/fnw07uumMK",['Tg1']
2022-10-18,1582265254578642945,Carlo Calenda,448452,Terzi ancora no. Ma quarti in crescita. Avanti https://t.co/U5tgKbiJjI,[]
2022-10-18,1582256128339345408,Carlo Calenda,448452,"Speriamo vivamente che il disastro della Gran Bretagna su tagli di tasse in deficit, simil flat tax etc smonti qualsiasi velleità nel nuovo governo di giocare con la finanza pubblica",[]
2022-10-18,1582251223247630336,Carlo Calenda,448452,L’opposizione deve offrire un’alternativa valida e non mettere insieme un’accozzaglia senza senso con il solo scopo di combattere il governo. Deve fare proposte concrete come abbiamo fatto noi per le bollette. https://t.co/WmHJVTZb4m,[]
2022-10-17,1582078206806745089,Carlo Calenda,448452,"Certo, l'invito lo abbiamo fatto da tempo spetta a @Piu_Europa decidere. https://t.co/qrIqA8y8BF",[]
2022-10-17,1582060324928122881,Carlo Calenda,448452,"Domani mattina alle ore 8:35 sarò ospite al @Tg1Rai su @RaiUno.

Vi aspetto! https://t.co/ihEB0BhZmk",[]
2022-10-17,1582051316947644416,Carlo Calenda,448452,Il Terzo Polo procede spedito verso la formalizzazione della federazione promessa agli elettori che prevederà: coordinamento nazionale; alleanze e proposte programmatiche prese insieme. Entro novembre firmeremo. Poi cantiere per partito unico entro le europee. @matteorenzi,[]
2022-10-17,1582016617386766346,Carlo Calenda,448452,"Se @pdnetwork e @Mov5Stelle , come sembra, faranno l’accordo per spartirsi tutte le VicePresidenze di Camera e Senato destinate all’opposizione, noi non parteciperemo al voto. Se questo accordo si materializzerà, la scelta del PD in termini di alleanze sarà evidente.",[]
2022-10-17,1581939761899786240,Carlo Calenda,448452,Li abbiamo già fatti Claudio! Anzi abbiamo fatto la stessa operazione anche in Europa. Non capisco il tweet https://t.co/N5U3irjhjV,[]
2022-10-17,1581920034464698368,Carlo Calenda,448452,"Dobbiamo ricominciare a pensare alla politica come un qualcosa che è espressione di noi, ma anche della capacità di realizzare delle cose normali, di buon senso.

Riascolta la mia intervista a #CTCF. https://t.co/lJiFnZ1IO5",['CTCF']
2022-10-17,1581909546649673729,Carlo Calenda,448452,Evocare il voto a meno di un mese dalle elezioni è un record planetario. La destra non regge alla prova del Governo e l’Italia non può permettersi instabilità e confusione. Se non sono in grado di formare un governo forte la parola deve tornare a Mattarella (e a Draghi). https://t.co/XLJmOiWzOW,[]
2022-10-17,1581908104060755970,Carlo Calenda,448452,"Mentre parliamo di mirabolanti tagli di tasse e flat tax, stiamo perdendo due pilastri della democrazia: la sanità pubblica e la scuola. https://t.co/NhmWTa82cn",[]
2022-10-16,1581670103758036992,Carlo Calenda,448452,"Questa sera, a partire dalle 20:50, sarò ospite di @fabfazio a @chetempochefa su @RaiTre.

Aspetto i vostri commenti! https://t.co/83zflx8CTP",[]
2022-10-16,1581590511189516288,Carlo Calenda,448452,"Ricordare è un dovere civico. Il rastrellamento del Ghetto di Roma e la deportazione di 1259 persone è una ferita che non si potrà mai rimarginare. Per questo dobbiamo continuare a combattere senza tregua contro ogni forma di intolleranza, razzismo, antisemitismo e totalitarismo.",[]
2022-10-16,1581560365884006402,Carlo Calenda,448452,.@GiuseppeConteIT pensa a questa storia quando chiedi di disarmare gli ucraini. Perché li condanneresti a subire quello che è accaduto al direttore del teatro di Kherson. Non c’è pace senza libertà. E non puoi imporre la schiavitu’ ai popoli che non la accettano. https://t.co/n9T3OyLLwj,[]
2022-10-16,1581542894535516166,Carlo Calenda,448452,Ieri abbiamo confermato opposizione dura a questo governo e giudizio molto negativo su scelta per camera e senato. Però per ⁦@repubblica⁩ ci teniamo “le mani libere” perché non vogliamo fare l’opposizione unitaria con i 5S. Andranno avanti così per parecchio. https://t.co/4fORISgGIr,[]
2022-10-15,1581331432902840320,Carlo Calenda,448452,"Oggi interessante dibattito alla festa ⁦@HuffPostItalia⁩ con ⁦@fabiorampelli⁩ , che ad un certo punto, con maschia assertività, mi ha detto “ti sbagli, Giorgia non ha mai detto di uscire dall’Euro”. Gli ho promesso che avrei agevolato video. Eccolo. https://t.co/LVceKYu3eO",[]
2022-10-15,1581314151343095811,Carlo Calenda,448452,"Posso fare opposizione con i 5 Stelle che non vogliono armi all’Ucraina ? Certo che no. La ragione della crisi del sistema politico italiano è che si mettono insieme accozzaglie contro altre accozzaglie.

La mia risposta a Massimo Giannini sull’unità delle opposizioni. https://t.co/AQpPf9D48h",[]
2022-10-15,1581311022274469888,Carlo Calenda,448452,"La storia dell'unità delle opposizioni non esiste. Alle elezioni ci siamo presentati come tre coalizioni ben distinte. Certo, è possibile fare opposizione insieme al Pd, ma sui temi, senza commettere l’errore di mettere dentro tutto e il contrario di tutto. https://t.co/qn32zNddLY",[]
2022-10-15,1581302607301468160,Carlo Calenda,448452,In tutta la campagna elettorale la coalizione di destra non ha mai detto una cosa in comune. Credo che le difficoltà aumenteranno: su flat tax e la Fornero cosa decideranno? https://t.co/QDr6cdwoBN,[]
2022-10-15,1581297003006263296,Carlo Calenda,448452,"HUFFPOST DAY - per capire il mondo di oggi e di domani. 

Il mio intervento in diretta qui:
https://t.co/dFr5SkR3g1 https://t.co/ZP5izO9x9E",[]
2022-10-15,1581247194086379525,Carlo Calenda,448452,"Fontana e Zan non possono essere messi in alcun modo sullo stesso piano. Si possono o meno condividere le idee di Zan, ma quelle di Fontana sono discriminatorie e inaccettabili. Questo tweet non rappresenta il pensiero di Azione. https://t.co/Yearusa44c",[]
2022-10-15,1581187261819154432,Carlo Calenda,448452,"Se non ti uniformi diventi “la quarta gamba della maggioranza”. Eppure è evidente che l’opposizione comune non si può fare se non condividi la posizione sulla politica estera, energetica… Questo vale per il M5S, per il PD non è dato sapere. Il tutti contro aiuta a non scegliere. https://t.co/kydHPyhCnm",[]
2022-10-15,1581185545291825152,Carlo Calenda,448452,"Siamo passati dalla retorica del campo largo alla retorica dell’opposizione unitaria. La radice è sempre la stessa: trovare la ragione di stare insieme non nelle proposte o nei valori, ma nell’essere contro qualcuno. È la tesi del PD e dunque anche quella di Repubblica. https://t.co/D3BI4xGCII",[]
2022-10-14,1581018318667857921,Carlo Calenda,448452,"Le Istituzioni si rispettano in primo luogo eleggendo persone adatte a rappresentarle. La Russa e Fontana non lo sono, per storia personale e posizioni politiche prese e ciò non ha nulla a che fare con l’essere di destra o di sinistra. https://t.co/H0sGKuiJhS",[]
2022-10-14,1581009781250461697,Carlo Calenda,448452,"No Fabio, si conferma la certezza di fare un’opposizione intransigente e quella dell’idiozia di aver fatto cadere Draghi. Qui populisti di destra e di sinistra non trovano sponde. https://t.co/XV0XOzn5iY",[]
2022-10-14,1580989485319598080,Carlo Calenda,448452,"Brava! In questa vicenda la protervia di Berlusconi, i diktat della Ronzulli, la pretesa di ministeri utili personalmente e gli insulti, meritavano una risposta. Ciò premesso così questi non governano sei mesi. https://t.co/xVSK5DI2bf",[]
