Date,Tweet ID,Leader Name,Followers,Text,Hashtags
2022-11-27,1596893713187319808,Carlo Calenda,448452,Conte ha fatto un condono pericoloso a Ischia e cancellato l’unità di missione “Casa Italia” per l’unica ragione che l’aveva istituita @matteorenzi. Entrambi gravi errori. Ma cercare a posteriori di prendere in giro gli italiani con eloquio stile azzeccagarbugli è anche peggio.,[]
2022-11-27,1596835606910627850,Carlo Calenda,448452,@84Andreac Corretto,[]
2022-11-27,1596834475123838976,Carlo Calenda,448452,Credo sia solo becera ignoranza. Una caratteristica dei qualunquisti https://t.co/0177BAWgig,[]
2022-11-27,1596828601508405248,Carlo Calenda,448452,Infine il museo delle case romane che non avevo mai visitato e che è un gioiello. Si vede tutta la stratificazione di Roma e tra le tante sale con affreschi una del IV secolo di una modernità incredibile. https://t.co/bCsqkvHeQX,[]
2022-11-27,1596828036527443968,Carlo Calenda,448452,Piazza San Paolo della Croce d Clivo di Scauro. Costruito da Marco Emilio Scauro princeps senatus (Oggi La Russa - pensate come siamo messi). https://t.co/6UZS6IntjL,[]
2022-11-27,1596827360086487040,Carlo Calenda,448452,Stamattina ho fatto un giro al Celio meraviglioso. Vi lascio le coordinate casomai qualcuno abbia voglia di seguirle. Da piazza della navicella a Santo Stefano rotondo chiesa a pianta circolare del 400. https://t.co/fZw85wa7qU,[]
2022-11-26,1596562845281714176,Carlo Calenda,448452,È quello che coordinava il tavolo delle proposte liberali. Quando lo incontrerò in Senato ci parlerò anche io.,[]
2022-11-26,1596561779043229701,Carlo Calenda,448452,Molto vicini se non fosse che uno dei possibili candidati “terzi” si è fatto eleggere con il PD (Alleato con SI) perdendo appeal per elettorato di centro che in Lombardia è decisivo. E poi avrebbe dovuto dimettersi dopo un mese in senato. Poco serio. Spiegaglielo se lo incontri https://t.co/gu7WX4DnO1,[]
2022-11-26,1596526721477623808,Carlo Calenda,448452,"Ma ognuno si fa un’opinione sulle persone. Lo fai tu nella tua vita professionale, lo facciamo noi nella nostra. https://t.co/JPNuDaFPvU",[]
2022-11-26,1596524035009294337,Carlo Calenda,448452,Ma non mi sono “schierato con Gualtieri” ho votato Gualtieri perché rispetto a quello che parlava di Piramidi sembrava più preparato. Siamo all’opposizione di Gualtieri https://t.co/0KUW8o5RRj,[]
2022-11-26,1596483287895379972,Carlo Calenda,448452,Vicini alla popolazione di #Ischia colpita così duramente da una tragedia che lascia attoniti. Il mio pensiero e il mio ringraziamento va a chi in queste ore è al lavoro per aiutare e assistere chi è in difficoltà.,['Ischia']
2022-11-26,1596453064755511296,Carlo Calenda,448452,"Il mio intervento integrale al @Linkiesta Festival: la nostra opposizione costruttiva, la federazione del #TerzoPolo, il rapporto con PD e il giudizio su Giorgia Meloni. 

Guardalo qui: https://t.co/Q1Pbxtlt71 https://t.co/qmn70uRZFR",['TerzoPolo']
2022-11-26,1596447384879480833,Carlo Calenda,448452,Messaggio che prenderei al volo @GiorgiaMeloni https://t.co/lKro1OUyVC,[]
2022-11-26,1596447013209530368,Carlo Calenda,448452,"Non sono d’accordo. Penso che Andreotti avesse un gran senso del potere, ma nessuna ambizione di modernizzazione dell’Italia. Nella sua lunga carriera ha assunto quasi ogni posizione essenzialmente quando gli faceva comodo. Le cose dette su Ambrosoli e non solo sono imperdonabili https://t.co/Ed40h7iEdA",[]
2022-11-25,1596245012660224000,Carlo Calenda,448452,Di Meloni mi affascina che sia diventata Premier solo con le sue forze. Ma smetta di fare la sovranista cacio e pepe e faccia un lavoro serio. Sarebbe un bene per lei e per l’Italia. https://t.co/f7bV8SmaPK,[]
2022-11-25,1596233897540718593,Carlo Calenda,448452,"Bisogna farla finita con la politica “contro”. Eravamo contro Berlusconi, ed è arrivato Salvini. Contro Salvini, ed è arrivata Meloni. È il metodo a essere profondamente sbagliato. Dobbiamo cambiare questo paradigma. https://t.co/io69ySunP9",[]
2022-11-25,1596226514256805890,Carlo Calenda,448452,"Forse potreste indicare le vostre priorità senza stravolgere i saldi. Perché altrimenti non si capisce davvero su cosa avverrà l’ennesima mobilitazione. Più pensioni, più sanità, più istruzione, più reddito di cittadinanza, più assistenza, più tutto, non è politica è retorica. https://t.co/FZGDNB4rIG",[]
2022-11-25,1596219704237912065,Carlo Calenda,448452,"In rientro da un bel tour de force: Roma-Milano-Bergamo-Milano-Treviso-Milano-Roma. Inaugurazione di due gruppi consiliari, Lombardia e Treviso, e presentazioni libro. Clima molto buono. Tanto entusiasmo e tantissimi ragazzi. https://t.co/SJm0k03AtB",[]
2022-11-25,1596218347565510657,Carlo Calenda,448452,"Non abbiamo alcuna intenzione di entrare in questo governo, né di supportare la maggioranza. La nostra non sarà un’opposizione pregiudiziale. Non sarà come l’opposizione di chi incita le piazze senza mai offrire soluzioni concrete per il Paese. https://t.co/D8yV5qpMFk",[]
2022-11-25,1596214241744556035,Carlo Calenda,448452,"L’Italia non va più pensata in termini di destra vs sinistra. Appoggiare due persone che hanno fatto bene, come D’Amato e Moratti, è la scelta giusta per il #TerzoPolo. Va superata la logica per cui l’importante è non far vincere la fazione opposta. Questa per noi non è politica. https://t.co/wFHcax8cvj",['TerzoPolo']
2022-11-25,1596159056753967104,Carlo Calenda,448452,"Oggi pomeriggio il Direttore @christianrocca mi intervisterà in occasione del @Linkiesta Festival. 

Seguitemi. https://t.co/Sm7vYUTEz2",[]
2022-11-25,1596153392325619713,Carlo Calenda,448452,@AngelaVasciaveo @WelfareIta Arrivi per milionesimo,[]
2022-11-25,1596142390573768706,Carlo Calenda,448452,"“Nessun intervento per incrementare la natalità potrà incidere veramente sulla decrescita demografica se non si trasformerà il modo in cui gli uomini considerano, vivono la procreazione e il tempo della cura che un bambino richiede”.",[]
2022-11-25,1596141953145454592,Carlo Calenda,448452,"L’intervento di mia madre Cristina al @WelfareIta, interpreta i dati su natalità e calo demografico portando la donna e l’uomo al centro di un nuovo modello culturale. https://t.co/SAnUxjrtaQ",[]
2022-11-25,1596123580831760385,Carlo Calenda,448452,L’abuso d’ufficio va eliminato perché paralizza l’attività amministrativa dei sindaci. Su questo punto condividiamo la linea del Ministro Nordio.,[]
2022-11-25,1596084303536197633,Carlo Calenda,448452,Perché dati i tempi molto stretti è probabile che gli interventi parlamentari possibili siano nulli o limitatissimi https://t.co/3nvDGobcZS,[]
2022-11-25,1596084066826145792,Carlo Calenda,448452,Ma mica riferivo a Feltri. L’ho allegato perché scrive  più o meno quello che spiego nei tweet precedenti. https://t.co/GTL5yZmFVU,[]
2022-11-25,1596048474021285889,Carlo Calenda,448452,@gallofranco Come è noto io non solo non approvai quella scelta ma proposi pochi giorni prima una risoluzione alla direzione adottata all’unanimità contro alleanza con i 5S,[]
2022-11-25,1596047945702334464,Carlo Calenda,448452,https://t.co/QscxJ7bfHG,[]
2022-11-25,1596045323952078848,Carlo Calenda,448452,"Ciò che scompare è la realtà. La scuola, la sanità, il lavoro etc. Non facciamo politica in questo modo. E per quanti assurdi articoli scriverete su inciuci inesistenti noi resteremo saldamente all’opposizione facendo il lavoro che spetta all’opposizione: proporre e confrontarsi.",[]
2022-11-25,1596044878169141249,Carlo Calenda,448452,"Trent’anni che andiamo avanti con gli avversari trasformati in nemici, salvo poi farci alleanze alleanze (PD-5S), con i paroloni sulla resistenza alle destre da parte di chi non sopporta quelli che la resistenza la fanno sul serio. E intanto l’Italia declina inesorabilmente.",[]
2022-11-24,1595875140914581505,Carlo Calenda,448452,"Presentazione de “La libertà che non libera” a #Treviso.
Perché la politica non è solo “come fare un punto di PIL in più”, ma anche quello slancio ideale capace di #cambiare una società che sta perdendo la rotta. https://t.co/PzsJyc3k4v","['Treviso', 'cambiare']"
2022-11-24,1595864529736724480,Carlo Calenda,448452,Noi chiediamo di ripristinare “Industria 4.0” esattamente così com’era nel 2017 e di estenderla agli investimenti ambientali. https://t.co/SuhYkOPcNE,[]
2022-11-24,1595854009872547842,Carlo Calenda,448452,I #politici devono far diventare popolari le decisioni giuste. Non fare promesse mirabolanti che quando si è al #Governo non si possono realizzare. https://t.co/16yrSi2wd9,"['politici', 'Governo']"
2022-11-24,1595838652634267648,Carlo Calenda,448452,"Da oggi il #terzopolo sarà rappresentato anche nel Consiglio comunale di #Treviso. 
Buon lavoro a Fabio Pezzato, Roberto Grigoletto e in bocca al lupo al capogruppo Niccolò Rocco.
Per una politica pragmatica, moderata nei valori e radicale nell’azione. https://t.co/NGr5O6vZJ7","['terzopolo', 'Treviso']"
2022-11-24,1595757532735311872,Carlo Calenda,448452,"La politica deve avere capacità di proporre. Il nostro giudizio sulla manovra del governo è negativo e parlerò con @GiorgiaMeloni delle nostre proposte alternative. Da avversari, non da nemici. https://t.co/smQDtmPbbW",[]
2022-11-24,1595745466544967687,Carlo Calenda,448452,Ma poi lavorate! Stanno sempre a dichiarare cose vacue e inutili,[]
2022-11-24,1595745268028571649,Carlo Calenda,448452,Ma questi dove li hanno presi! Che vergogna https://t.co/poeCSzGSyo,[]
2022-11-24,1595679860948697088,Carlo Calenda,448452,"Così, dicono, Putin non si fermerà. Diamogli Kiev è il sottinteso nascosto sotto l’uso ipocrita e immorale della parola pace. Sono stato invitato dal sindaco di Leopoli che è intervenuto alla nostra manifestazione. Andrò il 5 dicembre in segno di solidarietà.",[]
2022-11-24,1595679573248806913,Carlo Calenda,448452,"Mentre la Russia attacca le infrastrutture energetiche per far morire di freddo e di fame milioni di ucraini, il M5S e parte del PD continuano ad attaccare l’Occidente per il sostegno all’Ucraina.",[]
2022-11-24,1595674629804367873,Carlo Calenda,448452,Per queste ragioni sono stato attaccato da tutti gli attivisti antisraeliani che sconfinano nell’antisemitismo. Attenti all’intolleranza verso posizioni diverse. Sostenere la modernità del Vangelo non può essere considerato un attacco all’ebraismo (o all’Islam).,[]
2022-11-24,1595673722006167552,Carlo Calenda,448452,Siete matti. Antisemita per aver detto che la Bibbia non può diventare il fondamento del diritto? Che il Vangelo è un testo fondamentale sulla tolleranza? Sonouno strenuo difensore non solo delle comunità ebraiche contro il razzismo ma anche del sionismo come movimento culturale. https://t.co/RdGQCMCKtl,[]
2022-11-24,1595668901387452416,Carlo Calenda,448452,@Didos73 @GiorgiaMeloni Difficile no? Proporre raramente porta a essere usati. E comunque è la condotta giusta,[]
2022-11-24,1595668339258425344,Carlo Calenda,448452,"Non ci sono oscure trame o promesse di “stampelle”, ma il normale dialogo che avviene in tutti paesi maturi tra maggioranza e opposizione che tali restano. Cerchiamo di “normalizzare” la politica italiana e di legarla ai contenuti; basta conflitto ideologico infinito. https://t.co/h0HraZdGs6",[]
2022-11-24,1595667301176860673,Carlo Calenda,448452,Incontrare il Governo sulla manovra è importante. L’opposizione non si fa andando sempre in piazza ma proponendo alternative. E la politica non è una guerra perenne tra nemici ma un confronto tra avversari nell’interesse del paese. Ringrazio @GiorgiaMeloni per la disponibilità.,[]
2022-11-23,1595497204462276608,Carlo Calenda,448452,.@GioMelandri è il Maxxi. Punto. Ha fatto un lavoro strepitoso. Dovremmo tenercela molto molto stretta.,[]
2022-11-23,1595491961254907911,Carlo Calenda,448452,"All’assemblea nazionale dell’ANCI. Strette di mano, entusiasmo ed energia. #Amministratori locali. La #politica che si confronta ogni giorno; la più bella d’Italia. https://t.co/ypWpnXqxQD","['Amministratori', 'politica']"
2022-11-23,1595479497423323136,Carlo Calenda,448452,"All’Italia manca la capacità di far accadere le cose che hanno sindaci, assessori e consiglieri. Insieme dobbiamo essere in grado di ricostruire un’area europeista,di pragmatismo,di buon senso; servono le vostre gambe e il vostro impegno quotidiano.
#AssembleaAnci #amministratori https://t.co/KpsugUN4qL","['AssembleaAnci', 'amministratori']"
2022-11-23,1595433884870639616,Carlo Calenda,448452,"Il tour di presentazione del libro “La libertà che non libera” prosegue. La prossima tappa è #Treviso, vi aspetto domani nella sala Vittorio Zanini del museo civico Luigi Bailo alle 18:30. https://t.co/LpclDNAl9e",['Treviso']
2022-11-23,1595405982057668610,Carlo Calenda,448452,Non so quale sia l’esperienza di Governo di questo signore che non conosco. Per sua informazione abbiamo pubblicato e inviato a ⁦@GiorgiaMeloni⁩ e Giorgetti i dettagli delle nostre proposte. Chiacchierare prima di informarsi porta a dire cavolate. Buon lavoro https://t.co/arPWd3Q0IB,[]
2022-11-23,1595397384200228864,Carlo Calenda,448452,"@Stefano170959 Si. Racconto breve. Contratto Mittal blindato per 4,2 mld fatto saltare da Conte e c. Promessa di nazionalizzazione e acciaio verde. Oggi vicina al fallimento. Complimenti a 5S e c",[]
2022-11-23,1595397068339683331,Carlo Calenda,448452,@DomenicaBonali C’è,[]
2022-11-23,1595397014333923329,Carlo Calenda,448452,@PlateoCristiana Se sei curiosa apri il file e leggilo,[]
2022-11-23,1595390267770781699,Carlo Calenda,448452,Unica soluzione seria. Quando provai io tutti i partiti  erano contrari. Qualche miliardo di euro buttati dopo magari si sono convinto. https://t.co/dUtAwGYbqI,[]
2022-11-23,1595389207089930241,Carlo Calenda,448452,"Più investimenti su sanità, welfare familiare, borse di studio, industria, ambiente 4.0. Priorità ai giovani su taglio delle tasse. Più efficacia nel taglio dei costi energia. Via RdC e ritorno al Rei. Questa la nostra contromanovra con numeri e coperture.
https://t.co/9u7drCcGgQ https://t.co/BhnRlehwDx",[]
2022-11-23,1595379559700086785,Carlo Calenda,448452,"La nostra contromanovra propone più investimenti, più welfare familiare, meno assistenzialismo, meno mance, più attenzione all’implementazione delle misure. Siamo disposti a parlarne insieme alla Presidente del Consiglio. Meloni eviti che il suo governo diventi quello di Salvini. https://t.co/EvmPw5gbUG",[]
2022-11-23,1595373977706418176,Carlo Calenda,448452,"Per anni avete detto di voler abolire il RdC e ora al Governo non sapete come fare. Cos'avete fatto all'opposizione? Su Flat tax l’ennesima giravolta: perché un dipendente con stesso reddito di un p.iva paga più di tre volte delle loro tasse? Qual è la logica? 
#Contromanovra https://t.co/DQ8YP9vxCI",['Contromanovra']
2022-11-23,1595366869388722176,Carlo Calenda,448452,"Trovo la manovra presentata dal Governo una grande presa in giro innanzitutto per elettori della destra, perché tutte le promesse fatte in campagna elettorale sono state disattese.
#Contromanovra #Terzopolo https://t.co/FdCudl610q","['Contromanovra', 'Terzopolo']"
2022-11-23,1595356687686197248,Carlo Calenda,448452,In diretta dalla Sala Nassirya al Senato per la presentazione della Contromanovra del Terzo Polo. https://t.co/gOPUbfox7d,[]
2022-11-23,1595341443660406785,Carlo Calenda,448452,In qualunque paese occidentale il segretario del partito avrebbe già rimosso Malan dal ruolo di capogruppo. Aspettiamo fiduciosi @GiorgiaMeloni,[]
2022-11-23,1595316751608299520,Carlo Calenda,448452,"Non capisco il senso di precipitarsi in piazza contro la manovra senza prima aver spiegato cosa faresti nella situazione data. L’opposizione ha il dovere di offrire alternative non sfilate. Ci vediamo alle 11.00 in diretta su canali social. Con proposte, numeri e coperture.",[]
2022-11-22,1595178252485775366,Carlo Calenda,448452,Il declino della democrazia italiana spiegato in un tweet https://t.co/6UuThvSeqU,[]
2022-11-22,1595138818122059777,Carlo Calenda,448452,E nulla c’entra con il principio dello stato laico che ho menzionato espressamente. Sono polemiche idiote e pretestuose.,[]
2022-11-22,1595138489829335040,Carlo Calenda,448452,"Ma sei matto! Cioè io, che sono peraltro ateo, divento antisemita se dico che il messaggio del Vangelo rappresenta un cambiamento fondamentale dal punto di vista del principio di tolleranza? Ma stai delirando? https://t.co/dQlfRNlL0m",[]
2022-11-22,1595137906594959360,Carlo Calenda,448452,Il riferimento all’antisemitismo è grave e superficiale tanto più se fatto da un giornalista e non da uno sprovveduto qualsiasi. Le mie posizioni su antisemitismo sono note.,[]
2022-11-22,1595137192040726529,Carlo Calenda,448452,"Ma che cosa c’entra. Qui si parla dell’assunzione della Bibbia come fonte del diritto. Non della religione che riguarda la sfera personale, quella culturale o di fede. Semplifico: deve la Bibbia essere applicata come testo di riferimento del legislatore come intende Malan? https://t.co/yA6K9z9E3o",[]
2022-11-22,1595134357727215616,Carlo Calenda,448452,Direi una grande presa per i fondelli. https://t.co/yPdChlGMVm,[]
2022-11-22,1595105773562265601,Carlo Calenda,448452,@franc4mente_ È una risposta superficiale. C’è un aspetto culturale e uno politico. Il Vangelo sovverte la cupezza di larghe parti del vecchio testamento e rifonda le radici dell’Occidente sul principio di tolleranza. Lo Stato laico recepisce quelle radici che non sono solo religiose.,[]
2022-11-22,1595088948325658624,Carlo Calenda,448452,La cosa inaccettabile è la presa in giro fatta soprattutto da Berlusconi verso i percettori di pensioni minime e “le nostre mamme e le nostre nonne”. Una balla elettorale spacciata ai più fragili. Vergogna. https://t.co/wgtaC4JgdC,[]
2022-11-22,1595084957831122951,Carlo Calenda,448452,Non so come qualificare queste esternazioni. Personalmente le considero indegne e sintomo di una profonda ignoranza. Se le nostre regole derivassero dal vecchio testamento non saremmo molto diversi dai talebani. Per fortuna abbiamo avuto il Vangelo e lo Stato laico https://t.co/hqCOlUDL3n,[]
2022-11-22,1595009630484283392,Carlo Calenda,448452,"Decenni di polemiche idiote e inutili. Ma quando impareremo a considerare le infrastrutture energetiche, idrauliche, di trasporto uno straordinario mezzo di tutela e valorizzazione del patrimonio artistico e naturale? Quanti Mose e Tap prima di abbandonare la cultura del NO? https://t.co/5GCw9TLdLT",[]
2022-11-22,1594981836303867905,Carlo Calenda,448452,"Il modo migliore per ricordare Roberto Maroni è dire la verità: al di là delle differenze politiche, è stato un vero uomo di Stato. E in Italia non è cosa da poco.",[]
2022-11-22,1594976531511746561,Carlo Calenda,448452,"Enrico, fare manifestazioni contro la manovra senza proporre un’alternativa è esattamente l’opposizione che la destra si augura di avere. Vi manderemo il documento di dettaglio sulle proposte per una contromanovra più equa e giusta. Lavoriamoci insieme. https://t.co/idXEdpT5rd",[]
2022-11-22,1594974562424340480,Carlo Calenda,448452,"Domani alle 11.00 in Senato presenteremo la nostra contromanovra. Mance, ammiccamenti agli evasori, riforme del RDC posticipate non sono la strada per avere un paese più giusto. NON SIETE PRONTI",[]
2022-11-22,1594973795722338306,Carlo Calenda,448452,Se dovessi elencare i principali problemi strutturali dell’Italia: 1) istruzione; 2) sanità; 3) povertà lavorativa; 4) demografia; 5) produttività; 6) giovani; 7) donne; 8) funzionamento PA; 9) evasione. Da quello che appare la manovra non incide su nessuno di questi problemi.,[]
2022-11-22,1594971973246861312,Carlo Calenda,448452,Brillante https://t.co/qoC5YWeN2w,[]
2022-11-21,1594736122336116752,Carlo Calenda,448452,"Tre anni di @Azione_it. 
Un bilancio delle sfide che abbiamo affrontato e di quelle che abbiamo davanti.
Auguri a tutti noi. https://t.co/WSIE8HIfXJ",[]
2022-11-21,1594726810410852354,Carlo Calenda,448452,"Basta eleggere i politici in base alle bandierine che hanno portato. Bisogna incominciare a scegliere per quello che hanno fatto, per le competenze e la bravura. I Cinque Stelle? L'unica certezza è che scelgono sempre quello meno bravo. https://t.co/EB7mInlLkW",[]
2022-11-21,1594693654761074690,Carlo Calenda,448452,.⁦@sbonaccini⁩ ci sono due cose che contribuiscono alla crisi del ⁦@pdnetwork⁩: buttare sempre le responsabilità su gli altri e non proporre mai nulla di preciso. Sei per revisione RDC? Contro jobs act? Per ad armi Ucraina? Dicci qualcosa di…riformista (smicit) https://t.co/6lKZ9NrfCf,[]
2022-11-21,1594663828159086592,Carlo Calenda,448452,"Oggi dalle ore 15:30 sarò ospite a @tagadala7 su @La7tv.

Seguitemi! https://t.co/yPTD4OpLLB",[]
2022-11-21,1594662006933651457,Carlo Calenda,448452,Nel mentre Salvini annuncia l’abolizione del canone e dunque la cessazione del servizio pubblico che Sangiuliano vuole invece italianizzare. Direi pochissime idee ma sempre contraddittorie.,[]
2022-11-21,1594660646284500994,Carlo Calenda,448452,Sangiuliano ha iniziato a fare il Ministro da due settimane e ha già collezionato una serie di errori e boutade che basterebbero per 3 anni. L’ultima è l’ordine (a che titolo?) impartito alla Rai di raccontare l’identità italiana. Mai per carità quella liberal o quella europea. https://t.co/pfIfknUHX1,[]
2022-11-21,1594576061601353731,Carlo Calenda,448452,@Enrico44647886 Hai settanta anni. Inneggi all’antifascismo. E scrivi queste idiozie perché ho mostrato un luogo d’arte e storia che magari qualcuno non conosce? Ma quando è accaduto che la sinistra ha iniziato a scrivere come i leghisti?,[]
2022-11-21,1594574772079411200,Carlo Calenda,448452,La Verità ? No il @Corriere adesso per cortesia un bel titolo sui Taxi del Mare. A fianco del quotidiano inno al Governo Meloni. https://t.co/w0BpMvPwoo,[]
2022-11-20,1594366048341557256,Carlo Calenda,448452,"Al di là della probabile incostituzionalità, si conferma che la Lega di Salvini è letteralmente fuori controllo. https://t.co/La7jMrM3xs",[]
2022-11-20,1594284316473032704,Carlo Calenda,448452,In un momento di pausa dell’Assemblea ieri sono andato a rivedere palazzo Serra di Cassano sede dell’Istituto di studi filosofici. Il portone del palazzo è ancora chiuso dal 1799 anno in cui Gennaro Serra fu decapitato per aver difeso la Repubblica Partenopea. https://t.co/i9PfStQFkm,[]
2022-11-19,1594034864226848768,Carlo Calenda,448452,"Insieme facciamo una politica bella; col cuore.

Grazie a tutti i nostri delegati nazionali per essere venuti da ogni parte d’Italia.
E ora, tornate sui territori e andate a prende’ voti!
#AssembleaNationale @Azione_it https://t.co/moG7dGRJSu",['AssembleaNationale']
2022-11-19,1594026914032672769,Carlo Calenda,448452,@RobertoMaritan7 @Azione_it Veramente siamo tutti eletti con i voti della nostra lista. Buffa questa cosa per cui volete difendere la democrazia senza conoscerla,[]
2022-11-19,1594026583450419200,Carlo Calenda,448452,@FrancescoSamma2 @Azione_it Ma veramente non siamo mai andati al governo. Forse prima di sparare idiozie almeno controlla,[]
2022-11-19,1594026347143335941,Carlo Calenda,448452,@Marieddutzulla @Azione_it 7.8%,[]
2022-11-19,1594023806745677824,Carlo Calenda,448452,"Oggi abbiamo fatto una bellissima assemblea nazionale in presenza con 600 persone. Una giornata di interventi di merito, dibattiti e anche posizioni diverse. Tantissimi amministratori locali e personalità della società civile. Bello fare politica così.",[]
2022-11-19,1594019413585547275,Carlo Calenda,448452,Siamo nati da tre anni Abbiamo costruito un partito vero con 30.000 tesserati. Abbiamo fatto i congressi e eletto democraticamente gli organi. Partiti dall’1% abbiamo costruito elezione dopo elezione un grande movimento. Possiamo essere fieri del nostro lavoro. ⁦@Azione_it⁩ https://t.co/VZoep62BAb,[]
2022-11-19,1593995580664971264,Carlo Calenda,448452,Eletta ⁦@mara_carfagna⁩ Presidente Nazionale di ⁦@Azione_it⁩. Buon lavoro a lei a al mio amico fraterno e cofondatore del partito ⁦@MatteoRichetti⁩ per il suo nuovo incarico di capogruppo. https://t.co/tmTZrwaqki,[]
2022-11-19,1593992327126986752,Carlo Calenda,448452,Approvato il mandato per chiudere l’accordo di federazione con ⁦@ItaliaViva⁩. Adesso tocca a voi ⁦@matteorenzi⁩. Avanti https://t.co/Z9J7qT6R33,[]
2022-11-19,1593991135306956801,Carlo Calenda,448452,"Ma soprattutto siccome il grossista rimane con l’attuale aliquota, aumenta il prezzo finale per recuperare il differenziale iva. https://t.co/BPZ9iMnhkI",[]
2022-11-19,1593979284733001728,Carlo Calenda,448452,"Le #rivoluzioni che non rivoluzionano mai niente; il pragmatismo che manca; le idiozie che ascoltiamo…

#AssembleaNazionale https://t.co/hZCMY1j3I0","['rivoluzioni', 'AssembleaNazionale']"
2022-11-19,1593939349783060480,Carlo Calenda,448452,"Uno dei problemi cardine del nostro #Paese è la memoria corta per cui di niente resta traccia dentro noi.

#AssembleaNazionale https://t.co/JGmxFAvRCP","['Paese', 'AssembleaNazionale']"
2022-11-19,1593936344799117313,Carlo Calenda,448471,"Il mio sentito ringraziamento ai #militanti di @Azione_it che in questi anni hanno combattuto, spesso in situazioni complicate e difficili, con coraggio e passione.
Senza di voi, non saremmo qui. #Grazie 

#AssembleaNazionale https://t.co/q9Qn4FK1gU","['militanti', 'Grazie', 'AssembleaNazionale']"
2022-11-19,1593920648006492161,Carlo Calenda,448471,Oggi eleggeremo @mara_carfagna presidente di @Azione_it. È una persona competente che ci aiuterà a parlare al Sud. C'è un lavoro da fare per recuperare la rappresentanza perché il Mezzogiorno non deve essere condannato all'assistenzialismo. Sarà questa la nostra priorità.,[]
