Date,Tweet ID,Leader Name,Followers,Text,Hashtags
2022-11-26,1596552322905440256,Giuseppe Conte,1176398,Domani sarò ospite di Lucia Annunziata a #mezzorainpiu. In diretta dalle 14.30 su @RaiTre. https://t.co/vX3oOBvX8m,['mezzorainpiu']
2022-11-26,1596459955611402242,Giuseppe Conte,1176398,"Le immagini che giungono da #Ischia, sferzata stanotte da un violento nubifragio, sono terribili. Siamo vicini alle popolazioni coinvolte, in un territorio già in passato colpito da simili sciagure. Grazie a coloro che da ore stanno prestando soccorso. https://t.co/texsoWLwh5",['Ischia']
2022-11-24,1595839198832967680,Giuseppe Conte,1176398,"In pandemia Giorgia Meloni chiedeva al mio Governo 1000 euro per tutti con un click. Alla sua prima manovra, in piena emergenza energetica, mette in ginocchio gli italiani. https://t.co/g4AmhUekyF",[]
2022-11-24,1595778629090304001,Giuseppe Conte,1176398,Il tempo della propaganda è finito. https://t.co/q0YAkUINMB,[]
2022-11-24,1595739502470897666,Giuseppe Conte,1176398,L’austerity meloniana renderà felici solo evasori e corrotti. Qui di seguito la mia intervista di oggi al Corriere della sera: https://t.co/Dg14DOD2AA https://t.co/2HyUN38v7i,[]
2022-11-23,1595524464627834896,Giuseppe Conte,1176398,"La manovra della Meloni? Zero coraggio, zero crescita e tanta ingiustizia sociale! Ne ho parlato poco fa a #Controcorrente, ecco il video integrale dell’intervista: https://t.co/MYacSBRmF3 https://t.co/Om2vml4mzo",['Controcorrente']
2022-11-23,1595402847205597186,Giuseppe Conte,1176398,"Questa sera a #controcorrente, vi aspetto https://t.co/DvPwooXyg7",['controcorrente']
2022-11-22,1595098668335513612,Giuseppe Conte,1176398,Sarà battaglia. https://t.co/6kxvqY9MbJ,[]
2022-11-22,1595030502964076546,Giuseppe Conte,1176398,"Ci avevano raccontato di essere ‘pronti’, eppure la legge di bilancio si conferma una manovra davvero misera che, incapace di rispondere al disagio del Paese, apre una guerra agli ultimi: https://t.co/Rg20kIHCV4 https://t.co/OWqYCtt9Mi",[]
2022-11-22,1594981259096334339,Giuseppe Conte,1176398,Con Roberto Maroni se ne va uno dei protagonisti della politica degli ultimi 30 anni. Il @Mov5Stelle esprime vicinanza al dolore dei suoi cari e della sua comunità politica.,[]
2022-11-21,1594792168551768065,Giuseppe Conte,1176398,https://t.co/9bNsCO5BHT,[]
2022-11-21,1594724173883973632,Giuseppe Conte,1176398,Oggi è la #GiornataNazionaleDegliAlberi. Una giornata importante per il @Mov5Stelle e per tutti i cittadini che hanno a cuore l’ambiente. https://t.co/JiufSO9rap,['GiornataNazionaleDegliAlberi']
2022-11-19,1593970068945522689,Giuseppe Conte,1176398,"È venuto a mancare Riccardo Del Punta. Abbiamo lavorato per anni insieme, nello stesso Dipartimento fiorentino. Valentissimo studioso di diritto del lavoro. Collega e amico sempre disponibile, pronto ad affrontare anche i problemi più complessi con un filo di sorriso.",[]
2022-11-19,1593937564288700416,Giuseppe Conte,1176398,"Viaggio in prima classe per evasori e corrotti, un tuffo senza paracadute nel precipizio sociale ed economico per lavoratori e famiglie povere. È l’Italia che ha in mente Giorgia Meloni. Siamo pronti a un'opposizione fortissima in tutte le sedi, nelle Istituzioni e nel Paese. https://t.co/9bLL8jm5F2",[]
2022-11-18,1593550987108782083,Giuseppe Conte,1176398,https://t.co/AYcFYUXtVN,[]
2022-11-17,1593375772684812288,Giuseppe Conte,1176398,La mia intervista di questa sera a #PiazzaPulita: https://t.co/Ujp80bULc9 https://t.co/DmWNZUMQjO,['PiazzaPulita']
2022-11-17,1593281248293707776,Giuseppe Conte,1176398,Ci riproveranno nella legge di bilancio. Noi daremo battaglia perché ci si preoccupi di famiglie e imprese in difficoltà e non di come creare praterie per l'illegalità.,[]
2022-11-17,1593281246838366208,Giuseppe Conte,1176398,"Il Governo Meloni non si era accorto che girare con 5mila euro in contanti in una valigetta non è l'urgenza per un cittadino comune. Sicuramente lo è per evasori, corrotti e criminalità organizzata.",[]
2022-11-17,1593281244367822850,Giuseppe Conte,1176398,"Ennesima figuraccia del Governo. 

L'innalzamento del tetto al contante viene depennato all'ultimo dal Decreto Aiuti perché mancano i requisiti di urgenza previsti dal decreto legge. https://t.co/cLNMNKEAUN",[]
2022-11-17,1593203005918425089,Giuseppe Conte,1176398,Questa sera sarò ospite a #PiazzaPulita. Dalle 21.15 su La7. https://t.co/iJ96DT5gEW,['PiazzaPulita']
2022-11-16,1592953933794004992,Giuseppe Conte,1176398,https://t.co/B7nTurvIhA,[]
2022-11-16,1592847396639494144,Giuseppe Conte,1176398,https://t.co/l32fhffA4a,[]
2022-11-15,1592443123455905793,Giuseppe Conte,1176398,Oggi è una giornata importante per il @Mov5Stelle: prendono vita i gruppi territoriali! Ecco il mio messaggio per voi ⤵️ https://t.co/WyjZftqilW,[]
2022-11-13,1591903733910491137,Giuseppe Conte,1176398,"Poco fa a #ZonaBianca, ecco il video: https://t.co/9Ugc7Ej0JW https://t.co/KLhBd4e2Nf",['ZonaBianca']
2022-11-13,1591768074000162818,Giuseppe Conte,1176398,Questa sera a #ZonaBianca https://t.co/BfYFLzQzqJ,['ZonaBianca']
2022-11-11,1591104345747210243,Giuseppe Conte,1176398,"Le politiche inadeguate della destra non si combattono con gesti inqualificabili come questo. Si combattono democraticamente nelle istituzioni e nelle piazze, senza mollare un centimetro.",[]
2022-11-11,1591104341997670400,Giuseppe Conte,1176398,"La protesta a Bologna contro il Governo e il Presidente Meloni è pienamente legittima. Manifestare, fischiare, dissentire rientra nel quadro di una lotta politica. Farlo appendendo un manichino con il Premier a testa in giù è una forma di protesta dal sapore fortemente violento. https://t.co/xLlI9CKsA7",[]
2022-11-11,1591069840005271554,Giuseppe Conte,1176398,https://t.co/SvcGnILAlr,[]
2022-11-11,1591027006401302528,Giuseppe Conte,1176398,"Accetto le scuse del Ministro Crosetto per i suoi insulti nei miei confronti andati in onda ieri sera in tv, ma veniamo a questioni più serie: perché il Governo ha deciso di escludere la voce del Parlamento su armi e guerra? Gli italiani hanno il diritto di sapere.",[]
2022-11-10,1590793069166702592,Giuseppe Conte,1176398,Oggi il @Mov5stelle ha portato in Aula 100mila voci scese in piazza a Roma per dire che le armi e la guerra non sono l'unica soluzione possibile. https://t.co/fnWO0ycv36,[]
2022-11-10,1590717954861465600,Giuseppe Conte,1176398,"Felici che la nostra Alessia Piperno faccia finalmente ritorno in Italia per riabbracciare famiglia e amici, dopo settimane di detenzione in Iran. Grazie a chi ha lavorato in silenzio per arrivare al lieto esito di questa vicenda.",[]
2022-11-08,1590102284532580353,Giuseppe Conte,1176398,Poco fa su @Rai3 la mia intervista con Bianca Berlinguer e Paolo Mieli a #Cartabianca. Vi ripropongo qui il video: https://t.co/Uemzpqb198 https://t.co/sqE2xoiaW4,['Cartabianca']
2022-11-08,1590036271665401856,Giuseppe Conte,1176398,"Insomma, la Presidente Meloni ci ha detto che avrebbe fatto di tutto per aiutare gli italiani, ma alla prima occasione utile ha voltato loro le spalle. 

La linea di questo Governo è molto chiara: forti coi deboli, deboli con i forti. 4/4",[]
2022-11-08,1590036269610196992,Giuseppe Conte,1176398,Oggi il Governo ha infatti bocciato ben due emendamenti del @Mov5Stelle sugli extraprofitti: il primo per aumentare dal 25 al 40% il contributo a carico delle società energetiche; il secondo per estenderlo anche ai colossi farmaceutici e assicurativi. 3/4,[]
2022-11-08,1590036267739525122,Giuseppe Conte,1176398,"Recuperare gli extraprofitti maturati da chi ha speculato sulla crisi e prendere quei soldi per aiutare subito famiglie e imprese in ginocchio per il carobollette? Il Governo Meloni dice ‘no, grazie’. 2/4",[]
2022-11-08,1590036265717878784,Giuseppe Conte,1176398,"Tagliare i sostegni a chi ha perso il lavoro e rischia di finire in povertà? Il Governo Meloni non si fa scrupoli.

Facilitare la vita di evasori e corrotti che girano con valigette piene di contanti? Il Governo Meloni lo ha già annunciato: lo farà in legge di bilancio. 1/4",[]
2022-11-08,1590007954425593856,Giuseppe Conte,1176398,In diretta dalla sede del @Mov5Stelle: https://t.co/bSIcWB3h6w,[]
2022-11-08,1589977536938639362,Giuseppe Conte,1176398,"Giuseppe Bono è stato interprete e simbolo dell’eccellenza industriale italiana, un uomo animato da grande passione e visione lungimirante. La sua scomparsa è una grave perdita per l’intero Paese. Esprimo, anche a nome del @Mov5Stelle, sincero cordoglio ai suoi familiari.",[]
2022-11-08,1589947229225201666,Giuseppe Conte,1176398,Oggi pomeriggio terrò una conferenza stampa. Potrete seguirla dalle 16.30 in diretta sui miei canali. A più tardi! https://t.co/ZVV13NBOGc,[]
2022-11-08,1589911483533918208,Giuseppe Conte,1176398,"Questa sera su @RaiTre, vi aspetto! #cartabianca https://t.co/W7hHsyXCbi",['cartabianca']
2022-11-07,1589693364638973952,Giuseppe Conte,1176398,Sull’ambiente non si torna indietro. https://t.co/q5TJJjItSX,[]
2022-11-05,1588993082779119617,Giuseppe Conte,1176398,Esprimo profondo cordoglio a nome mio e del @Mov5Stelle per la tragedia causata dall’elicottero precipitato ad Apricena (Foggia). Rivolgo un pensiero di profondo affetto ai familiari delle vittime e un sincero ringraziamento ai soccorritori che si sono mobilitati senza esitazione,[]
2022-11-05,1588966784245592065,Giuseppe Conte,1176398,"Ognuno di noi è chiamato a fare la sua parte: il @Mov5Stelle era nelle strade di Roma, al fianco dei cittadini e continuerà ad opporsi a chi si ostina a raccontarci che le armi sono l’unica soluzione possibile. https://t.co/Zcqu4Cln8l",[]
2022-11-05,1588966776280616960,Giuseppe Conte,1176398,"Donne e uomini, giovani e anziani: uniti dall’unica convinzione che la soluzione al conflitto in Ucraina deve ripartire da un negoziato.",[]
2022-11-05,1588966772572819456,Giuseppe Conte,1176398,"Questa è una voce che i governi non possono ignorare e devono ascoltare. Tantissime persone, una mobilitazione imponente che ha gridato la voglia e la necessità di #PACE. https://t.co/7bDvq84jFf",['PACE']
2022-11-05,1588885901320814592,Giuseppe Conte,1176398,Non è il momento di restare inermi. Per questo oggi siamo in piazza al fianco di migliaia e migliaia di cittadini per dire la cosa più semplice e potente: #PACE. https://t.co/jWchGJKF8x,['PACE']
2022-11-05,1588854524479148032,Giuseppe Conte,1176398,https://t.co/oTq9Uqa5av,[]
2022-11-04,1588644654249312256,Giuseppe Conte,1176398,"""Basta alle trivellazioni, basta all’inquinamento del nostro mare e basta a un governo ipocrita e servo dei poteri forti"". Per commentare le decisioni del suo Governo prendiamo in prestito le sue parole del 2016, Presidente Meloni. Non avremmo saputo dirlo meglio. https://t.co/JkXrfUyyuF",[]
2022-11-03,1588284316039401472,Giuseppe Conte,1176398,La mia intervista di poco fa a #DrittoeRovescio: https://t.co/CcRCI0KBiU https://t.co/WRdRJntEL2,['DrittoeRovescio']
2022-11-03,1588224016271171584,Giuseppe Conte,1176398,"Oggi lungo e proficuo confronto con David Card, premio Nobel per l’economia 2021, sulle nuove sfide del mercato del lavoro e, in particolare, sul #salariominimo al fine di rafforzare la tutele dei lavoratori e, nel contempo, rendere più produttivo il sistema economico italiano. https://t.co/gpuhdFpiIl",['salariominimo']
2022-11-03,1588110872068636674,Giuseppe Conte,1176398,Vi aspetto questa sera a #drittoerovescio. Non mancate! https://t.co/nae347fV8p,['drittoerovescio']
2022-11-02,1587853002957885442,Giuseppe Conte,1176398,"Dopo la pandemia il @Mov5Stelle ha garantito un aumento in busta paga agli operatori sanitari che erano in prima linea contro il Covid. Oggi, con la firma del contratto collettivo nazionale del comparto sanitario, questo contributo diventerà realtà per circa 550mila dipendenti.",[]
2022-11-02,1587758157727764481,Giuseppe Conte,1176398,Ma non erano ‘pronti’? https://t.co/IwE6qnVy6x,[]
2022-11-01,1587504078283735042,Giuseppe Conte,1176398,Una norma da “Stato di polizia”: https://t.co/56YObw7AiJ,[]
2022-10-30,1586862080816185345,Giuseppe Conte,1176398,Complimenti a @LulaOficial per la sua nuova elezione a Presidente. Il popolo brasiliano ha scelto la strada della giustizia sociale e climatica ed oggi rialza la testa per guardare con fiducia alle grandi sfide globali. Bom trabalho!🇧🇷 https://t.co/bVexKp31VI,[]
2022-10-29,1586289115988865025,Giuseppe Conte,1176398,"“Il Brasile, amalo o lascialo”. Le parole del grande Jorge Amado, alla vigilia del voto brasiliano, ci ricordano che la sfida di @LulaOficial per rilanciare equità, giustizia sociale e ambientalismo parla ai progressisti di tutto il mondo. Boa sorte!🇧🇷
#LulaPresidente",['LulaPresidente']
2022-10-29,1586261237423538176,Giuseppe Conte,1176398,"Ieri sera sono stato ospite a #AccordiEDisaccordi, qui di seguito il video integrale della mia intervista: https://t.co/1WaI12EGiX https://t.co/ig7ydnfbQP",['AccordiEDisaccordi']
2022-10-28,1586028722372874240,Giuseppe Conte,1176398,"Sissignora! Gradiremmo sapere da Palazzo Chigi anche come vuole sostenere famiglie e imprese sul carobollette, visto che “il” Presidente del Consiglio nel suo discorso di fiducia non ci ha dato nemmeno un indizio. https://t.co/wyge0UOv6N",[]
2022-10-28,1585940476196139009,Giuseppe Conte,1176398,Ci vediamo questa sera su @nove per #accordiedisaccordi 📺 https://t.co/9O3ayLbnBA,['accordiedisaccordi']
2022-10-28,1585875270187118592,Giuseppe Conte,1176398,https://t.co/HC1JtB7XAz,[]
2022-10-27,1585716877074255872,Giuseppe Conte,1176398,Carobollette? Contratti precari? Salari troppo bassi? Giorgia Meloni ha trovato la soluzione ai vostri problemi: alzare il tetto dei contanti a 10mila euro! https://t.co/42F7SHxK6x,[]
2022-10-27,1585678239409766405,Giuseppe Conte,1176398,. https://t.co/RHxX9cABlX,[]
2022-10-27,1585609872040665091,Giuseppe Conte,1176398,Proprio così. https://t.co/v9BYViutjF,[]
2022-10-26,1585275473462005762,Giuseppe Conte,1176398,Il mio intervento oggi al #SaloneDellaGiustizia: https://t.co/xK0vaconIi https://t.co/VGY7gwR2qQ,['SaloneDellaGiustizia']
2022-10-26,1585218565346537472,Giuseppe Conte,1176398,"A proposito di merito, Presidente Meloni https://t.co/EyyxanrDlw",[]
2022-10-25,1584959569041960960,Giuseppe Conte,1176398,"Dichiarazione di voto, discussione sulla fiducia al Governo: https://t.co/boITp0e1z1 https://t.co/MENPBb75nM",[]
2022-10-25,1584948057384157190,Giuseppe Conte,1176398,In diretta della Camera dei deputati: https://t.co/4H52Up9E9y,[]
2022-10-25,1584937207202078722,Giuseppe Conte,1176398,Alle 18.30 circa interverrò in diretta dalla Camera dei deputati https://t.co/uut9rCLed0,[]
2022-10-25,1584866661022453760,Giuseppe Conte,1176398,"Dalla Presidente Meloni oltre un’ora di vuota retorica, condita da tanti slogan demagogici e i soliti richiami culturali della destra. I cittadini però non hanno ascoltato una sola parola su soluzioni per carobollette e crisi energetica. 
Meno male che erano ‘pronti’.",[]
2022-10-24,1584603099783913472,Giuseppe Conte,1176398,"Domani pomeriggio, intorno alle 18, interverrò alla Camera dei deputati in occasione della fiducia al nuovo governo. Potrete seguirmi in diretta streaming sui miei canali e su quelli del @Mov5Stelle. https://t.co/FqXGmYlGyY",[]
2022-10-23,1584100102842433536,Giuseppe Conte,1176398,https://t.co/fZCYco74hC,[]
2022-10-21,1583512245505753090,Giuseppe Conte,1176398,https://t.co/qOaNIGVZ7e,[]
2022-10-21,1583404502237208578,Giuseppe Conte,1176398,https://t.co/I3hMbBYYTM,[]
2022-10-20,1583138022220238848,Giuseppe Conte,1176398,In diretta dal Quirinale: https://t.co/f3DryVPPdJ,[]
2022-10-19,1582785783680839681,Giuseppe Conte,1176398,Il centrodestra continua a minare l'immagine dell'Italia. Le parole di Berlusconi sulla guerra in Ucraina e su Putin sono gravi e inaccettabili. Forza Italia non può esprimere la guida della Farnesina del prossimo governo. Porteremo questa preoccupazione al Presidente Mattarella. https://t.co/Yf0rkXnoRW,[]
2022-10-19,1582631752077541376,Giuseppe Conte,1176398,"Sabato 5 novembre scenderemo in piazza a Roma insieme a tante associazioni e a tantissimi cittadini. Tacciano le armi, è ora di farci sentire con una sola voce per la pace. https://t.co/cfG5bdmOYW",[]
2022-10-18,1582454177099223041,Giuseppe Conte,1176398,"La proposta di legge di Gasparri contro l'aborto, Berlusconi in luna di miele con Putin: se vogliono guidare l'Italia in questa direzione andranno a sbattere contro un muro. Noi.",[]
2022-10-18,1582404107955863553,Giuseppe Conte,1176398,".@FloridiaBarbara e @FraSilvestriM5S sono i nostri capigruppo, rispettivamente al Senato e alla Camera. Siamo pronti a fare un’opposizione intransigente e senza sconti nell’esclusivo interesse dei cittadini. https://t.co/1HRdilPX9L",[]
2022-10-16,1581575550178426880,Giuseppe Conte,1176398,Questo anniversario non ci sfida a un mero esercizio di ricordo. È semmai monito affinché nelle Istituzioni e nelle nostre piazze e nelle nostre strade non sia mai abbassata la guardia contro un revanscismo culturale che ammicca a vecchie nostalgie. #16ottobre1943 https://t.co/xEzefAJRSg,['16ottobre1943']
2022-10-15,1581358904163807233,Giuseppe Conte,1176398,"Solidarietà a Paola #Egonu, orgoglio italiano, fuoriclasse dentro e fuori il campo di volley. Le becere parole che le sono state rivolte non qualificano lei ma gli squallidi individui che le hanno pronunciate. Il @Mov5Stelle e tutta Italia sono dalla tua parte, avanti Paola! https://t.co/Ql975EE1dX",['Egonu']
2022-10-15,1581273734253400065,Giuseppe Conte,1176398,Complimenti a @PpBombardieri per la sua rielezione a segretario della @UILofficial. Ora lavoriamo insieme per affrontare le molte sfide che il nostro Paese ha di fronte a partire dal salario minimo e dalla riduzione del tempo di lavoro a parità di salario.,[]
2022-10-15,1581170912145330178,Giuseppe Conte,1176398,"Ieri sera sono stato ospite per una breve intervista al #MaurizioCostanzoShow, vi ripropongo qui di seguito il video: https://t.co/pCrt6xWTlM
Buona giornata a tutti voi. https://t.co/3ZB3w7mmqE",['MaurizioCostanzoShow']
2022-10-14,1581010709176938497,Giuseppe Conte,1176398,https://t.co/D0ko4rDGXK,[]
2022-10-14,1580895061046272000,Giuseppe Conte,1176398,Questa sera sarò ospite al Maurizio Costanzo Show. Dalle 23.50 su Canale 5 📺 https://t.co/QuBlij4JLS,[]
2022-10-13,1580502643402690561,Giuseppe Conte,1176398,Ci impegneremo con tenacia e coraggio affinché nessuno venga dimenticato e lasciato indietro. Lo faremo in ogni giorno di questa nuova legislatura.,[]
2022-10-13,1580502640353738753,Giuseppe Conte,1176398,"""Non c'è un momento da perdere: dalle istituzioni democratiche deve venire il segnale chiaro che nessuno verrà lasciato solo, prima che la paura e la rabbia possano raggiungere i livelli di guardia e tracimare"". 

Grazie Liliana Segre. https://t.co/j57VqfIreg",[]
2022-10-11,1579934278124974081,Giuseppe Conte,1176398,"Serietà e dedizione non bastano, non sono sufficienti. Serve qualcosa in più, serve coraggio!

Buona legislatura a tutta la comunità del @Mov5Stelle! https://t.co/pyg9S9qwFn",[]
2022-10-11,1579830651465142273,Giuseppe Conte,1176398,Il mio intervento questa mattina all’assemblea dei gruppi parlamentari del @Mov5Stelle: https://t.co/hhLJ5qsjK7 https://t.co/0DF1diPIqj,[]
2022-10-10,1579407550919110657,Giuseppe Conte,1176398,"Siamo già fuori tempo, non permettiamo che sia troppo tardi.",[]
2022-10-10,1579407548859711489,Giuseppe Conte,1176398,"L’unica strada che può portarci a una via d’uscita rispetto a un conflitto che sta sfuggendo di mano e sta assumendo ogni giorno proporzioni sempre più vaste e incontrollabili è imprimere una svolta, seria e stringente, in direzione di un negoziato di pace.",[]
2022-10-10,1579407544938024960,Giuseppe Conte,1176398,"Condanniamo con forza l'azione della Russia, attacchi e missili sulle città, la morte e la devastazione fra i civili. Ora più che mai è urgente che l'Europa prenda in mano la situazione per fermare questa follia fatta di attacchi, vendette, azioni e reazioni che si chiama guerra. https://t.co/zYkFNligot",[]
2022-10-09,1579050990749130753,Giuseppe Conte,1176398,Oggi ricorre la giornata per le vittime del lavoro. Ognuna di queste vite spezzate rappresenta una ferita profonda per tutti noi. La sicurezza sul lavoro sia priorità della nuova legislatura. Serve un grande patto fra politica e parti sociali. Il M5S è pronto a fare la sua parte.,[]
2022-10-05,1577583410075279362,Giuseppe Conte,1176398,Pronti a fare la nostra parte https://t.co/lX1IJsUC8l,[]
2022-10-04,1577232800633061379,Giuseppe Conte,1176398,"I valori della giustizia sociale, della lotta alla corruzione, della tutela del lavoro, dell'ambiente e della pace sono sotto attacco. Oggi più che mai serve il @Mov5Stelle a difenderli. 

Tanti auguri Movimento, lunga vita al Movimento! https://t.co/IxbcQ0FbEs",[]
2022-10-03,1576849278231752705,Giuseppe Conte,1176398,https://t.co/1qbrRHpaXt,[]
2022-10-02,1576528867950747648,Giuseppe Conte,1176398,"Auguri a tutti i nonni, che sono una bussola per la nostra vita. #FestaDeiNonni https://t.co/OJ2sDik9Zw",['FestaDeiNonni']
2022-09-29,1575545162184667141,Giuseppe Conte,1176398,Servono subito aiuti e un Recovery Fund europeo come in pandemia.,[]
2022-09-29,1575544161167675407,Giuseppe Conte,1176398,"Il nuovo Governo non si è ancora insediato e già si litiga su posti e caselle, anziché pensare subito a un piano di intervento contro un aumento delle bollette del 60%. In Germania si investono 200 miliardi per salvare imprese e famiglie. https://t.co/5p3ma5EnnQ",[]
2022-09-26,1574463378470440971,Giuseppe Conte,1176398,"Non permetteremo a nessuno di toccare le nostre riforme contro la precarietà, le disuguaglianza, la corruzione. Non molleremo di un centimetro. https://t.co/4yxYzDmM90",[]
2022-09-26,1574430313354240005,Giuseppe Conte,1176398,Conferenza stampa in diretta da Roma: https://t.co/g2OSGAJVh2 https://t.co/GSl4edtv2s,[]
2022-09-26,1574400654575034368,Giuseppe Conte,1176398,Alle 17.30 conferenza stampa in diretta streaming. Vi aspetto! https://t.co/8ZPeEYVrEc,[]
2022-09-26,1574201641141563392,Giuseppe Conte,1176398,In diretta dalla sede del @Mov5Stelle: https://t.co/ME0mEPeryj https://t.co/QtKse55sM0,[]
