Date,Tweet ID,Leader Name,Followers,Text,Hashtags
2022-09-05,1566886541347127304,Giuseppe Conte,1176398,Si riparte! Direzione Lombardia e Piemonte. Sempre #dallapartegiusta https://t.co/7HjhLDROAn,['dallapartegiusta']
2022-09-05,1566726162361061377,Giuseppe Conte,1176398,Questa sera a #PortaAPorta https://t.co/P3YxphYymq,['PortaAPorta']
2022-09-05,1566670268042563585,Giuseppe Conte,1176398,Fra poco su @RadioCapital_fm #breakfastclub,['breakfastclub']
2022-09-04,1566519263711707139,Giuseppe Conte,1176398,Nei ritagli di tempo una delle cose più piacevoli è giocare a calcio con mio figlio Niccolò https://t.co/Apr6UAF0Q2,[]
2022-09-04,1566456200140554241,Giuseppe Conte,1176398,"Spiace che Repubblica si sia offesa perché sono intervenuto a Cernobbio solo in collegamento per ribadire ciò che tutti gli italiani sanno: che non esiste una ""agenda Draghi"" e che il ""metodo Draghi"" rifiuta il confronto politico e poi conduce allo stallo: https://t.co/tL5eG6G3jg https://t.co/P8HxpMQYp7",[]
2022-09-04,1566441869504135170,Giuseppe Conte,1176398,In memoria di Angelo Vassallo. Sempre dalla parte della legalità #dallapartegiusta https://t.co/zWMxcHoIiW,['dallapartegiusta']
2022-09-04,1566377764889960450,Giuseppe Conte,1176398,Grazie Avellino! #DallaParteGiusta https://t.co/RmYyiaZBv9,['DallaParteGiusta']
2022-09-04,1566312209063477248,Giuseppe Conte,1176398,"Una serata emozionante ieri per le strade di Salerno. Vi ringrazio di cuore! Ci vediamo questa mattina, intorno alle 10, ad Avellino. A più tardi! #dallapartegiusta https://t.co/jtPKYLEFj9",['dallapartegiusta']
2022-09-03,1566125835479924737,Giuseppe Conte,1176398,Ci vediamo domani mattina ad Avellino! #dallapartegiusta https://t.co/Oj5NQtzZl1,['dallapartegiusta']
2022-09-03,1566113816232038403,Giuseppe Conte,1176398,"La politica deve toccare con mano queste storie, deve ascoltare e agire, a fianco di chi non ha voce. #dallapartegiusta",['dallapartegiusta']
2022-09-03,1566113813593837568,Giuseppe Conte,1176398,"""Questo posto ci ha salvato"". È stato emozionante oggi a Barra, nella periferia di #Napoli, poter incontrare ragazze e ragazzi del ""tappeto di Iqbal"", che si riscattano con l'impegno, il talento, la voglia di fare. Allontanando le scorciatoie del malaffare e della criminalità. https://t.co/c6j6kEm1pL",['Napoli']
2022-09-03,1566084602548060162,Giuseppe Conte,1176398,"Un affetto incontenibile in una città che ogni giorno lotta per il riscatto con la sua bellezza, la sua forza, il suo entusiasmo. Grazie Napoli! #dallapartegiusta https://t.co/d0v2EJAtbD",['dallapartegiusta']
2022-09-03,1565972753567596546,Giuseppe Conte,1176398,Giorgia Meloni e i suoi amici non difendono gli italiani e l'interesse nazionale. Io non dimentico ⤵️ https://t.co/HiNmCv0IgY,[]
2022-09-02,1565811135735107584,Giuseppe Conte,1176398,"Grazie Manfredonia, con cuore e coraggio #dallapartegiusta! https://t.co/DcYEmokEG1",['dallapartegiusta']
2022-09-02,1565791960866213897,Giuseppe Conte,1176398,In diretta da Manfredonia: https://t.co/ilSf6qLUrb #DallaParteGiusta https://t.co/BaEf939OyX,['DallaParteGiusta']
2022-09-02,1565741440700977152,Giuseppe Conte,1176398,"Domani in Campania, vi aspetto! #dallapartegiusta https://t.co/mJstRiWqcg",['dallapartegiusta']
2022-09-02,1565734229442543617,Giuseppe Conte,1176398,Tornare dove sono cresciuto e ricevere questo affetto mi dà una grande forza. Grazie terra mia. #dallapartegiusta https://t.co/zMkHcHuJSb,['dallapartegiusta']
2022-09-02,1565703328687919107,Giuseppe Conte,1176398,Ora è il momento della verità. #dallapartegiusta https://t.co/my10RAC37S,['dallapartegiusta']
2022-09-02,1565638542059094016,Giuseppe Conte,1176398,Gli unici a proporre il VERO salario minimo siamo noi del @Mov5Stelle. Ecco perché! #DallaParteGiusta https://t.co/GjnndL33Jw,['DallaParteGiusta']
2022-09-01,1565429262894645254,Giuseppe Conte,1176398,In diretta da San Giovanni Rotondo #dallapartegiusta: https://t.co/G2MOFNl7Hd,['dallapartegiusta']
2022-09-01,1565400767107923969,Giuseppe Conte,1176398,"Gli appuntamenti di domani, non mancate! #dallapartegiusta https://t.co/CTlSbfGxDD",['dallapartegiusta']
2022-09-01,1565327181542293541,Giuseppe Conte,1176398,"Quanto affetto questa mattina a San Severo! Avanti, sempre #dallapartegiusta.

Ci vediamo più tardi a Vico del Gargano, poi Vieste e questa sera a San Giovanni Rotondo. Vi aspetto! https://t.co/FPvE5aG4fV",['dallapartegiusta']
2022-09-01,1565278451359260673,Giuseppe Conte,1176398,"A Cosenza oltre 200 arresti tra amministratori locali, imprenditori ed esponenti criminalità organizzata. Grazie a magistrati e forze dell’ordine. Per il @Mov5Stelle il contrasto a mafie e corruzione è un’urgenza: orgogliosi di essere alfieri della legalità. #dallapartegiusta https://t.co/s8oINUr9wb",['dallapartegiusta']
2022-09-01,1565274172514832387,Giuseppe Conte,1176398,"Scegli di stare #dallapartegiusta, sostienici con una donazione ⤵️ https://t.co/UIvairegW4",['dallapartegiusta']
2022-08-31,1565098405919166466,Giuseppe Conte,1176398,Dopo la splendida piazza di Chieti questa sera una gradita sosta a Termoli per un abbraccio a tutti i molisani! #dallapartegiusta https://t.co/3Pe96eoMWT,['dallapartegiusta']
2022-08-31,1565048343562227714,Giuseppe Conte,1176398,"Oggi a #Crotone ennesima tragedia del lavoro. La politica non può restare a guardare: il @Mov5Stelle chiede un patto per la sicurezza, più personale ispettivo e l’istituzione della Procura nazionale del lavoro. La sicurezza sul lavoro sia priorità dell’agenda sociale italiana. https://t.co/q0k8y8oR5y",['Crotone']
2022-08-31,1565033474712641540,Giuseppe Conte,1176398,In diretta da Chieti #DallaParteGiusta: https://t.co/WqlkzOPJx8,['DallaParteGiusta']
2022-08-31,1565014662852317184,Giuseppe Conte,1176398,Ci vediamo domani in Puglia! #dallapartegiusta https://t.co/BPMG1JJ7fe,['dallapartegiusta']
2022-08-31,1564952737233649670,Giuseppe Conte,1176398,Il grande affetto di Rimini ci dà la carica per batterci con ancor più forza.È stato importante parlare con commercianti e cittadini alle prese con rincari e bollette.Quando mesi fa abbiamo chiesto interventi immediati gli altri pensavano a investire sulle armi. #DallaParteGiusta https://t.co/ynnJyvOhzQ,['DallaParteGiusta']
2022-08-31,1564888987478753280,Giuseppe Conte,1176398,"Ieri in Veneto sui cantieri superbonus ho incontrato cittadini, imprenditori e artigiani: il Governo deve rimuovere subito gli ostacoli al Superbonus, che grazie al @Mov5stelle ha prodotto lavoro, crescita, taglio delle bollette e dell'inquinamento. #dallapartegiusta https://t.co/gi1tqfJ800",['dallapartegiusta']
2022-08-30,1564713824824983557,Giuseppe Conte,1176398,Grazie ai ragazzi del #FornaciRosse di Vicenza. Sono commosso da questa accoglienza. C'è voglia di stare #dallapartegiusta https://t.co/2j9yC0TdFQ,"['FornaciRosse', 'dallapartegiusta']"
2022-08-30,1564681669021409281,Giuseppe Conte,1176398,"È stato bello incontrare qui a Vicenza con @GuidolinBarbara gli infermieri del #Nursind: hanno riconosciuto il lavoro fatto dal @Mov5Stelle per loro, spesso contro tutto e tutti. Su aumento stipendi e riconoscimento delavoro usurante per la categoria siamo al loro fianco. https://t.co/QMd8qYYUuK",['Nursind']
2022-08-30,1564650771140018177,Giuseppe Conte,1176398,"Ci vediamo domani a Rimini, San Benedetto del Tronto e Chieti! #dallapartegiusta https://t.co/ciFlCKn6y9",['dallapartegiusta']
2022-08-30,1564618769846177801,Giuseppe Conte,1176398,"Lasciamoci alle spalle carbone e fonti fossili, le rinnovabili sono il futuro! https://t.co/CQ18keMjbb",[]
2022-08-30,1564547102176382980,Giuseppe Conte,1176398,"Il tuo aiuto è essenziale per realizzare il nostro progetto. Scegli di stare #dallapartegiusta, sostienici con una donazione: https://t.co/CzLijiFI03 https://t.co/VpII1qdvnO",['dallapartegiusta']
2022-08-29,1564288927367823370,Giuseppe Conte,1176398,Alcune tappe di questa settimana. Vi aspetto! https://t.co/gEr4YMcgbx,[]
2022-08-29,1564208950014316544,Giuseppe Conte,1176398,"Il ricordo di #LiberoGrassi, l’imprenditore ucciso da Cosa Nostra perché si oppose al pizzo, rimane scolpito nella nostra memoria. Libero scelse con coraggio di non cedere al ricatto mafioso e da allora è un faro per tutti noi nella lotta contro la mafia e la criminalità https://t.co/MLhE18IR8c",['LiberoGrassi']
2022-08-28,1563962354055913474,Giuseppe Conte,1176398,Il mio intervento all’evento #LaPiazza (Ceglie Messapica): https://t.co/YHvHmg6Q4y,['LaPiazza']
2022-08-28,1563878790752882692,Giuseppe Conte,1176398,Questa sera doppio appuntamento ⤵️ https://t.co/asBS2IAymx,[]
2022-08-28,1563846035142856706,Giuseppe Conte,1176398,Non si facciano pagare alla scuola le conseguenze della crisi energetica. I nostri ragazzi hanno già dato. https://t.co/4aAHJzjsSs,[]
2022-08-28,1563792789208539136,Giuseppe Conte,1176398,"No, io Silvio Berlusconi a Bruxelles non me lo ricordo https://t.co/dn9WJfLnjs",[]
2022-08-27,1563540857856241666,Giuseppe Conte,1176398,https://t.co/RKs4VlEb5V https://t.co/MbOyhpaonI,[]
2022-08-27,1563539882286489600,Giuseppe Conte,1176398,"Occhio ragazzi, Salvini ha trovato il modo per risolvere i problemi dei giovani. Tutti a fare il militare! https://t.co/p1tJnEcK3d",[]
2022-08-27,1563465875776102401,Giuseppe Conte,1176398,https://t.co/7UkCmSasSC,[]
2022-08-25,1562921184034963456,Giuseppe Conte,1176398,Questa sera a #Tg2Post: https://t.co/uoqd76f5EM,['Tg2Post']
2022-08-25,1562872735159975936,Giuseppe Conte,1176398,La mia intervista al Tg4: https://t.co/mpp3VYmdhl https://t.co/OzcnR8I60T,[]
2022-08-25,1562851143281254400,Giuseppe Conte,1176398,"Il vero bipolarismo? Tra chi è fintamente “green” e insiste con inquinamento, carbone e fonti fossili e chi, come noi, è in prima linea per l'ambiente e il clima, nel segno delle rinnovabili. Stai #dallapartegiusta https://t.co/m4qNTPu43u",['dallapartegiusta']
2022-08-25,1562762507705454592,Giuseppe Conte,1176398,Oggi in diretta al Tg4 alle ore 19 e alle 21.30 su Tg2 Post. Vi aspetto! https://t.co/6gDq1Y9O3t,[]
2022-08-24,1562536845757792258,Giuseppe Conte,1176398,"Lo avevamo detto, il confronto a lume di candela in Rai su cui si sono accordati Letta e Meloni non rispetta il diritto dei cittadini a essere correttamente informati. Non sono loro le uniche due alternative per l'Italia. La democrazia e il pluralismo sono una cosa seria. https://t.co/Ugod3jVmIk",[]
2022-08-24,1562429786173370371,Giuseppe Conte,1176398,Vi aspetto questa sera alle ore 19 su @RadioR101 #DallaParteGiusta,['DallaParteGiusta']
2022-08-23,1562153173950898176,Giuseppe Conte,1176398,Cara Giorgia: così proprio no! https://t.co/mYMmB5inN5,[]
2022-08-23,1562087771702976514,Giuseppe Conte,1176398,"Ecco cosa succede quando la politica irresponsabile strumentalizza la cronaca, senza curarsi delle conseguenze e dell’eco mediatica, senza rispetto per chi patisce violenza. Questo scempio è quanto di più lontano dal nostro modo di intendere la dignità delle persone. https://t.co/1h3BVMKOqe",[]
2022-08-23,1562059484687736832,Giuseppe Conte,1176398,"Al Meeting di Rimini non è stata ospitata la voce del @Mov5Stelle. C'era invece una sfilata di politici che fingono di litigare e poi intorno trovano sempre un accordo.
Siamo scomodi per un certo sistema che vuole escluderci e oscurarci. Siamo diversi da loro.#dallapartegiusta https://t.co/kmXrWdH5Mm",['dallapartegiusta']
2022-08-22,1561766397746810881,Giuseppe Conte,1176398,"Il “sindaco pescatore” Angelo Vassallo è stato in vita un esempio di lotta per l’ambiente, contro la criminalità e per la legalità. Ha pagato con la vita, ma l’impegno del fratello Dario continua a ricordarci quel che conta. È un onore candidarlo e stare #dallapartegiusta https://t.co/5X0B5sYpLy",['dallapartegiusta']
2022-08-22,1561738199042514944,Giuseppe Conte,1176398,"In Sicilia il @Mov5Stelle correrà con @NuccioDiPaola Presidente. Impegno, correttezza e schiena dritta, la nostra proposta per il Governatore che ogni siciliano merita! https://t.co/l1u6mwTpgn",[]
2022-08-22,1561717282430230528,Giuseppe Conte,1176398,"In Sicilia il @Mov5Stelle correrà da solo, per dare riscatto e dignità a tutta l'isola: https://t.co/3IMh4ok2dF https://t.co/N2okfJcFhy",[]
2022-08-21,1561372269091364866,Giuseppe Conte,1176398,https://t.co/o4KIqb7sUI,[]
2022-08-21,1561363906932707331,Giuseppe Conte,1176398,"Nelle condizioni attuali con i vertici nazionali del Pd folgorati dell'agenda Draghi non potremmo nemmeno sederci al tavolo. E noi i nostri valori, le nostre battaglie non li svendiamo. Lo abbiamo già dimostrato, senza paura di pagarne il prezzo. #dallapartegiusta https://t.co/lPGBsBxifa",['dallapartegiusta']
2022-08-21,1561324411449393154,Giuseppe Conte,1176398,A fra poco #mezzorainpiù https://t.co/A5Q0MA0xAi,['mezzorainpiù']
2022-08-21,1561311671452401665,Giuseppe Conte,1176398,https://t.co/jSeedQs2dg,[]
2022-08-20,1561030196752523266,Giuseppe Conte,1176398,Domani sarò ospite di Lucia Annunziata a #mezzorainpiù. Ho alcune cose da raccontarvi e idee per il Paese da illustrarvi. Vi aspetto in diretta dalle 14.30 su @RaiTre. https://t.co/Js6VA8cIg4,['mezzorainpiù']
2022-08-20,1560995160758034432,Giuseppe Conte,1176398,"Miracoli elettorali. Il nostro progetto per un #salariominimo a 9 euro l'ora è stato ostacolato per mesi. Da quando è stata fissata la data delle elezioni, tutti hanno cambiato idea. Ma che faranno dopo il voto? Una delle solite promesse scritte sulla sabbia? #dallapartegiusta https://t.co/J4XHm8YgkK","['salariominimo', 'dallapartegiusta']"
2022-08-20,1560941266296266753,Giuseppe Conte,1176398,Proprio così. #dallapartegiusta https://t.co/g3s378FipW,['dallapartegiusta']
2022-08-20,1560909676266528769,Giuseppe Conte,1176398,"@EnricoLetta Caro Enrico, possiamo anche illuderci che con Draghi ""sarà tre volte Natale e festa tutto il giorno"". Esci dalla nostalgia, la realtà dell'agenda Draghi sono 6 euro in più al mese per i lavoratori a più basso reddito. Due colazioni al bar.",[]
2022-08-19,1560664800161853440,Giuseppe Conte,1176398,"Un onore lottare per la legalità al fianco di Roberto Scarpinato, che la mafia l'ha sfidata insieme a Falcone e Borsellino. https://t.co/yWYGrmJj9c",[]
2022-08-19,1560621932755779585,Giuseppe Conte,1176398,"Non lasciamo che la campagna elettorale distragga dalle urgenze del Paese: è una questione di responsabilità, tema che a tanti politici dovrebbe essere caro. Il @Mov5Stelle è pronto a fare la sua parte. È dalla parte dell’Italia, #dallapartegiusta.",['dallapartegiusta']
2022-08-19,1560621928825737216,Giuseppe Conte,1176398,"Il @Mov5Stelle propone alcune misure di immediato impatto, su cui siamo pronti a confrontarci con tutte le forze politiche ⤵️ https://t.co/ppKNR7yFpo",[]
2022-08-19,1560621872391274496,Giuseppe Conte,1176398,"La campagna elettorale non può nascondere queste urgenze. Tra meno di un mese una nuova ondata di caro-bollette e caro-energia minaccia di mettere in ginocchio metà Paese, alimentando tensioni sociali e disaffezione verso la Politica.",[]
2022-08-19,1560621867228172290,Giuseppe Conte,1176398,"Parlo di un tetto al prezzo del gas, di un Recovery Plan per l'energia sul modello di quanto fatto per la sanità durante la pandemia, di uno scostamento di bilancio per proteggere il tessuto imprenditoriale e sociale.",[]
2022-08-19,1560621861272096768,Giuseppe Conte,1176398,"Si tratta di una situazione potenzialmente disastrosa, frutto anche di una timidezza d’azione che a livello europeo non ha aiutato a raggiungere obiettivi importanti su cui il @Mov5Stelle da mesi ha alzato la voce, invitando il Governo a fare tutto il possibile.",[]
2022-08-19,1560621854968127488,Giuseppe Conte,1176398,"Personalmente, invece, sono preoccupato dal cupo scenario che abbiamo davanti: a fine settembre il costo delle bollette rischia di raddoppiare, aziende e famiglie potrebbero trovarsi ancora in sofferenza.",[]
2022-08-19,1560621845770108928,Giuseppe Conte,1176398,"In questi giorni mi pare ci sia un’ostinata ricerca di polemiche ad uso elettorale, legate per lo più a temi lontani dalle difficoltà reali dei cittadini: ora sulla candidatura dei virologi, domani su chissà cos’altro.",[]
2022-08-18,1560343257057574912,Giuseppe Conte,1176398,"L’intromissione di Dmitri Medvedev sulle prossime tornate elettorali europee è inopportuna e pericolosa: gli italiani non devono prendere lezioni e consigli da nessuno, tanto meno da chi si è reso protagonista di guerra e condotte che violano i più elementari diritti umani.",[]
2022-08-18,1560289292861194240,Giuseppe Conte,1176398,"In questi momenti drammatici abbiamo due obblighi morali. 
1) intervenire subito e massicciamente a sostegno di territori colpiti, famiglie e imprese
2) non nascondere più la testa sotto la sabbia sull’emergenza climatica: gli ultimi eventi impongono misure straordinarie, ora. https://t.co/zE2w6Qx728",[]
2022-08-17,1559955956909367299,Giuseppe Conte,1176398,"Per noi lavoro significa dignità: vogliamo che si lavori per vivere, non che si viva per lavorare. #dallapartegiusta https://t.co/6mthvE4yKi",['dallapartegiusta']
2022-08-16,1559647424771244042,Giuseppe Conte,1176398,"Entusiasmo e partecipazione: un sentito grazie alla comunità @Mov5Stelle per la grande affluenza a queste ‘parlamentarie’. I candidati che ho proposto per lavorare alla nostra idea di Paese hanno ottenuto un ampio consenso, sfiorando il 90%. Avanti a testa alta! #dallapartegiusta",['dallapartegiusta']
2022-08-16,1559552613263314944,Giuseppe Conte,1176398,Alle 18.00 sarò in diretta su https://t.co/6L6rIkTHhY per un confronto con il direttore @MassimGiannini. A più tardi!,[]
2022-08-15,1559257401911558144,Giuseppe Conte,1176398,"Buon ferragosto a tutti. Ho alcune considerazioni da condividere con voi in vista dell’importante votazione di domani. Con cuore e coraggio, #dallapartegiusta https://t.co/dWDvlFqW54",['dallapartegiusta']
2022-08-14,1558915060424122368,Giuseppe Conte,1176398,"È con immenso dolore che apprendo della morte di Matteo Incerti, un ragazzo della nostra comunità, un amico che ha visto il Movimento muovere i suoi passi sin dall’inizio. Caro Matteo, ti ricorderemo sempre con affetto. Ci stringiamo al dolore dei suoi cari. https://t.co/Pe1SY3bgWI",[]
2022-08-14,1558846434115452932,Giuseppe Conte,1176398,"È il momento di decidere. Il 25 settembre scegli di stare 
#dallapartegiusta https://t.co/6OlIk8kWW2",['dallapartegiusta']
2022-08-14,1558711762022793217,Giuseppe Conte,1176398,"Sono passati quattro anni, ma il dolore e la rabbia per la tragedia del Ponte Morandi non sono scalfiti dal tempo. Il mio pensiero oggi va alle 43 vittime, alle loro famiglie, ai loro cari, ad un intero Paese che ancora attende sia fatta giustizia.",[]
2022-08-13,1558408886612279296,Giuseppe Conte,1176398,"Con #PieroAngela se ne va una figura importante della cultura italiana. Una voce e una professionalità che per decenni hanno raccontato il mistero del nostro universo con sapienza, passione e dedizione. https://t.co/SUokikpbOP",['PieroAngela']
2022-08-12,1558015964230418434,Giuseppe Conte,1176398,La mia intervista di ieri sera a #controcorrente: https://t.co/D6Dc6wzy1U https://t.co/DkAgfTAL96,['controcorrente']
2022-08-12,1558003723263148035,Giuseppe Conte,1176398,https://t.co/ODYqU9LVpq,[]
2022-08-11,1557705115221590018,Giuseppe Conte,1176398,Questa sera su Rete 4 a #controcorrente https://t.co/aNwnocH1zN,['controcorrente']
2022-08-11,1557694347541467137,Giuseppe Conte,1176398,"Nuova settimana, nuovo cambio di alleanza per Calenda. Ora è il momento di abbracciare il Rinascimento saudita di Renzi, per provare insieme a trovare un posto in Parlamento. Le emergenze di cittadini e imprese? Un dettaglio secondario.",[]
2022-08-11,1557622583805231106,Giuseppe Conte,1176398,Sarà una campagna elettorale molto intensa e il @Mov5Stelle è prontissimo ad affrontarla. Qui la mia intervista di ieri sera a #LaCorsaAlvoto: https://t.co/C8zypSP3ek,['LaCorsaAlvoto']
2022-08-10,1557390234169524224,Giuseppe Conte,1176398,L’Italia non è un Paese a sovranità limitata. https://t.co/EbjsxpnLOB,[]
2022-08-10,1557321305501962240,Giuseppe Conte,1176398,Questa sera sarò ospite di @paolocelata a #LaCorsaAlVoto. In onda in prima serata su @La7tv https://t.co/uyywvrHMn5,['LaCorsaAlVoto']
2022-08-10,1557291944514125827,Giuseppe Conte,1176398,Abbassiamo le tasse e semplifichiamo davvero la vita a cittadini e imprese. Dal centrodestra in questi giorni sentiamo solo propaganda e proposte irrealizzabili. La mia intervista questa mattina a @Radio24_news: https://t.co/uDc9HWz7SE,[]
2022-08-09,1557047913007792130,Giuseppe Conte,1176398,"A nessuno sembra interessare la realtà, il dramma di una generazione. Ragazze e ragazzi, non lasciatevi rubare il futuro. https://t.co/Ivi3ZFIdPx",[]
2022-08-09,1556952354519482369,Giuseppe Conte,1176398,"Trattativa Stato-Mafia, la politica risponda: è giusto legittimare chi scende a patti con i boss? Qui di seguito il mio appello pubblicato oggi sulle pagine del Fatto Quotidiano: https://t.co/2yDJ4PDS1c https://t.co/Y7e92m7qwn",[]
2022-08-08,1556775496402276358,Giuseppe Conte,1176398,"È da poco passato il giorno del mio compleanno. Condivido questo video che avevo preparato per voi. Vi ringrazio ancora per i tanti messaggi e i gesti d’attenzione. Ci aspettano settimane intense, forza! 💪🏻 https://t.co/mx4LthAkSl",[]
2022-08-08,1556602591471099905,Giuseppe Conte,1176398,@gualtierieurope @giorgio_gori @matteolepore @BeppeSala @DarioNardella @SergioGiordani_ @MicheleGuerraPR @MattBiff Caro Roberto bene apporre una firma “per il clima”. È la stessa che metterai per costruire un megainceneritore e diffondere fumi inquinanti qui a Roma?,[]
2022-08-08,1556567235518504960,Giuseppe Conte,1176398,La mia intervista questa mattina a “The Breakfast Club” su @RadioCapital_fm: https://t.co/oHhZg8STHw,[]
2022-08-07,1556344198823034882,Giuseppe Conte,1176398,Domani mattina doppio appuntamento: alle 8.10 su @RadioCapital_fm per “The Breakfast Club” e alle 8.40 in diretta a @MorningNewsTv su Canale 5. Vi aspetto!,[]
2022-08-07,1556310851753328640,Giuseppe Conte,1176398,"In molti mi chiedono cosa ne sarà del “campo largo” di Letta dopo il broncio di Calenda, le voraci pretese di posti sicuri di Tabacci e Di Maio, i veti incrociati e le repentine giravolte. Non spetta a me la risposta. Per parte mia posso dire questo: https://t.co/vhzMbRLjwq https://t.co/bJMlF1iTFo",[]
2022-08-06,1555989770848948224,Giuseppe Conte,1176398,"Difendere la Costituzione vuol dire avere idee chiare, non fare ammucchiate e spartizione di collegi elettorali e posti: https://t.co/WwqeuNNn7c https://t.co/RhGLYKxYZv",[]
2022-08-06,1555938298404769792,Giuseppe Conte,1176398,Per noi i cittadini che soffrono vengono prima dei “Migliori”. Chiunque essi siano. https://t.co/ZnJnC3HO7J,[]
2022-08-05,1555543956057985025,Giuseppe Conte,1176398,"Noi le risposte pronte, vere e forti, le abbiamo indicate al Governo Draghi. L'ultima volta con i nostri 9 punti, respinti però al mittente. Il mittente, tuttavia, non si chiama né Giuseppe Conte né M5S. Sono gli italiani che non ce la fanno più.",[]
2022-08-05,1555543949175099393,Giuseppe Conte,1176398,"È però evidente a tutti, oggi forse ancora di più, quello che ripetiamo da mesi: questi interventi sono necessari ma del tutto insufficienti.",[]
2022-08-05,1555543946901725185,Giuseppe Conte,1176398,"Ovviamente il @Mov5Stelle ieri ha appoggiato il Decreto aiuti bis per tamponare i rincari, gli aumenti della benzina. In Parlamento faremo tutto il possibile per migliorare le cose.",[]
2022-08-05,1555543945316376587,Giuseppe Conte,1176398,D’altro canto il Ministero dell’economia non è ancora riuscito a incassare la sacrosanta tassa sugli extraprofitti dei colossi energetici: all'appello mancano 9 miliardi che sarebbero utilissimi a famiglie e imprese.,[]
2022-08-05,1555543943206653954,Giuseppe Conte,1176398,"Offrire 6-7 euro al mese in più ai lavoratori a basso reddito non è proprio la “risposta pronta ai problemi che si presentano"" di cui ieri ha parlato Draghi con riferimento alla sua ""agenda"". Oggi Bombardieri della Uil, studi e simulazioni alla mano, parla di una ""elemosina"".",[]
2022-08-04,1555270225767153664,Giuseppe Conte,1176398,Le nostre priorità non sono le ammucchiate elettorali. Ci interessa difendere con le unghie e con i denti i temi per cui ci siamo impegnati con i cittadini. https://t.co/kCyUNTSjau,[]
2022-08-04,1555258911414001664,Giuseppe Conte,1176398,"@GiorgiaMeloni @FratellidItalia Giorgia, mai detto di avere abolito la povertà. Per l'Istat in pandemia abbiamo evitato che 1 milione di persone finissero in povertà, con aiuti che tu chiami metadone di Stato. Sei fortunata, con la politica prendi 500 euro al giorno. Perché umili chi vive con 500 euro al mese?",[]
2022-08-04,1555189285669801984,Giuseppe Conte,1176398,"@GiorgiaMeloni @FratellidItalia Cara @GiorgiaMeloni, questa l’ho già sentita. Anzi, l’ho già fatta. Con gli sgravi alle imprese per assumere giovani, donne e con #DecontribuzioneSud, inseriti nell’ultima Manovra del Conte II, circa 1,8 milioni di persone hanno ottenuto un lavoro. Ah già: tu non l’hai votata!",['DecontribuzioneSud']
2022-08-04,1555178359927324672,Giuseppe Conte,1176398,"Voi avete capito cosa è l’""agenda Draghi""? https://t.co/PZFYUWbaBU",[]
2022-08-04,1555172597322731520,Giuseppe Conte,1176398,"L'unico voto utile è quello al @Mov5Stelle ! Nell'intervista di questa mattina a L'aria che tira Estate ho spiegato perché
https://t.co/JpiQKlVEuF",[]
2022-08-03,1554926044842688512,Giuseppe Conte,1176398,"La mia intervista a TG2 Post di questa sera
https://t.co/p2h6vmN2uU https://t.co/XZG3Sr1HiM",[]
2022-08-03,1554858762741088258,Giuseppe Conte,1176398,Per mesi il Governo ha demonizzato il Superbonus voluto dal M5S. Ora grazie a quella misura abbiamo le risorse per aiutare famiglie e imprese alle prese con rincari e bollette. https://t.co/XF5W7K7IUw,[]
