Date,Tweet ID,Leader Name,Followers,Text,Hashtags
2022-08-03,1554839339233853440,Giuseppe Conte,1176398,Per una volta sono d’accordo con Calenda. https://t.co/8N2JS3zF6h,[]
2022-08-03,1554761052688113665,Giuseppe Conte,1176398,"Forse la memoria mi inganna, ma non ricordo Berlusconi con me a Bruxelles a trattare fino all'alba per ottenere i 209 miliardi che ho portato dall'Europa in Italia nel 2020. Ricordo invece Forza Italia, come altri, chiedere il Mes, la troika e altre misure lacrime e sangue. https://t.co/zfa1EvPYZU",[]
2022-08-03,1554749639663943681,Giuseppe Conte,1176398,Questa sera a #tg2post https://t.co/f8Mys2wlq1,['tg2post']
2022-08-03,1554735979650580480,Giuseppe Conte,1176398,"No alle ammucchiate, no alle proposte assurde della destra. Sì al campo giusto, dove si rispettano gli impegni con i cittadini.
Qui la mia intervista oggi a “Agorà Estate” | 3/08/2022
https://t.co/Y8eMUEBUYO https://t.co/fkKoQPtQHF",[]
2022-08-02,1554577172878311432,Giuseppe Conte,1176398,"La mia intervista di poco fa a ""InOnda"" su La7 https://t.co/4jP2dugw3g https://t.co/jO7fChukzV",[]
2022-08-02,1554536598607372295,Giuseppe Conte,1176398,Intervista a TG5 | 2/8/2022 https://t.co/rBuYPF8eki,[]
2022-08-02,1554440503013347328,Giuseppe Conte,1176398,https://t.co/bjBPi1Ahqt,[]
2022-08-02,1554419170674200577,Giuseppe Conte,1176398,"Siete migliaia. Sottraete tempo alle famiglie, alle meritate vacanze per discutere, per programmare un rinnovato impegno, per “esserci”.

Grazie per questo entusiasmo, ci aspetta una campagna contro tutto e tutti. Avanti, insieme! https://t.co/Gg1qXaQk4j",[]
2022-08-02,1554419164596604929,Giuseppe Conte,1176398,"Cittadini iscritti dalla prima ora e cittadini che si avvicinano adesso al @Mov5Stelle. State affollando palazzetti, sale riunioni, vi ritrovate a confrontarvi anche sul web per sostenere l’azione politica del Movimento. https://t.co/x96gKK7iiU",[]
2022-08-02,1554419158519107591,Giuseppe Conte,1176398,"C'è chi presenta nuovi simboli, chi fonda nuovi partiti, sposa nuove bandiere, chi da un giorno all’altro cestina principi e valori professati per anni. Chi sta negoziando la medesima poltrona ma con nuovi colori.

Ma poi ci siete voi. https://t.co/4yfERaZ7h1",[]
2022-08-02,1554398566872915970,Giuseppe Conte,1176398,Questa sera sarò ospite a #InOnda. Alle 21.30 su @La7tv https://t.co/yj0jSNIQPP,['InOnda']
2022-08-02,1554372283698921474,Giuseppe Conte,1176398,La mia intervista questa mattina a #radioanchio: https://t.co/4kXBo5UKEl,['radioanchio']
2022-08-01,1554169515428167682,Giuseppe Conte,1176398,Domani mattina alle 8.35 su Radio Uno 📻 #radioanchio https://t.co/XS1TbBhRYG,['radioanchio']
2022-07-31,1553723360005292033,Giuseppe Conte,1176398,"Ma soprattutto a coloro che, al contrario, hanno deciso di restare al nostro fianco per continuare a difendere i nostri principi, i nostri valori: https://t.co/maf7MOrmqV https://t.co/JbaFxvtBnf",[]
2022-07-31,1553723341793542149,Giuseppe Conte,1176398,"Oggi vi annoio con una riflessione un po’ lunga, ma necessaria. Una riflessione dedicata a coloro che, avuta conferma della regola dei due mandati, come da impegni presi con gli elettori, si stanno industriando per trovare nuove collocazioni politiche.",[]
2022-07-31,1553639075873267713,Giuseppe Conte,1176398,https://t.co/VPDCHScL3K,[]
2022-07-30,1553380372985020416,Giuseppe Conte,1176398,https://t.co/XoS6PWKFez,[]
2022-07-30,1553296140619112451,Giuseppe Conte,1176398,"Serietà, responsabilità e coraggio per cambiare. Come quando abbiamo governato il Paese nel momento più difficile. Con chi non conta, per chi non ha voce. https://t.co/pviG6Bl1Eg",[]
2022-07-29,1553047570443804672,Giuseppe Conte,1176398,"In bocca al lupo a @FraSilvestriM5S, nuovo capogruppo del @M5S_Camera e ai nuovi componenti del direttivo. Rimbocchiamoci le maniche e impegniamoci fino all’ultimo giorno di legislatura per aiutare famiglie e imprese. Ci aspetta un periodo davvero intenso 💪🏻",[]
2022-07-29,1552956608140959745,Giuseppe Conte,1176398,"Ci tengo a essere sincero con tutti voi: vi spiego quello che è successo in questi giorni, quello che siamo e quello che non siamo. Abbiamo le idee chiare per l'Italia https://t.co/O6cA54X6cp",[]
2022-07-29,1552916863721607169,Giuseppe Conte,1176398,La mia intervista poco fa a #NonStopNews su @rtl1025: https://t.co/yxKsn1IA2T,['NonStopNews']
2022-07-29,1552902056519897088,Giuseppe Conte,1176398,Fra poco a #NonStopNews su @rtl1025 https://t.co/ZKtuWMaiEt,['NonStopNews']
2022-07-28,1552699155356827649,Giuseppe Conte,1176398,"Le nostre priorità: salario minimo per chi ha stipendi da 2 o 3 euro l’ora, taglio delle tasse sul lavoro per aumentare gli stipendi, aiuti a famiglie e imprese sulle bollette.

Le priorità del centrodestra: la spartizione di collegi elettorali e posti di potere. https://t.co/cirFpTAnVf",[]
2022-07-27,1552343040857079808,Giuseppe Conte,1176398,"Ci batteremo con tutte le nostre forze per voi. 
Questo è il mio, il nostro impegno. 
Saremo il #campogiusto. https://t.co/z7zZdtxi4l",['campogiusto']
2022-07-27,1552230778020446208,Giuseppe Conte,1176398,Noi saremo il campo giusto. https://t.co/uZuw6xkLnj,[]
2022-07-26,1552047382640173057,Giuseppe Conte,1176398,La mia intervista questa sera a #Filorosso: https://t.co/SSxEfyAqeN https://t.co/xa7cEMENyk,['Filorosso']
2022-07-26,1551992636814376967,Giuseppe Conte,1176398,Finora abbiamo ascoltato di tutto e di più. Adesso parlo io: https://t.co/Hav2Ab74iF,[]
2022-07-26,1551879055007514627,Giuseppe Conte,1176398,Questa sera sarò ospite a #Filorosso. Dalle 21.20 su Rai 3. https://t.co/TjFElkBYlJ,['Filorosso']
2022-07-23,1550962791632306181,Giuseppe Conte,1176398,Grazie @FloridiaBarbara! https://t.co/7TFcMswaiv,[]
2022-07-23,1550803935874646018,Giuseppe Conte,1176398,https://t.co/YVljPgFh7i https://t.co/YTM4UObEAX,[]
2022-07-21,1550131198550192137,Giuseppe Conte,1176398,Questa sera a #ZonaBianca https://t.co/91bFnA0VIi,['ZonaBianca']
