Date,Tweet ID,Leader Name,Followers,Text,Hashtags
2022-09-25,1574001093922766848,Giuseppe Conte,1176398,Buon voto a tutti! https://t.co/T2Wm7nUhyw,[]
2022-09-23,1573429807462899717,Giuseppe Conte,1176398,È stata una campagna elettorale molto emozionante. Non smettiamo mai di lottare per un'Italia migliore #dallapartegiusta https://t.co/qcIal9UmVG,['dallapartegiusta']
2022-09-23,1573411162976559104,Giuseppe Conte,1176398,Un abbraccio grande così  #dallapartegiusta https://t.co/UFyOxi7fPB,['dallapartegiusta']
2022-09-23,1573387007434362881,Giuseppe Conte,1176398,In diretta da Piazza Santi Apostoli a Roma: https://t.co/geLMm1iLUP #dallapartegiusta https://t.co/FSiKhhgnkI,['dallapartegiusta']
2022-09-23,1573371888709292032,Giuseppe Conte,1176398,Ci hanno detto che eravamo morti. A me sembra che siamo in ottima salute! #dallapartegiusta https://t.co/qwp21Yaqj6,['dallapartegiusta']
2022-09-23,1573324487080439808,Giuseppe Conte,1176398,Vi aspetto! #DallaParteGiusta https://t.co/AH4ZTN5YhT,['DallaParteGiusta']
2022-09-23,1573297529604685825,Giuseppe Conte,1176398,Domenica 25 settembre non si può sbagliare. Ecco come si vota. https://t.co/bamQIJcdaT,[]
2022-09-23,1573267256758378496,Giuseppe Conte,1176398,"Ci siamo! Ci vediamo questa sera in Piazza Santi Apostoli, a Roma, per chiudere la campagna elettorale tutti insieme. Vi aspetto alle 18, tutti #dallapartegiusta! https://t.co/nxnUJFqMyy",['dallapartegiusta']
2022-09-23,1573199312120684544,Giuseppe Conte,1176398,Ieri sera sono stato ospite di Bruno Vespa a #PortaaPorta. Ho avuto modo di parlare del nostro programma e delle nostre proposte per il governo del Paese. Qui la mia intervista: https://t.co/ETG4Siswo7 #dallapartegiusta https://t.co/mkVK7pG5Cs,"['PortaaPorta', 'dallapartegiusta']"
2022-09-22,1573060750859550721,Giuseppe Conte,1176398,"Cosa resterà di questo Governo dei Migliori? Ditemelo voi, io non lo so. https://t.co/OS5p0OHDiF",[]
2022-09-22,1573038799407484937,Giuseppe Conte,1176398,La mia intervista al Tg1 #dallapartegiusta https://t.co/ixLSQlhoPC,['dallapartegiusta']
2022-09-22,1573006893362077697,Giuseppe Conte,1176398,La mia intervista oggi a Pomeriggio Cinque: https://t.co/HJkrTbM8Re https://t.co/IhGyT6Er16,[]
2022-09-22,1572997818477862913,Giuseppe Conte,1176398,"Giorgia, hai combattuto così bene la povertà che l’ultima volta che sei stata al Governo, prima con Berlusconi e Salvini e poi come stampella di quello tecnico, le persone in povertà assoluta sono passate da 2,1 a 3,5 milioni. Non credi di aver fatto già abbastanza danni? https://t.co/8jJkftPnCf",[]
2022-09-22,1572959833975930881,Giuseppe Conte,1176398,Davvero il @Mov5Stelle non si è occupato del Nord del Paese? I fatti raccontano un’altra storia. Qui vi spiego perché https://t.co/pH6mB9dcZr,[]
2022-09-22,1572946025626869760,Giuseppe Conte,1176398,Gli appuntamenti di questa sera in tv 📺 #dallapartegiusta https://t.co/QAp1t4hmkt,['dallapartegiusta']
2022-09-22,1572930633407827968,Giuseppe Conte,1176398,Questa mattina a l’@Ariachetira ho detto alcune cose importanti che vorrei condividere qui con voi. Ecco la mia intervista: https://t.co/cmJfjPVout #DallaParteGiusta https://t.co/1wtr1wq7nI,['DallaParteGiusta']
2022-09-22,1572877705850265600,Giuseppe Conte,1176398,Nelle prossime ore in tv 📌 #dallapartegiusta https://t.co/a49X9ybdH4,['dallapartegiusta']
2022-09-21,1572694721490980864,Giuseppe Conte,1176398,"Acerra, Caserta, Giugliano… grazie per l’accoglienza di oggi! Tutti #dallapartegiusta! https://t.co/kHpdq3QihR",['dallapartegiusta']
2022-09-21,1572679169007550464,Giuseppe Conte,1176398,In diretta da Giugliano in Campania: https://t.co/IMSPDwR9LC #dallapartegiusta https://t.co/SSwaZbfM6f,['dallapartegiusta']
2022-09-21,1572662567759220736,Giuseppe Conte,1176398,"Con @SergioCosta_Gen vi raccontiamo cosa abbiamo fatto per #Bagnoli. Nel 2018 ci siamo rimboccati le maniche e abbiamo sbloccato le opere di bonifica necessarie, dopo trent’anni di inerzia della politica. Il @Mov5Stelle ci mette sempre la faccia, sempre #dallapartegiusta https://t.co/YzJEm2n4Fr","['Bagnoli', 'dallapartegiusta']"
2022-09-21,1572618313007779841,Giuseppe Conte,1176398,Proprio così. #dallapartegiusta https://t.co/orFBI3vYoZ,['dallapartegiusta']
2022-09-21,1572603510235054081,Giuseppe Conte,1176398,"In collegamento da Napoli sono stato ospite a #Tagadà, su La7. Vi ripropongo qui la mia intervista: https://t.co/9evmcXIppP https://t.co/4Vc1YahR5y",['Tagadà']
2022-09-21,1572568494310555651,Giuseppe Conte,1176398,"Napoli è sempre un abbraccio di entusiasmo e calore! Grazie a tutti gli amici e le amiche per questa mattinata, continuiamo insieme #dallapartegiusta https://t.co/6zApLTOAfs",['dallapartegiusta']
2022-09-21,1572549821696995335,Giuseppe Conte,1176398,Gli appuntamenti in tv di oggi ⤵️ https://t.co/QfJIQn0l6b,[]
2022-09-21,1572522237202407426,Giuseppe Conte,1176398,"Per noi la povertà non è una colpa: a tutti può capitare in un momento così difficile di perdere il lavoro, di perdere la strada costruita con fatica. Tutti devono avere la certezza di non rimanere soli. #dallapartegiusta",['dallapartegiusta']
2022-09-21,1572522232353820673,Giuseppe Conte,1176398,"Non fatevi ingannare. Ecco il vero volto di Meloni&amp;co sulla povertà. Disprezzano chi non ha nulla, chi si trova in un momento difficile: vogliono togliergli tutto. https://t.co/sskr4tph0X",[]
2022-09-21,1572506043510575105,Giuseppe Conte,1176398,"Questa mattina negli studi di @agorarai, ecco la mia intervista: https://t.co/OYru9EScxq https://t.co/sZA8WM74qS",[]
2022-09-21,1572478759714033664,Giuseppe Conte,1176398,Fra poco a @agorarai,[]
2022-09-20,1572347794404380672,Giuseppe Conte,1176398,La mia intervista questa sera a #dimartedi: https://t.co/oW7OXihm5y #DallaParteGiusta https://t.co/a3Q6sxe3EG,"['dimartedi', 'DallaParteGiusta']"
2022-09-20,1572267239608578048,Giuseppe Conte,1176398,Ci vediamo domani in Campania! Sempre #dallapartegiusta https://t.co/0UzLTexGxg,['dallapartegiusta']
2022-09-20,1572258708943421440,Giuseppe Conte,1176398,"Sandro, contro i clan e la prepotenza della camorra bisogna essere uniti, non esistono steccati, simboli o partiti a dividerci. Siamo al tuo fianco. https://t.co/SejkqFwxFp",[]
2022-09-20,1572245173517819904,Giuseppe Conte,1176398,Oggi con gli amici di @Skuolanet https://t.co/L1r0BNHrSu,[]
2022-09-20,1572233774511038466,Giuseppe Conte,1176398,"A Silvana Sciarra, nuova Presidente della Corte Costituzionale, auguri di buon lavoro dal @Mov5Stelle. La sua riconosciuta competenza costituisce sicura garanzia per l’esercizio di un ruolo istituzionale fondamentale per gli equilibri del Paese.",[]
2022-09-20,1572211454367113216,Giuseppe Conte,1176398,Questa sera in tv ⤵️ #DallaParteGiusta https://t.co/52SK4byaPT,['DallaParteGiusta']
2022-09-20,1572160906603237376,Giuseppe Conte,1176398,Questa mattina intervista con l’ @Agenzia_Ansa: https://t.co/41SicIl8iC #dallapartegiusta https://t.co/tsJrMb5Xcj,['dallapartegiusta']
2022-09-20,1572135680263831554,Giuseppe Conte,1176398,"Venerdì 23 settembre, dalle 18, vi aspetto tutti in Piazza Santi Apostoli, a Roma, per la chiusura della campagna elettorale. Non mancate! #dallapartegiusta https://t.co/FjVStupfYh",['dallapartegiusta']
2022-09-19,1571960457593765889,Giuseppe Conte,1176398,La mia intervista poco fa a #StaseraItalia: https://t.co/ZK1cLzSeRb #DallaParteGiusta https://t.co/h48gbaeFnN,"['StaseraItalia', 'DallaParteGiusta']"
2022-09-19,1571896467148738560,Giuseppe Conte,1176398,https://t.co/zlEij0piaG,[]
2022-09-19,1571858736708206594,Giuseppe Conte,1176398,Poco fa sono stato ospite alla trasmissione #Ore14. Vi ripropongo qui la mia intervista: https://t.co/OX4cEcEt4R #dallapartegiusta https://t.co/nAcjMiLhfA,"['Ore14', 'dallapartegiusta']"
2022-09-19,1571818376946655235,Giuseppe Conte,1176398,A Genova ne approfitto per un rapido saluto a Beppe. Con cuore e coraggio sempre #dallapartegiusta https://t.co/w7ONZIOtqK,['dallapartegiusta']
2022-09-19,1571794111929139201,Giuseppe Conte,1176398,"Oggi in tv, ecco dove ⤵️ #ore14 #staseraitalia https://t.co/rV2Hh3IykT","['ore14', 'staseraitalia']"
2022-09-18,1571530430985211906,Giuseppe Conte,1176398,"Siamo orgogliosi di aver dato una spinta economica nel segno della sostenibilità ambientale a un intero comparto. Al fianco di chi lavora, sempre. #dallapartegiusta",['dallapartegiusta']
2022-09-18,1571530427843870720,Giuseppe Conte,1176398,"""Grazie al Movimento 5 Stelle da 2 anni riusciamo a lavorare e ad avere un reddito dignitoso, a mangiare una pizza la sera"". I lavoratori del settore edile mi hanno spiegato che due anni fa, prima del Superbonus 110%, non c'erano più prospettive di lavoro. https://t.co/1AYmqNAfR7",[]
2022-09-18,1571484226263859202,Giuseppe Conte,1176398,"Domani prima a Genova e poi a Milano, ecco gli appuntamenti ⤵️ #dallapartegiusta https://t.co/Agn5elo03K",['dallapartegiusta']
2022-09-18,1571434486952349696,Giuseppe Conte,1176398,"Ieri sera, in collegamento da Palermo, sono stato ospite al @tpi Fest di Bologna. Qui di seguito la mia intervista: https://t.co/JJzNuQb7vt",[]
2022-09-17,1571240478653251590,Giuseppe Conte,1176398,In diretta da Palermo: https://t.co/oMyqQ1ygxl #dallapartegiusta https://t.co/Nq13ILctJV,['dallapartegiusta']
2022-09-17,1571208925592051712,Giuseppe Conte,1176398,"Ancora un’onda di affetto e calore in Sicilia! Ancora entusiasmo con tantissime amiche e amici ad Agrigento e Trapani che passo dopo passo mi danno una grandissima forza! Ci vediamo fra poco a Palermo, in Piazza Verdi, alle 22. Vi aspetto! #dallapartegiusta https://t.co/UcKehDeW8s",['dallapartegiusta']
2022-09-17,1571163213282115586,Giuseppe Conte,1176398,"Ognuno sceglie i suoi simboli e le sue battaglie. La nostra strada si chiama legalità e al nostro fianco c'è Roberto Scarpinato, ex magistrato del pool antimafia di Falcone e Borsellino. La mafia combattiamola ogni giorno in ogni città, quartiere per quartiere. #dallapartegiusta https://t.co/LLuFWaKmNr",['dallapartegiusta']
2022-09-17,1571144365699104769,Giuseppe Conte,1176398,"Oggi a Enna e poi a Caltanissetta con Roberto Scarpinato: un vero e proprio simbolo della lotta alla mafia, candidato con noi al Parlamento mentre il centrodestra in Sicilia candida Renato Schifani, imputato nel processo Montante. 
Orgogliosi di stare #dallapartegiusta https://t.co/0ehVYtwX2J",['dallapartegiusta']
2022-09-16,1570892105983328257,Giuseppe Conte,1176398,"Splendida serata Gela! Avanti insieme, sempre #dallapartegiusta! https://t.co/QmF06dKXCE",['dallapartegiusta']
2022-09-16,1570872405220036609,Giuseppe Conte,1176398,#DallaParteGiusta con @NuccioDiPaola in diretta da Gela: https://t.co/8tgfeWo8Ek https://t.co/aYC6vlELHu,['DallaParteGiusta']
2022-09-16,1570835151147634690,Giuseppe Conte,1176398,"Siracusa, Marina di Ragusa: vi abbraccerei uno ad uno!!
Il vostro calore conferma che c’è voglia di stare #dallapartegiusta https://t.co/jVCGb9p1L4",['dallapartegiusta']
2022-09-16,1570796437910458368,Giuseppe Conte,1176398,"Domani ancora in Sicilia, ecco dove ⤵️ #dallapartegiusta https://t.co/Guo1MBRCr6",['dallapartegiusta']
2022-09-16,1570776440500535296,Giuseppe Conte,1176398,"Tiberio, Angela e tutti quelli che si ribellano alle mafie non sono soli: il @Mov5Stelle è al loro fianco. Oggi a Reggio Calabria, con Federico Cafiero de Raho, abbiamo ribadito il nostro impegno per la legalità. Nessun passo indietro: avete la nostra parola. #dallapartegiusta https://t.co/vieNuHv9FD",['dallapartegiusta']
2022-09-16,1570754518744453120,Giuseppe Conte,1176398,La questione è davvero molto seria: Meloni e Salvini devono chiarire! https://t.co/R6qDCSa21d,[]
2022-09-16,1570718913708818435,Giuseppe Conte,1176398,Una mattinata piena di entusiasmo oggi a Messina. Grazie! #dallapartegiusta https://t.co/Sbm7oEcL2Y,['dallapartegiusta']
2022-09-16,1570658996578832387,Giuseppe Conte,1176398,Ci stringiamo forte ai marchigiani in queste ore drammatiche. Pronti a fare tutto il possibile per aiutare le famiglie e i territori colpiti. https://t.co/aK403rpcPb,[]
2022-09-15,1570548752469086210,Giuseppe Conte,1176398,"...e a fine serata una pausa nel cuore di Catania con @NuccioDiPaola, sempre #dallapartegiusta https://t.co/boeLxvrBQB",['dallapartegiusta']
2022-09-15,1570512075864297473,Giuseppe Conte,1176398,"Catania, non so che dire. Così cambiamo tutto! Qui in Sicilia l'onda è iniziata, qui l'onda riparte! #dallapartegiusta https://t.co/dqEZK3x5yN",['dallapartegiusta']
2022-09-15,1570443554413060096,Giuseppe Conte,1176398,"Qui di seguito gli appuntamenti di domani, vi aspetto! #dallapartegiusta https://t.co/p1vYUa3OSq",['dallapartegiusta']
2022-09-15,1570414439483973633,Giuseppe Conte,1176398,"Ciao Bari e grazie per il calore di questa mattina! Ora si riparte, direzione Sicilia. Vi aspetto questa sera a Catania in Piazza Palestro. #dallapartegiusta https://t.co/yPeIzrxouk",['dallapartegiusta']
2022-09-15,1570367756029120514,Giuseppe Conte,1176398,"""La più grande sofferenza è essere soli"". Don Puglisi ha sfidato la mafia ed è stato ucciso 29 anni fa. Ci ha insegnato che per combattere la criminalità è necessario battersi affinché nessuno sia dimenticato e resti indietro. Non lasciamo cadere il suo monito. https://t.co/yWGUDEo6Pp",[]
2022-09-15,1570361481329541123,Giuseppe Conte,1176398,Questa campagna elettorale è possibile soltanto grazie a voi! Scegliete di stare #dallapartegiusta e se non lo avete ancora fatto potete contribuire con una donazione qui ⤵️ https://t.co/UIvaireOLC,['dallapartegiusta']
2022-09-15,1570352615279718402,Giuseppe Conte,1176398,"Questo Paese è sottosopra. Senza di noi avrebbero dimenticato 40 mila imprese edilizie a rischio chiusura e alzato invece i superstipendi dei dirigenti dello Stato. Ecco perché c'è bisogno di @Mov5Stelle in Italia, oggi più che mai! #dallapartegiusta https://t.co/kBkHjYwtNh",['dallapartegiusta']
2022-09-14,1570143072671133696,Giuseppe Conte,1176398,In diretta da Foggia: https://t.co/nazDyote13 #DallaParteGiusta https://t.co/nbECqHJCrt,['DallaParteGiusta']
2022-09-14,1570113704603287553,Giuseppe Conte,1176398,"Oggi in tantissimi avete ribadito quanto c'è bisogno del @Mov5Stelle nel nostro Paese. Contro le ingiustizie, per un'Italia che cambia ascoltando la voce di chi non ne ha. Grazie Bisceglie, Trani, Barletta, Andria! Ci vediamo fra poco a Foggia. Stiamo insieme #dallapartegiusta https://t.co/3ydC4I2NBC",['dallapartegiusta']
2022-09-14,1570106450386591749,Giuseppe Conte,1176398,Gli appuntamenti di domani ⤵️ #DallaParteGiusta https://t.co/sWirHITOJs,['DallaParteGiusta']
2022-09-14,1570073285123080196,Giuseppe Conte,1176398,"Ritornare nella mia terra, in Puglia, è sempre emozionante. Grazie Brindisi per l’affetto di questa mattina! #dallapartegiusta https://t.co/oCEcfWam5G",['dallapartegiusta']
2022-09-14,1570053097627725826,Giuseppe Conte,1176398,"Eppure l’avete votato, Enrico 🤔
Un bel tacer non fu mai scritto. https://t.co/hQPU0op6hJ",[]
2022-09-14,1570046276116582406,Giuseppe Conte,1176398,La nostra determinazione paga: il Governo è tornato sui suoi passi e ha appena annunciato di voler cancellare la norma che alza i megastipendi dei dirigenti di Stato. Meglio tardi che mai. Vi teniamo aggiornati.,[]
2022-09-14,1570032554564096000,Giuseppe Conte,1176398,"Via libera definitivo del Parlamento europeo alla direttiva sul #salariominimo. Mentre in Italia gli altri partiti pensano ad alzare stipendi ai superdirigenti di Stato, noi continuiamo a batterci per il salario minimo legale a 9 euro l'ora. Basta paghe da fame! #dallapartegiusta https://t.co/wmeHaBnRHi","['salariominimo', 'dallapartegiusta']"
2022-09-14,1569975007958208513,Giuseppe Conte,1176398,Non vi fate ingannare! Scegliete di stare #dallapartegiusta https://t.co/s0hrNWDPc6,['dallapartegiusta']
2022-09-14,1569938744362295297,Giuseppe Conte,1176398,La mia intervista di ieri sera a #cartabianca: https://t.co/MEn2GHM0dH https://t.co/ghTCfKRxRf,['cartabianca']
2022-09-13,1569777186105692161,Giuseppe Conte,1176398,https://t.co/zYwPLPBuIa,[]
2022-09-13,1569688663478439937,Giuseppe Conte,1176398,Ci vediamo domani in Puglia! #dallapartegiusta https://t.co/Q8F6Zd7Mwh,['dallapartegiusta']
2022-09-13,1569654481859518466,Giuseppe Conte,1176398,"Ora Letta chieda scusa e con lui anche tutti gli altri. Grazie al @Mov5Stelle e a quelli che Letta ha chiamato ""piccoli calcoli elettorali"" oggi è stata trovata una soluzione per 40mila imprese edilizie, lavoratori e famiglie che erano stati dimenticati da tutti #dallapartegiusta https://t.co/z41PlwBvxb",['dallapartegiusta']
2022-09-13,1569617747100704768,Giuseppe Conte,1176398,🤦‍♂️ https://t.co/Mi6UJeuyLL,[]
2022-09-13,1569594240677691392,Giuseppe Conte,1176398,Orgogliosi di essere l'unica forza politica che restituisce alla comunità parte delle indennità ricevute dagli eletti. Venerdì si sono concluse le operazioni di voto per individuare la destinazione dei 2 milioni di euro delle restituzioni. Qui l’esito del voto. #dallapartegiusta https://t.co/RBb6Gzlqlk,['dallapartegiusta']
2022-09-13,1569585541707972608,Giuseppe Conte,1176398,Ieri sera sono stato ospite di Nicola Porro a #QuartaRepubblica. Per chi non avesse avuto modo di seguire ecco il video della mia intervista: https://t.co/lRllzQy2f9 https://t.co/1IUkmWJcFZ,['QuartaRepubblica']
2022-09-13,1569576127106015232,Giuseppe Conte,1176398,Ora in diretta su @Radio1Rai https://t.co/gISHvyp1ou,[]
2022-09-12,1569361908507054082,Giuseppe Conte,1176398,"Un momento toccante questo pomeriggio a Villa Wolkonsky, sede della residenza di @EdLlewellynFCDO: il doveroso omaggio mio e dell’intera comunità del @Mov5Stelle al popolo britannico e alla memoria di Sua Maestà Elisabetta II. https://t.co/VVs14MwRxX",[]
2022-09-12,1569304073240977408,Giuseppe Conte,1176398,"In bocca al lupo a studenti, docenti e personale scolastico per questa prima campanella! Oggi vi ripropongo questa intervista con gli amici di ScuolaZoo in cui parliamo di proposte su scuola e formazione. Leggerò con piacere i vostri commenti: https://t.co/A52OdYl47i https://t.co/FH4MCMOMha",[]
2022-09-12,1569196102552797186,Giuseppe Conte,1176398,Gli appuntamenti di oggi 📌 #dallapartegiusta https://t.co/BZ3wq7wAJC,['dallapartegiusta']
2022-09-11,1569073117317992449,Giuseppe Conte,1176398,Dopo 24 anni l’Italia è campione del mondo di #pallavolo! Grazie ragazzi! #ItaliaPolonia #ItalVolley https://t.co/AFfyqFTB1E,"['pallavolo', 'ItaliaPolonia', 'ItalVolley']"
2022-09-11,1568965885397794817,Giuseppe Conte,1176398,"Competenza, cuore e coraggio. Non siamo disposti a mollare un centimetro per i nostri valori, per fare il bene dei cittadini. Qui l’intervista di poco fa a #mezzorainpiù: https://t.co/WbfhrxqUvF #dallapartegiusta https://t.co/WdA26pIL45","['mezzorainpiù', 'dallapartegiusta']"
2022-09-11,1568871172464431104,Giuseppe Conte,1176398,"Oggi doppio appuntamento, vi aspetto! https://t.co/itZigHzsLc",[]
2022-09-10,1568671860811776002,Giuseppe Conte,1176398,Altri miliardi per le spese militari mentre famiglie e imprese non ce la fanno? La risposta è NO! #dallapartegiusta https://t.co/aOMrOQno2T,['dallapartegiusta']
2022-09-10,1568650118336749570,Giuseppe Conte,1176398,"Sta girando una pericolosa menzogna sul @Mov5Stelle. Partiti e giornali continuano a dire che stiamo ""bloccando gli aiuti alle famiglie"". Non è così. Gli aiuti sono già operativi, ma le altre forze politiche vogliono tagliar fuori 40mila aziende in difficoltà. Non lo permetteremo https://t.co/OJQJQ53nyj",[]
2022-09-10,1568635905266839555,Giuseppe Conte,1176398,Gli appuntamenti di domani ⤵️ https://t.co/WPbq2Mlujl,[]
2022-09-10,1568593545744850946,Giuseppe Conte,1176398,"Livorno, quanta passione! #dallapartegiusta https://t.co/WfZ1Abp2Kk",['dallapartegiusta']
2022-09-10,1568527697071988736,Giuseppe Conte,1176398,"Cara Liliana, l'intera comunità del @Mov5Stelle ti abbraccia: tanti auguri di buon compleanno! https://t.co/1Ny2pnQDCb",[]
2022-09-10,1568517246091202564,Giuseppe Conte,1176398,"Direzione Livorno, in una pausa mi sono confrontato con i cittadini sulle priorità del Governo: l'aumento delle spese militari. Non la crisi di famiglie e aziende o i provvedimenti per impedire ai mafiosi di uscire dal carcere. C'è un'Italia che ci chiede altro. #dallapartegiusta https://t.co/HIOn3KQTrt",['dallapartegiusta']
2022-09-09,1568313421904416771,Giuseppe Conte,1176398,"Per noi il programma elettorale non è un malloppo di carta da consegnare qualche giorno prima delle elezioni. È quello per cui ci impegneremo sempre, costi quel che costi, solo e soltanto per il bene cittadini. Con voi al nostro fianco possiamo portare l'Italia #dallapartegiusta https://t.co/6zMmPNqY22 https://t.co/mmpx3X9LKL",['dallapartegiusta']
2022-09-09,1568283688432959490,Giuseppe Conte,1176398,Gli appuntamenti di domani ⤵️ https://t.co/2UlsQvlZ6A,[]
2022-09-09,1568268268716310531,Giuseppe Conte,1176398,"Il programma, le idee per il Paese, i nostri obiettivi. Segui in diretta da Roma: https://t.co/4gwNHpEXaZ #dallapartegiusta https://t.co/3tpIMbXwEw",['dallapartegiusta']
2022-09-09,1568257270009724929,Giuseppe Conte,1176398,"In diretta dall’Auditorium della Conciliazione di Roma, con cuore e coraggio #dallapartegiusta. Segui la diretta: https://t.co/fPQ71Roire https://t.co/4VR93fDSWw",['dallapartegiusta']
2022-09-09,1568157160407764992,Giuseppe Conte,1176398,"“Cambia il vento ma noi no…”

Infuriano le polemiche in campagna elettorale, ma non ci lasciamo distrarre. Oggi si vota per decidere a quali progetti destinare il fondo accumulato con le restituzioni dei parlamentari del M5S. Sempre #dallapartegiusta: https://t.co/pCNz2FgXDJ",['dallapartegiusta']
2022-09-09,1568155775989698560,Giuseppe Conte,1176398,Il Decreto Aiuti “bloccato” dal @Mov5Stelle? Una sonora sciocchezza! Ieri sera ho spiegato come stanno davvero le cose a #Tg2Post: https://t.co/ul3NEDXqze https://t.co/yIzVjZtnNy,['Tg2Post']
2022-09-08,1567987149685010432,Giuseppe Conte,1176398,Questa sera a #DrittoeRovescio: https://t.co/n2dynmf50H,['DrittoeRovescio']
2022-09-08,1567936134688243713,Giuseppe Conte,1176398,"My deepest condolences to the Royal Family and to all the British people for the sad loss of Her Majesty Queen Elizabeth II.
A life entirely devoted to United Kingdom’s citizens, an example of perseverance and dedication.
May Her soul rest in peace https://t.co/rgpoeCpmnu",[]
2022-09-08,1567914024917995521,Giuseppe Conte,1176398,"La mia intervista a “L’aria che tira”:
https://t.co/6NaKxDNaCV https://t.co/lRpZEFFnof",[]
2022-09-08,1567912599374766080,Giuseppe Conte,1176398,https://t.co/QFQx1oHPJf,[]
2022-09-08,1567841021106462722,Giuseppe Conte,1176398,https://t.co/he5Hi1JBhZ,[]
2022-09-08,1567810327408001026,Giuseppe Conte,1176398,"Quando la transizione ecologica prende per mano crescita e sviluppo economico. Quando la sostenibilità ambientale è davvero una priorità, non uno slogan da campagna elettorale. Quando parlano i fatti, quando si è #dallapartegiusta https://t.co/cje0Buxa96",['dallapartegiusta']
2022-09-08,1567758537455017985,Giuseppe Conte,1176398,https://t.co/237vUhVAAM,[]
2022-09-07,1567552088074231808,Giuseppe Conte,1176398,Grazie Torino per questa accoglienza! Io penso che possiamo ancora cambiare il Paese. E tu? Stai #dallapartegiusta https://t.co/LRnhEnlFRj,['dallapartegiusta']
2022-09-07,1567540660525211649,Giuseppe Conte,1176398,"Giorgia, per caso vuoi la guerra civile? https://t.co/mtlsUXmVEr",[]
2022-09-07,1567509829513580546,Giuseppe Conte,1176398,"Ho promesso a Mario che faremo tutto il necessario per lui e per i cittadini che ogni giorno si spezzano la schiena per sbarcare il lunario. Servono stipendi degni e un #salariominimo per tutti. Nessuno rimarrà indietro.
#dallapartegiusta","['salariominimo', 'dallapartegiusta']"
2022-09-07,1567509826938314763,Giuseppe Conte,1176398,"Direzione Torino, breve sosta sul cammino per un panino e un caffè. Prima di andare via, ho scambiato due parole con Mario, lavoratore di una multiservizi. Mi ha parlato delle preoccupazioni del momento, del carovita e della difficoltà di andare avanti in questi tempi di crisi https://t.co/vImm2PwrvI",[]
2022-09-07,1567457025944059904,Giuseppe Conte,1176398,"Ai ragazzi di #ScuolaZoo ho lasciato un messaggio per Salvini, che sarà presto loro ospite. Sarò a #Baggio, periferia di #Milano, dove la Lega vuole una centrale nucleare. Parleremo dei pericoli, delle scorie, dei costi e dei tempi, dei referendum dimenticati. #dallapartegiusta https://t.co/FBeA7vhhg8","['ScuolaZoo', 'Baggio', 'Milano', 'dallapartegiusta']"
2022-09-07,1567401933161353218,Giuseppe Conte,1176398,Bisogna dire le cose come stanno. È il momento di stare #dallapartegiusta: https://t.co/HUmA8AfmNX #dimartedì https://t.co/1TLnx2qNY5,"['dallapartegiusta', 'dimartedì']"
2022-09-06,1567238914984796162,Giuseppe Conte,1176398,A Milano c'è voglia di stare #dallapartegiusta https://t.co/9aireRbj9n,['dallapartegiusta']
2022-09-06,1567236066486239234,Giuseppe Conte,1176398,Le soluzioni per arginare il carobollette e le ricette del Movimento 5 Stelle in favore del tessuto produttivo del Paese. Ne ho parlato questa sera al Tg5 ⤵️ https://t.co/1SutslVaKo,[]
2022-09-06,1567176917693906945,Giuseppe Conte,1176398,"Succedono cose strane in questa campagna elettorale. Ora si tira in mezzo pure Trump. Il 25 settembre si avvicina, il @Mov5stelle spaventa e si gioca sporco. Ho qualcosa da dirvi ⤵️ https://t.co/Br6Me3htnL",[]
2022-09-06,1567134617978691585,Giuseppe Conte,1176398,"Dalla parte di famiglie, insegnanti e studenti. Sempre #dallapartegiusta https://t.co/aWEk8UAaHO",['dallapartegiusta']
2022-09-06,1567066272357122048,Giuseppe Conte,1176398,La mia intervista di ieri sera a #PortaAPorta: https://t.co/wdfxcmfbqM https://t.co/FOFmgkZ7Zl,['PortaAPorta']
2022-09-06,1567043147414343681,Giuseppe Conte,1176398,Alcuni degli appuntamenti di oggi. Vi aspetto! #DallaParteGiusta https://t.co/Kd5eKtLWpZ,['DallaParteGiusta']
